Index|KEYWORDS|Romaji construction|Kana construction|Meaning|Alternate Spellings|
5140|jatta, じゃった, did/was X and regret doing it, jatta, te shimaimashita, de shimatta, de shimaimashita|jatta|じゃった|286||
5141|(o)  ni naru, になる, to do/be X (honorific), ni naru|(o)  ni naru|になる|287||
5142|(o)  nasaru, なさる, to do/be X (honorific), nasaru|(o)  nasaru|なさる|288||
5143|(o)  suru, する, to do/be X (humble), suru|(o)  suru|する|289||
5144|(o)  itasu, いたす, to do/be X (humble), itasu|(o)  itasu|いたす|290||
5145|(o)  kudasai, 下さい, to please do/be X, kudasai|(o)  kudasai|下さい|291||
5146|(o)  naide kudasai, ないで下さい, to please don't do/be X, naide kudasai|(o)  naide kudasai|ないで下さい|292||
5147|(o)  nasaimase, なさいませ, to please do/be X (honorific), nasaimase|(o)  nasaimase|なさいませ|293||
5148|(o)  nasaimasu na, なさいますな, to please don't do/be X (honorific), nasaimasu na|(o)  nasaimasu na|なさいますな|294||
5149|nasai, なさい, you are ordered to do/be X (polite), nasai|nasai|なさい|295||
5150|nasaru na, なさるな, you are ordered not to do/be X (polite), nasaru na|nasaru na|なさるな|296||
5151|ta mama, た儘, as it is, as one likes, because, as, as long as, た侭, ta mama|ta mama|た儘|297|た侭|
5152|naosu, 直す, to do/be X over again, naosu|naosu|直す|298||
5153|tai, たい, want to do/be X, tai|tai|たい|299||
5154|takatta, たかった, wanted to do/be X, takatta|takatta|たかった|300||
5155|takunai, たくない, don't want to do/be X, takunai|takunai|たくない|301||
5156|takunakatta, たくなかった, didn't want to do/be X, takunakatta|takunakatta|たくなかった|302||
5157|tai desu, たいです, want to do/be X (polite), tai desu|tai desu|たいです|303||
5158|tai deshita, たいでした, wanted to do/be X (polite), tai deshita|tai deshita|たいでした|304||
5159|taku arimasen, たくありません, don't want to do/be X (polite), taku arimasen|taku arimasen|たくありません|305||
5160|taku arimasen deshita, たくありませんでした, didn't want to do/be X (polite), taku arimasen deshita|taku arimasen deshita|たくありませんでした|306||
5161|tagaru, たがる, (I understand that) he/she wants to do/be X, tagaru|tagaru|たがる|307||
5162|yasui, やすい, easy to do/be X, yasui, easy to be|yasui|やすい|308||
5163|nikui, にくい, difficult to do/be X, nikui, difficult to be, difficult to do, hard to be|nikui|にくい|309||
5164|yagaru, やがる, to do/be X (speaker is contemptuous), yagaru, difficult to be, difficult to do, hard to be|yagaru|やがる|310||
5165|yagare, やがる, to do/be with hatred or contempt, yagare, yagare|yagare|やがる|311||
5166|nu, ぬ, to not do/be X, nu|nu|ぬ|312||
5167|zu, ず, to (verb) without doing/being X, zu|zu|ず|313||
5168|agaru, 上がる, is done doing/being X, agaru|agaru|上がる|314||
5169|hodo, 程, to the point of, hodo|hodo|程|315||
5170|ina ka, 否か, or not, ina ka|ina ka|否か|316||
5171|koto ni suru, ことにする, to have decided to do/be X (in the future), koto ni suru, nai koto ni suru, nai koto ni shimasu, koto ni kimeru|koto ni suru|ことにする|317||
5172|koto ni shita, ことにした, we decided to do/be X, koto ni shita|koto ni shita|ことにした|318||
5173|maji, まじ, cannot, should not, will not, must not, must not do/be X, maji|maji|まじ|319||
5174|koto ni shiteiru, ことにしている, (I) have decided to be doing/being X, koto ni shiteiru|koto ni shiteiru|ことにしている|320||
5175|koto ni naru, ことになる, It has been decided that (he) does/be X, koto ni naru, nai koto ni naru, nai koto ni narimasu|koto ni naru|ことになる|321||
5176|ga hayai ka, が早いか, as soon as (he) does/is X, ga hayai ka|ga hayai ka|が早いか|322||
5177|tara dou desu ka, たらどうですか, Why don't (you) do/be X? How about doing/being X?, tara dou desu ka, dara dou desu, tara dou da, dara dou da|tara dou desu ka|たらどうですか|323||
5178|tara ii desu ka, たらいいですか, What do (you) think/suggest if (he) does/is X?, tara ii desu ka, dara ii desu ka|tara ii desu ka|たらいいですか|324||
5179|deshou ka, でしょうか, Shouldn't (you) do/be X?, deshou ka|deshou ka|でしょうか|325||
5180|masen ka, ませんか, Why don't (you) do/be X?, masen ka, nai ka|masen ka|ませんか|326||
5181|nai ka, ないか, Why don't (you) do/be X?, masen ka, nai ka|nai ka|ないか|326||
5182|mashou ka, ませんか, May (he) do/be X?, mashou ka|mashou ka|ませんか|327||
5183|dake, だけ, only do X, dake, dake da, dake desu|dake|だけ|328||
5184|ta bakari, たばかり, have (just) recently done X, ta bakari, bakkari, bakashi, bakkashi, just done, recently done, just recently done, just did|ta bakari|たばかり|329||
5185|bakari, ばかり, ready to do/be X, bakari, bakkari, bakashi, bakkashi|bakari|ばかり|330||
5186|ta tokoro da, たところだ, to have done/been X just now, ta tokoro da, ta tokoro desu|ta tokoro da|たところだ|331||
5187|tokoro da, ところだ, just about to do/be X, tokoro da|tokoro da|ところだ|332||
5188|teiru tokoro da, ているところだ, to be just in the middle of X-ing, teiru tokoro da, teiru tokoro desu|teiru tokoro da|ているところだ|333||
5189|koto ga aru, ことがある, occasionally do/be X, koto ga aru, nai koto ga aru, nai koto ga arimasu, koto ga nai, koto ga nakatta|koto ga aru|ことがある|334||
5190|koto ga dearu, ことがである, allowed to do/be X, koto ga dearu, nai koto ga dearu, nai koto ga dearimasu|koto ga dearu|ことがである|335||
5191|ta koto ga aru, たことがある, to have experienced X-ing, ta koto ga aru, have done before|ta koto ga aru|たことがある|336||
5192|ta koto ni naru, たことになる, to have happened to do/be X, ta koto ni naru|ta koto ni naru|たことになる|337||
5193|ta to shite mo, たとしても, even if there was|ta to shite mo|たとしても|7067||
5194|koto ni natteiru, ことになっている, to be scheduled/due to do X, koto ni natteiru, nai koto ni natteiru, nai koto ni natteimasu, scheduled to do, due to do|koto ni natteiru|ことになっている|338||
5195|ou to shiteiru, おうとしている, about to do/be X, ou to suru, ou to shiteiru, ou to shimasu, ou to shiteimasu, intend to do/be|ou to shiteiru|おうとしている|339||
5196|ou to suru, おうとする, about to do/be X, ou to suru, ou to shiteiru, ou to shimasu, ou to shiteimasu, intend to do/be|ou to suru|おうとする|339||
5197|ou to shita, おうとした, was just about to do X, tried to do X, ou to shita, ou to shimashita|ou to shita|おうとした|340||
5198|ou to omou, おうと思う, plan to do/be X, intend to do/be X, ou to omou, ou to omotteiru, ou to omoimasu, plan to be, considering to do, considering to be, ou to moimasu, ou to mou|ou to omou|おうと思う|341||
5199|ou to omotteiru, おうと思っている, planning to do/be X, ou to omou, ou to omotteiru, ou to omotteimasu, plan to be, considering to do, considering to be, ou to motteimasu, ou to motteiru|ou to omotteiru|おうと思っている|342||
5200|tomonaku, ともなく, not intending to do/be X, tomonaku, absentmindedly, without planning to, without intending to|tomonaku|ともなく|343||
5201|tsumori, 積もり, intend to do/be X, 積り, tsumori|tsumori|積もり|344|積り|
5202|ba ii noni, ばいいのに, (He) should do/be X, ba ii noni|ba ii noni|ばいいのに|345||
5203|ba yokatta noni, ばよかったのに, (He) should do/be X, ba yokatta noni|ba yokatta noni|ばよかったのに|346||
5204|ba yokatta, ばよかった, (He) should have done/been X, ba yokatta|ba yokatta|ばよかった|347||
5205|i, い, present tense, keiyoushi, i keiyoushi, i-adjective|i|い|348||
5206|i desu, いです, present tense (polite), keiyoushi, i keiyoushi, i-adjective|i desu|いです|349||
5207|kunai desu, くないです, present tense negative, keiyoushi, i keiyoushi, i-adjective|kunai desu|くないです|350||
5208|ku arimasen, くありません, present negative tense (polite), keiyoushi, i keiyoushi, i-adjective|ku arimasen|くありません|351||
5209|katta desu, かったです, past tense, keiyoushi, i keiyoushi, i-adjective|katta desu|かったです|352||
5210|kunakatta desu, くなかったです, past negative tense, keiyoushi, i keiyoushi, i-adjective|kunakatta desu|くなかったです|353||
5211|ku arimasen deshita, くありませんでした, past negative tense (polite), keiyoushi, i keiyoushi, i-adjective|ku arimasen deshita|くありませんでした|354||
5212|ku, く, adverb form, keiyoushi, i keiyoushi, i-adjective|ku|く|355||
5213|kute, くて, X and Y, is so X that, keiyoushi, i keiyoushi, i-adjective|kute|くて|356;357||
5214|kutemo, くて, even if, keiyoushi, i keiyoushi, i-adjective|kutemo|くて|6206||
5215|ku naru, くなる, to turn into X, keiyoushi, i keiyoushi, i-adjective|ku naru|くなる|358||
5216|ku suru, くする, to make X, keiyoushi, i keiyoushi, i-adjective|ku suru|くする|359||
5217|mi, み, noun form, keiyoushi, i keiyoushi, i-adjective|mi|み|360||
5218|kereba, ければ, if X, kereba desu, conditional, keiyoushi, i keiyoushi, i-adjective|kereba|ければ|361||
5219|karou, かろう, should be X, must be X, ought to be X, volitional, suggestive, keiyoushi, i keiyoushi, i-adjective|karou|かろう|362||
5220|sa, さ, level, degree of something, keiyoushi, i keiyoushi, i-adjective|sa|さ|6197||
5221|[root], , present tense, keiyoudoushi, na keiyoushi, na-adjective|[root]||363||
5222|desu, です, present tense (polite), keiyoudoushi, na keiyoushi, na-adjective|desu|です|364||
5223|de wa arimasen, ではありません, present negative tense (most polite), keiyoudoushi, na keiyoushi, na-adjective|de wa arimasen|ではありません|365||
5224|ja nai desu, じゃないです, present negative tense (polite), keiyoudoushi, na keiyoushi, na-adjective|ja nai desu|じゃないです|366||
5225|dewa nai, ではない, present negative tense (neutral), keiyoudoushi, na keiyoushi, na-adjective|dewa nai|ではない|367||
5226|ja nai, じゃない, present negative tense (impolite), keiyoudoushi, na keiyoushi, na-adjective|ja nai|じゃない|368||
5227|deshita, でした, past tense, keiyoudoushi, na keiyoushi, na-adjective|deshita|でした|369||
5228|ja arimasen deshita, じゃありませんでした, past negative tense, keiyoudoushi, na keiyoushi, na-adjective|ja arimasen deshita|じゃありませんでした|370||
5229|de wa arimasen deshita, じゃありませんでした, past negative tense (polite), keiyoudoushi, na keiyoushi, na-adjective|de wa arimasen deshita|じゃありませんでした|371||
5230|de (next adj.), で, X and Y, keiyoudoushi, na keiyoushi, na-adjective|de (next adj.)|で|372||
5231|demo, くて, even if, keiyoudoushi, na keiyoushi, na-adjective|demo|くて|6207||
5232|ni naru, になる, to turn into X , keiyoudoushi, na keiyoushi, na-adjective|ni naru|になる|373||
5233|ni suru, にする, to make X, keiyoudoushi, na keiyoushi, na-adjective|ni suru|にする|374||
5234|deareba, であれば, if X, deareba desu, conditional, keiyoudoushi, na keiyoushi, na-adjective|deareba|であれば|375||
5235|yotei da, 予定だ, I plan to X, to yotei da, to yotei desu|yotei da|予定だ|6149||
5236|ni kyoumi ga aru, に興味がある, I am interested in|ni kyoumi ga aru|に興味がある|6612||
