KEYWORDS|Romaji construction|Kana construction|Meaning|Alternate Spellings|
koto ni natteiru, ことになっている, skill, arm (esp. upper arm), nai koto ni natteiru, nai koto ni natteimasu, scheduled to do, due to do|koto ni natteiru|ことになっている|338||
ou to suru, ou to shiteiru, おうとする, おうとしている, skill, arm (esp. upper arm), ou to shimasu, ou to shiteimasu, intend to do/be|ou to suru, ou to shiteiru|おうとする, おうとしている|339||
ou to shita, おうとした, skill, arm (esp. upper arm), ou to shimashita|ou to shita|おうとした|340||
ou to omou, ou to omotteiru, おうと思う, skill, arm (esp. upper arm), ou to omoimasu, plan to be, considering to do, considering to be|ou to omou, ou to omotteiru|おうと思う|341||
ou to omou, ou to omotteiru, おうと思っている, skill, arm (esp. upper arm),  ou to omotteimasu, plan to be, considering to do, considering to be|ou to omou, ou to omotteiru|おうと思っている|342||
tomonaku, ともなく, skill, arm (esp. upper arm), absentmindedly, without planning to, without intending to|tomonaku|ともなく|343||
tsumori, 積もり, skill, arm (esp. upper arm), 積り|tsumori|積もり|344|積り|
ba ii noni, ばいいのに, skill, arm (esp. upper arm)|ba ii noni|ばいいのに|345||
ba yokatta noni, ばよかったのに, skill, arm (esp. upper arm)|ba yokatta noni|ばよかったのに|346||
ba yokatta, ばよかった, skill, arm (esp. upper arm)|ba yokatta|ばよかった|347||
i, い, skill, arm (esp. upper arm), keiyoushi, i keiyoushi, i-adjective|i|い|348||
i desu, いです, skill, arm (esp. upper arm), keiyoushi, i keiyoushi, i-adjective|i desu|いです|349||
kunai desu, くないです, skill, arm (esp. upper arm), keiyoushi, i keiyoushi, i-adjective|kunai desu|くないです|350||
ku arimasen, くありません, skill, arm (esp. upper arm), keiyoushi, i keiyoushi, i-adjective|ku arimasen|くありません|351||
katta desu, かったです, skill, arm (esp. upper arm), keiyoushi, i keiyoushi, i-adjective|katta desu|かったです|352||
kunakatta desu, くなかったです, skill, arm (esp. upper arm), keiyoushi, i keiyoushi, i-adjective|kunakatta desu|くなかったです|353||
ku arimasen deshita, くありませんでした, skill, arm (esp. upper arm), keiyoushi, i keiyoushi, i-adjective|ku arimasen deshita|くありませんでした|354||
ku, く, skill, arm (esp. upper arm), keiyoushi, i keiyoushi, i-adjective|ku|く|355||
kute, くて, skill, arm (esp. upper arm), keiyoushi, i keiyoushi, i-adjective|kute|くて|356;357||
ku naru, くなる, skill, arm (esp. upper arm), keiyoushi, i keiyoushi, i-adjective|ku naru|くなる|358||
ku suru, くする, skill, arm (esp. upper arm), keiyoushi, i keiyoushi, i-adjective|ku suru|くする|359||
mi, み, skill, arm (esp. upper arm), keiyoushi, i keiyoushi, i-adjective|mi|み|360||
kereba, ければ, skill, arm (esp. upper arm), kereba desu, conditional, keiyoushi, i keiyoushi, i-adjective|kereba|ければ|361||
karou, かろう, skill, arm (esp. upper arm), volitional, suggestive, keiyoushi, i keiyoushi, i-adjective|karou|かろう|362||
[root], , skill, arm (esp. upper arm), keiyoudoushi, na keiyoushi, na-adjective|[root]||363||
desu, です, skill, arm (esp. upper arm), keiyoudoushi, na keiyoushi, na-adjective|desu|です|364||
de wa arimasen, ではありません, skill, arm (esp. upper arm), keiyoudoushi, na keiyoushi, na-adjective|de wa arimasen|ではありません|365||
ja nai desu, じゃないです, skill, arm (esp. upper arm), keiyoudoushi, na keiyoushi, na-adjective|ja nai desu|じゃないです|366||
dewa nai, ではない, skill, arm (esp. upper arm), keiyoudoushi, na keiyoushi, na-adjective|dewa nai|ではない|367||
ja nai, じゃない, skill, arm (esp. upper arm), keiyoudoushi, na keiyoushi, na-adjective|ja nai|じゃない|368||
deshita, でした, skill, arm (esp. upper arm), keiyoudoushi, na keiyoushi, na-adjective|deshita|でした|369||
ja arimasen deshita, じゃありませんでした, skill, arm (esp. upper arm), keiyoudoushi, na keiyoushi, na-adjective|ja arimasen deshita|じゃありませんでした|370||
de wa arimasen deshita, じゃありませんでした, skill, arm (esp. upper arm), keiyoudoushi, na keiyoushi, na-adjective|de wa arimasen deshita|じゃありませんでした|371||
de (next adj.), で, skill, arm (esp. upper arm), keiyoudoushi, na keiyoushi, na-adjective|de (next adj.)|で|372||
ni naru, になる, skill, arm (esp. upper arm), keiyoudoushi, na keiyoushi, na-adjective|ni naru|になる|373||
ni suru, にする, skill, arm (esp. upper arm), keiyoudoushi, na keiyoushi, na-adjective|ni suru|にする|374||
deareba, であれば, skill, arm (esp. upper arm), deareba desu, conditional, keiyoudoushi, na keiyoushi, na-adjective|deareba|であれば|375||
yotei da, 予定だ, skill, arm (esp. upper arm), to yotei desu|yotei da|予定だ|6149||
