Index|KEYWORDS|Roumaji construction|Kana construction|Meaning|Alternate Spellings|Extra keywords|Preposition|Kanji Root|Latin Root|Exception index|
18790|tsumoritsumoru, 積もり積もる, pile up and up, pile up more and more, mount (e.g. debts, concerns)|tsumoritsumoru|積もり積もる|35820||||積もり積も|tsumoritsumo|57|
18791|okashigaru, 可笑しがる, be amused (by, at), wonder at|okashigaru|可笑しがる|35727||||可笑しが|okashiga|57|
18792|kittonaru, 屹度なる, look stern|kittonaru|屹度なる|35659||||屹度な|kittona|57|
18793|kasanikakaru, 嵩にかかる, be highhanded, be arrogant, be overbearing, 笠にかかる, 嵩に懸かる, 笠に懸かる|kasanikakaru|嵩にかかる|35640|笠にかかる, 嵩に懸かる, 笠に懸かる|||嵩にかか|kasanikaka|57|
18794|hyoubanninaru, 評判になる, be talked about, get a name for oneself, get publicity|hyoubanninaru|評判になる|35605||||評判にな|hyoubannina|57|
18795|gironninaru, 議論になる, get into an argument, come to discuss, be controversial (usu. as an adjectival phrase), be contentious|gironninaru|議論になる|35573;35574||||議論にな|gironnina|57|
18796|kudasaru, 下さる, give (polite, speaker is the recipient or his relative), please, を|kudasaru|下さる|4961|||を|下さ|kudasa|69|
18797|irassharu, いらっしゃる, exist, come, go|irassharu|いらっしゃる|4962||||いらっしゃ|irassha|70|
18798|ossharu, 仰る, say, を|ossharu|仰る|4963|||を|仰|ossha|71|
18799|gozaru, 御座る, be (archaic)|gozaru|御座る|4964||||御座|goza|72|
18800|nasaru, 為さる, do, request, を/に|nasaru|為さる|4965|||を/に|為さ|nasa|73|
18801|rassharu, らっしゃる, be, come, go|rassharu|らっしゃる|4754||||らっしゃ|rassha|74|
18802|oidenasa, お出でなさる, come, go, be (somewhere)|oidenasa|お出でなさる|4757||||お出でなさ|oidenasa|75|
18803|gorannasaru, 御覧なさる, see, look, watch|gorannasaru|御覧なさる|4763||||御覧なさ|gorannasa|76|
18804|tatsu, 立つ, stand, rise, stand up, find oneself (e.g. in a difficult position), depart (on a plane, train, etc.), stand, rise, stand up, 発つ|tatsu|立つ|10108;10109;10110;19743|発つ|||立|ta|78|
18805|matsu, 待つ, expect, await, look forward to, anticipate, await, look forward to, anticipate, depend on, need, 俟つ, を/まで|matsu|待つ|5275;19322;19323;19324|俟つ||を/まで|待|ma|78|
18806|katsu, 勝つ, win, gain victory, 克つ, 贏つ|katsu|勝つ|5276|克つ, 贏つ|||勝|ka|78|
18807|motsu, 持つ, hold (in one's hand), take, carry, possess, have, own, maintain, keep, last, be durable, keep, survive, take charge of, be in charge of, を|motsu|持つ|14960;14961;14962;14963;14964|||を|持|mo|78|
18808|tatsu, 経つ, pass (of time), elapse|tatsu|経つ|19744||||経|ta|78|
18809|utsu, 打つ, strike (someone, noon, etc.), beat (a drum, rhythmically, etc.), hit, strike, knock, beat, punch, slap, tap, bang, clap, pound, strike (noon, etc.), sound (cymbals, etc.), beat (a drum, etc.), beat (rhythmically, e.g. pulse, waves, etc.), move, impress, touch, drive in, hammer in, put in, inject, type, send, transmit, insert, write in, mark, make (noodles, etc.), prepare, till (soil), sprinkle, throw, cast, do, carry out, play, perform, engage in (gambling, etc.), pay (a deposit, etc.), visit (on a pilgrimage), line (a coat), bind (a criminal), を|utsu|打つ|5279;17966;17967;17968;17969;17970;17971;17972;17973;17974;17975;17976;17977;17978;17979;17980|||を|打|u|78|
18810|medatsu, 目立つ, attract attention, be conspicuous, stand out, 目だつ|medatsu|目立つ|5280|目だつ|||目立|meda|78|
18811|sodatsu, 育つ, be raised (e.g. child), be brought up, grow (up)|sodatsu|育つ|5281||||育|soda|78|
18812|tatsu, 裁つ, cut (cloth), 截つ, を|tatsu|裁つ|5282|截つ||を|裁|ta|78|
18813|tatsu, 断つ, sever, cut off, suppress, eradicate, exterminate, abstain (from), give up, 絶つ, 斷つ, を|tatsu|断つ|5283;35458;35459|絶つ, 斷つ||を|断|ta|78|
18814|tatsu, 建つ, be erected, be built|tatsu|建つ|5284||||建|ta|78|
18815|tatsu, 起つ, rise up, initiate (political) action|tatsu|起つ|5287||||起|ta|78|
18816|tatsu, 勃つ, have an erection|tatsu|勃つ|5288||||勃|ta|78|
18817|mitsu, 満つ, be full, wax (e.g. moon), rise (e.g. tide), mature, expire|mitsu|満つ|5289||||満|mi|78|
18818|utsu, 撃つ, shoot (at), attack, defeat, destroy, avenge, 討つ, 射つ, を|utsu|撃つ|5290;8024|討つ, 射つ||を|撃|u|78|
18819|naritatsu, 成り立つ, consist of, be made up of, be composed of, be practical (logical, feasible, viable), be concluded (e.g. of an agreement), hold true (e.g. of a theory), be valid, be viable (of a business, lifestyle, etc.), carry on, keep going, 成立つ|naritatsu|成り立つ|5292;17444;17445|成立つ|||成り立|narita|78|
18820|uchikatsu, 打ち勝つ, conquer (e.g. an enemy), defeat, overcome (a difficulty), 打勝つ, を|uchikatsu|打ち勝つ|5293|打勝つ||を|打ち勝|uchika|78|
18821|tamotsu, 保つ, keep, preserve, hold, retain, maintain, support, sustain, last, endure, keep well (food), wear well, be durable, を|tamotsu|保つ|5294|||を|保|tamo|78|
18822|yakudatsu, 役立つ, be useful, be helpful, serve the purpose, 役だつ|yakudatsu|役立つ|8635|役だつ|||役立|yakuda|78|
18823|tabidatsu, 旅立つ, begin a trip, embark, die, pass away, depart this life, begin a trip, depart, embark, 旅だつ|tabidatsu|旅立つ|9280;9281;22325|旅だつ|||旅立|tabida|78|
18824|kiwadatsu, 際立つ, be prominent, be conspicuous, 際だつ|kiwadatsu|際立つ|14813|際だつ|||際立|kiwada|78|
18825|butsu, 打つ, hit (a person), strike, beat, deliver (a speech), give (an address), 撃つ, 撲つ, を|butsu|打つ|16764;16765|撃つ, 撲つ||を|打|bu|78|
18826|ukemotsu, 受け持つ, take (be in) charge of, を|ukemotsu|受け持つ|23457|||を|受け持|ukemo|78|
18827|hanatsu, 放つ, fire (gun, shoot, hit (e.g. baseball), break wind, set free, release, let loose, emit (e.g. light), give off (e.g. a scent), send out (a person to carry out a duty), set fire to, を|hanatsu|放つ|26026;26027;26028;26029;26030|||を|放|hana|78|
18828|uketetatsu, 受けて立つ, accept somebody's challenge, take up the gauntlet|uketetatsu|受けて立つ|28798||||受けて立|uketeta|78|
18829|muretatsu, 群れ立つ, stand all around (e.g. bamboo, pines, pampas grass), むれ立つ|muretatsu|群れ立つ|28749|むれ立つ|||群れ立|mureta|78|
18830|omotedatsu, 表立つ, become public, be known|omotedatsu|表立つ|30805||||表立|omoteda|78|
18831|wakatsu, 分かつ, divide, separate, share, distribute, distinguish, 分つ, 別つ, を|wakatsu|分かつ|34073;34074;34075|分つ, 別つ||を|分か|waka|78|
18832|morau, 貰う, receive, take, accept, get somebody to do something, を|morau|貰う|5300;10509|||を|貰|mora|81|
18833|iu, 言う, express, say, utter, declare, name, call, go (e.g. "the alarm went ping"), make a noise, 云う, 謂う, yuu, を|iu|言う|5301;9575;9576;9577|云う, 謂う, yuu||を|言|i|82|
18834|ukagau, 伺う, ask, inquire, hear, be told, implore, seek direction, visit, speak (a large crowd)|ukagau|伺う|5349;5350||||伺|ukaga|80|
18835|kau, 買う, buy, purchase, value, have a high opinion, stir, provoke, draw upon oneself, を|kau|買う|5295;21915;21916|||を|買|ka|80|
18836|omou, 思う, plan (do), think (of doing), plan (to do), judge, assess, regard, imagine, suppose, dream, expect, look forward to, feel, be (in a state of mind), desire, want, recall, remember, think, consider, believe, reckon, 惟う, 念う, 憶う, 懐う, 想う, を|omou|思う|5296;13880;13881;13882;13883;13884;13885;20582|惟う, 念う, 憶う, 懐う, 想う||を|思|omo|80|
18837|harau, 払う, pay attention, pay (e.g. money, bill), brush off, wipe away, clear away, dust off, cut off (e.g. branches), drive away (e.g. one's competitors), sell off (something unneeded), dispose of, pay (e.g. attention), show (e.g. respect, concern), make (e.g. effort, sacrifice), expend, exert, move out (of one's own place), vacate, sweep (e.g. one's legs), knock aside, make a sweeping stroke (in Japanese calligraphy), reset (an abacus)|harau|払う|5297;7658;7659;7660;7661;7662;7663;7664;7665;7666;7667||||払|hara|80|
18838|au, 会う, meet, encounter, see, have an accident, have a bad experience, 逢う, 遇う, 遭う, に|au|会う|9338;9339|逢う, 遇う, 遭う||に|会|a|80|
18839|au, 合う, do ... each other, come together, merge, unite, meet, fit, match, suit, agree with, be correct, be profitable, be equitable, do ... to each other, do ... together, ou, を|au|合う|5299;18607;18608;18609;18610|ou||を|合|a|80|
18840|chigau, 違う, be wrong, differ (from), vary, not be in the usual condition, not match the correct (answer, etc.), be different from promised|chigau|違う|5302;10632;10633;10634;10635||||違|chiga|80|
18841|tsukau, 使う, use (a thing, method, person, time, money, language), put use, operate, use (a thing, method, etc.), make use of, put to use, use (a person, animal, puppet, etc.), employ, handle, manage, manipulate, use (time, money, etc.), spend, consume, use (language), speak, 遣う, を|tsukau|使う|5303;12052;12053;12054;12055|遣う||を|使|tsuka|80|
18842|suu, 吸う, suck in, smoke, inhale, sip, を|suu|吸う|5304|||を|吸|su|80|
18843|narau, 習う, take lessons in, be taught, learn (from a teacher), study (under a teacher), get training in, を|narau|習う|5305|||を|習|nara|80|
18844|sasou, 誘う, invite, ask, call (for), tempt, lure, induce, を|sasou|誘う|5306|||を|誘|saso|80|
18845|shimau, 仕舞う, bring a close, close (a business, etc.), close down, shut down, shut up, finish, stop, end, put an end to, bring to a close, put away, put back, keep, store, finish ..., do ... completely, 了う, 蔵う, 終う, を|shimau|仕舞う|5307;7917;7918;7919|了う, 蔵う, 終う||を|仕舞|shima|80|
18846|mimau, 見舞う, ask after (health), ask after (someone's health), visit, attack, strike, meet with misfortune, suffer an attack, を|mimau|見舞う|5308;20533;20534|||を|見舞|mima|80|
18847|mayou, 迷う, get lost, lose one's way, waver, hesitate, be perplexed, be puzzled, give in temptation, lose control of oneself, turn in one's grave|mayou|迷う|5309||||迷|mayo|80|
18848|hirou, 拾う, pick up, find, gather, get (a taxi)|hirou|拾う|5310||||拾|hiro|80|
18849|yuu, 結う, do up (hair), braid, fasten, fix, を|yuu|結う|5311|||を|結|yu|80|
18850|iwau, 祝う, congratulate, celebrate, observe (a festival), を|iwau|祝う|5312|||を|祝|iwa|80|
18851|kabau, 庇う, protect someone, take under one's wing, plead for, stick up for, cover up for someone, を|kabau|庇う|5313|||を|庇|kaba|80|
18852|kamau, 構う, care (for, about), prepare for, interfere with, meddle in, mind, care about, be concerned about, have a regard for, be an issue, matter, create inconvenience, keep company, care for, look after, entertain, pay attention to, spend time with, tease, banish, prohibit, を|kamau|構う|5314;11568;11569;11570;11571;11572|||を|構|kama|80|
18853|kanau, 叶う, come true (wish), be suited to, bear (e.g. I can't bear the heat), come true (of a wish, prayer, etc.), be realized, be fulfilled, suit (e.g. a purpose), meet (wishes, ideals, etc.), conform to (standards, rules, etc.), be consistent with, match (implies competition), rival, bear (e.g. the heat), 敵う, 適う|kanau|叶う|5315;17180;17181;17182|敵う, 適う|||叶|kana|80|
18854|karakau, 揶揄う, ridicule, tease, mock, chaff, razz, banter with, make fun of, poke fun at, make cracks about, を|karakau|揶揄う|5316|||を|揶揄|karaka|80|
18855|kidukau, 気遣う, worry about, feel anxious about, have apprehensions of, kizukau|kidukau|気遣う|5317|kizukau|||気遣|kiduka|80|
18856|kuichigau, 食い違う, cross each other, run counter to, differ, clash, go awry, disagree|kuichigau|食い違う|5318||||食い違|kuichiga|80|
18857|machigau, 間違う, make a mistake, be incorrect, be mistaken, を|machigau|間違う|5319|||を|間違|machiga|80|
18858|mukau, 向かう, turn toward, face, go towards, head towards, 対う, 向う,  対う|mukau|向かう|5320;9786;9787|対う, 向う,  対う|||向か|muka|80|
18859|tatakau, 戦う, combat, struggle against, engage in contest, make war (on), wage war (against), go to war (with), fight (with), do battle (against), compete (against), struggle (against adversities, etc.), fight, contend, resist, 闘う|tatakau|戦う|5321;11216;11217;11218|闘う|||戦|tataka|80|
18860|tetsudau, 手伝う, take part in, help, assist, aid, contribute to, be a factor in, 手つだう, を|tetsudau|手伝う|5322;16520;16521|手つだう||を|手伝|tetsuda|80|
18861|utau, 歌う, sing (one's praises in a poem, etc.), compose a poem, recite a poem, 詠う, 唱う, 謡う, 唄う, を|utau|歌う|20868|詠う, 唱う, 謡う, 唄う||を|歌|uta|80|
18862|ushinau, 失う, lose, part with, 喪う, を|ushinau|失う|5324|喪う||を|失|ushina|80|
18863|utagau, 疑う, doubt, distrust, be suspicious of, suspect, を|utagau|疑う|5325|||を|疑|utaga|80|
18864|utau, 謳う, express, state, insist, stipulate|utau|謳う|5326||||謳|uta|80|
18865|warau, 笑う, laugh, smile, sneer, ridicule, be dumbfounded, be flabbergasted, 咲う, 嗤う|warau|笑う|5327;20874;20875;20876|咲う, 嗤う|||笑|wara|80|
18866|kayou, 通う, attend (school, church, etc.), go to and from (a place), go back and forth between, run between (e.g. bus, train, etc.), ply between, go to (school, work, etc.), attend, commute, frequent, circulate (e.g. blood, electricity), be communicated (e.g. thought), resemble|kayou|通う|5328;12515;12516;12517;12518||||通|kayo|80|
18867|osou, 襲う, attack, assail, make an assault, strike, hunt down, succeed (someone in a post, role, etc.), make a sudden visit, を|osou|襲う|5329|||を|襲|oso|80|
18868|ou, 追う, follow (i.e. a set order, a trend), drive (i.e. a herd), be pressed (for time, etc. in passive voice), chase, run after, pursue, follow after, follow (a set order, a trend, etc.), drive out, get rid of, oust, expel, drive (e.g. a herd), be pressed (e.g. for time), 逐う, を|ou|追う|5330;19439;19440;19441;19442;19443|逐う||を|追|o|80|
18869|nerau, 狙う, aim at, を|nerau|狙う|5331|||を|狙|nera|80|
18870|yatou, 雇う, employ, hire, charter, を|yatou|雇う|5332|||を|雇|yato|80|
18871|you, 酔う, get seasick, get drunk, become intoxicated, feel sick (e.g. in a vehicle), become nauseated, be elated, be exalted, be spellbound, be in raptures|you|酔う|5333;10294;10295;10296||||酔|yo|80|
18872|kuruu, 狂う, go mad, get out of order, go amiss|kuruu|狂う|5334;9167||||狂|kuru|80|
18873|sukuu, 掬う, scoop, ladle out, を|sukuu|掬う|5335|||を|掬|suku|80|
18874|nuguu, 拭う, wipe, get rid of, eliminate (e.g. one's shame), remove (e.g. an impression), erase, を|nuguu|拭う|5336|||を|拭|nugu|80|
18875|tsugunau, 償う, redeem (one's faults), make up for, compensate for, indemnify, recompense, redeem (e.g. a fault), atone for, を|tsugunau|償う|5337;12029|||を|償|tsuguna|80|
18876|warukuiu, 悪く言う, deprecate, traduce|warukuiu|悪く言う|5338||||悪く言|warukui|80|
18877|warau, 嗤う, sneer, ridicule|warau|嗤う|5339||||嗤|wara|80|
18878|ou, 負う, bear, carry on one's back, take responsibility for, accept a duty, be injured, owe, を|ou|負う|5340|||を|負|o|80|
18879|ou, 生う, grow, spring up (archaic), cut (teeth), を|ou|生う|5341|||を|生|o|80|
18880|sukuu, 救う, rescue from, help out of, save, を|sukuu|救う|5342|||を|救|suku|80|
18881|sukuu, 巣食う, build (a nest), nest, haunt (a place), hang out (somewhere)|sukuu|巣食う|5343||||巣食|suku|80|
18882|omou, 想う, think, consider, believe (esp. heartfeltedly), を|omou|想う|5344|||を|想|omo|80|
18883|arau, 洗う, wash, investigate, を|arau|洗う|5345|||を|洗|ara|80|
18884|niou, 匂う, be fragrant, smell (good), stink, smell (bad), glow, be bright, smack of, show hints of|niou|匂う|5347;11043;11044;11045||||匂|nio|80|
18885|niou, 臭う, stink, smell (bad)|niou|臭う|5348||||臭|nio|80|
18886|ukagau, 窺う, peep (through), peep, examine (esp. covertly), await (one's chance), guess, infer, gather, surmise, を|ukagau|窺う|5351|||を|窺|ukaga|80|
18887|abarekuruu, 暴れ狂う, rage, run amok, run amuck, tear around|abarekuruu|暴れ狂う|5352||||暴れ狂|abarekuru|80|
18888|chimau, ちまう, do something completely, を|chimau|ちまう|5353|||を|ちま|chima|80|
18889|nigemadou, 逃げ惑う, run around trying escape|nigemadou|逃げ惑う|5354||||逃げ惑|nigemado|80|
18890|okonau, 行う, perform, do, conduct oneself, carry out, 行なう, を|okonau|行う|5355|行なう||を|行|okona|80|
18891|ajiwau, 味わう, taste, savor, savour, relish, appreciate, enjoy, relish, digest, experience, go through, taste (e.g. victory), know (e.g. pain), を|ajiwau|味わう|12446;12447;12448|||を|味わ|ajiwa|80|
18892|sakarau, 逆らう, go against, oppose, disobey, defy|sakarau|逆らう|5357||||逆ら|sakara|80|
18893|hanashiau, 話し合う, discuss, talk together, 話合う, 話しあう,  話合う, を|hanashiau|話し合う|5358|話合う, 話しあう,  話合う||を|話し合|hanashia|80|
18894|negau, 願う, have something done for oneself, desire, wish, hope, beg, request, implore, pray, を|negau|願う|5359;9807;9808|||を|願|nega|80|
18895|shiharau, 支払う, pay, を|shiharau|支払う|5360|||を|支払|shihara|80|
18896|niau, 似合う, suit, match, become, be like|niau|似合う|5361||||似合|nia|80|
18897|kirau, 嫌う, hate, dislike, loathe, を|kirau|嫌う|5362|||を|嫌|kira|80|
18898|oou, 覆う, cover, hide, conceal, wrap, disguise, 被う, 掩う, 蔽う, 蓋う|oou|覆う|5363|被う, 掩う, 蔽う, 蓋う|||覆|oo|80|
18899|tamerau, 躊躇う, hesitate|tamerau|躊躇う|5364||||躊躇|tamera|80|
18900|uranau, 占う, tell someone's fortune, forecast, predict, divine, を|uranau|占う|5365|||を|占|urana|80|
18901|arasou, 争う, deny (e.g. evidence, usu. in negative form), compete, contest, contend, quarrel, argue, dispute, be at variance, oppose, deny (e.g. evidence)|arasou|争う|5366;18594;18595;18596||||争|araso|80|
18902|seou, 背負う, be burdened with, take responsibility for, carry on back or shoulder, carry on one's back, have (something) in the background, be in front (of something), be conceited, think highly of oneself, 脊負う, shou,  脊負う, を|seou|背負う|5367;35765;35766;35767|脊負う, shou,  脊負う||を|背負|seo|80|
18903|oginau, 補う, compensate for, supplement, を|oginau|補う|5368|||を|補|ogina|80|
18904|surechigau, すれ違う, pass by one another, disagree, miss each other, 擦れ違う|surechigau|すれ違う|5369|擦れ違う|||すれ違|surechiga|80|
18905|au, 遭う, meet, encounter (undesirably), have an accident, have a bad experience|au|遭う|5370||||遭|a|80|
18906|totonou, 整う, be ready, be prepared, be arranged, be in order, be put in order, be well-ordered, be well-proportioned, be harmonious, be adjusted, be regulated, be refined (e.g. of a face), be settled (e.g. treaty, contract), be completed, 調う|totonou|整う|13391;13392;13393;13394|調う|||整|totono|80|
18907|sorou, 揃う, become complete, be all present, be a full set, have everything at one's disposal, be equal, be uniform, gather, assemble|sorou|揃う|5372||||揃|soro|80|
18908|hau, 這う, creep, crawl, 匍う, 延う, 爬う|hau|這う|5373|匍う, 延う, 爬う|||這|ha|80|
18909|furumau, 振舞う, behave, conduct oneself, entertain, treat someone (a drink), make tea for someone (tea ceremony), 振る舞う, を|furumau|振舞う|5375|振る舞う||を|振舞|furuma|80|
18910|deau, 出会う, meet (by chance), come across, run across, encounter, happen upon, meet (e.g. of rivers, highways, etc.), emerge and engage (an enemy), 出逢う, 出遭う,  出逢う,  出合う,  出あう|deau|出会う|5376;12774;12775|出逢う, 出遭う,  出逢う,  出合う,  出あう|||出会|dea|80|
18911|deau, 出遭う, meet (by chance), come across, run across, encounter, happen upon|deau|出遭う|5377||||出遭|dea|80|
18912|deau, 出合う, meet, intersect|deau|出合う|5378||||出合|dea|80|
18913|madou, 惑う, be puzzled, be perplexed, have doubts, feel lost, be at sea|madou|惑う|5379||||惑|mado|80|
18914|kau, 飼う, keep a pet, own a pet, raise a pet, keep (a pet or other animal), have, own, raise, rear, feed, を|kau|飼う|5380;21113|||を|飼|ka|80|
18915|kurau, 喰らう, eat (vulgar), drink (vulgar), receive (e.g. a blow), 食らう, を|kurau|喰らう|5381|食らう||を|喰ら|kura|80|
18916|kuu, 食う, eat (vulgar male language), receive (usually unfavorable event), have sex with a woman for the first time (vulgar, male language), live, make a living, survive, bite, sting (as insects do), tease, torment, taunt, make light of, make fun of, encroach on, eat into, consume, defeat a superior, threaten a position, consume time and-or resources, receive something (usu. an unfavourable event), have sexual relations with a woman, esp. for the first time, live, make a living, survive, encroach on, eat into, consume, 喰う, 啖う, を|kuu|食う|5382;6935;6936;6937;6938;6939;6940;6941;6942;9725;9726|喰う, 啖う||を|食|ku|80|
18917|samayou, 彷徨う, loiter, putter, prowl, wander about, roam about, knock around|samayou|彷徨う|5383||||彷徨|samayo|80|
18918|ubau, 奪う, snatch away, dispossess, steal, を|ubau|奪う|5384|||を|奪|uba|80|
18919|uchiau, 打ち合う, fight, exchange blows, rally, 打合う, を|uchiau|打ち合う|5385|打合う||を|打ち合|uchia|80|
18920|atsukau, 扱う, deal with (a person), treat, handle, take care of, entertain, deal with (a problem), handle, manage, operate (e.g. a machine), handle, work, deal in, sell, cover (a topic), treat, discuss, take up, treat A as B, mediate (an argument), be too much for one, find unmanageable, gossip, を|atsukau|扱う|16734;16735;16736;16737;16738;16739;16740;16741;16742|||を|扱|atsuka|80|
18921|shitagau, 従う, abide (by the rules), obey (an order, law, etc.), abide by (a rule, custom, etc.), follow, observe, conform to, yield to, follow (a person), accompany, go with, go alongside (e.g. a river), follow (e.g. a sign), serve (as), engage in (work), 随う, 順う, 隨う,  遵う,  從う,  随う|shitagau|従う|5387;9177;9178;9179;9180|随う, 順う, 隨う,  遵う,  從う,  随う|||従|shitaga|80|
18922|chikau, 誓う, swear, vow, take an oath, pledge, を|chikau|誓う|5388|||を|誓|chika|80|
18923|nuu, 縫う, sew, stitch, weave one's way (e.g. through a crowd), を|nuu|縫う|5389;15108|||を|縫|nu|80|
18924|sokonau, 損なう, harm, hurt, injure, damage, spoil, mar, fail to ..., miss one's opportunity to ..., 損う, 害う, を|sokonau|損なう|5390;16382|損う, 害う||を|損な|sokona|80|
18925|hamukau, 刃向かう, strike back at, bite back, turn on, rise against, oppose, defy, 歯向かう, 刃向う, 歯向う|hamukau|刃向かう|5391|歯向かう, 刃向う, 歯向う|||刃向か|hamuka|80|
18926|shokkiarau, 食器あらう, do the dishes|shokkiarau|食器あらう|6106||||食器あら|shokkiara|80|
18927|tsuriau, 釣り合う, balance, be in harmony, be in equilibrium, suit, go well together, be a good match, つり合う, 釣合う, を|tsuriau|釣り合う|8021;8022|つり合う, 釣合う||を|釣り合|tsuria|80|
18928|yashinau, 養う, support, maintain, provide for, bring up, raise, rear, feed, adopt (a child), cultivate (a habit, a quality, etc.), develop, build up, foster, recuperate (from injury, illness, etc.), を|yashinau|養う|8047;8048;8049;8050;8051|||を|養|yashina|80|
18929|sou, 沿う, run along, run beside, stick to (a line), follow (a policy, plan, etc.), act in accordance with, align with|sou|沿う|8473;8474||||沿|so|80|
18930|sou, 添う, meet (wishes, expectations, etc.), satisfy, comply with, live up to, accompany, go with, stay by one's side, associate with (someone), mix with, marry, wed, be added|sou|添う|8475;8476;8477;8478;8479||||添|so|80|
18931|shitau, 慕う, yearn for, long for, pine for, miss, love dearly, adore, follow (someone), idolize (for virtue, learning, status, etc.), を|shitau|慕う|9199;9200;9201|||を|慕|shita|80|
18932|tsukiau, 付き合う, associate with, keep company with, go out with, go steady with, get on with, go along with, follow someone's lead, accompany someone, compromise, つき合う, 付合う|tsukiau|付き合う|10205;10206|つき合う, 付合う|||付き合|tsukia|80|
18933|tsukurou, 繕う, mend, patch up, repair, darn, fix (hair, clothes, appearance etc.), adjust, tidy up, groom, keep up appearances, cover up (e.g. a mistake), gloss over, treat (illness, injury, etc.), を|tsukurou|繕う|10563;10564;10565;10566|||を|繕|tsukuro|80|
18934|toriatsukau, 取り扱う, handle, operate (a machine, etc.), use, deal with (an issue), manage, treat (someone), deal with (someone), deal in, carry, sell, を|toriatsukau|取り扱う|12001;12002;12003;12004|||を|取り扱|toriatsuka|80|
18935|mukuu, 報う, reward, recompense, repay, retaliate, get revenge|mukuu|報う|11749;11750||||報|muku|80|
18936|nikayou, 似通う, resemble closely|nikayou|似通う|13842||||似通|nikayo|80|
18937|meguriau, めぐり合う, meet fortuitously (e.g. running into an old friend), meet by chance, happen across, 巡り合う, 巡り逢う, めぐり会う, 回り合う, 巡り会う, 巡りあう, 廻り合う|meguriau|めぐり合う|14933|巡り合う, 巡り逢う, めぐり会う, 回り合う, 巡り会う, 巡りあう, 廻り合う|||めぐり合|meguria|80|
