KEYWORDS|Roumaji construction|Kana construction|Meaning|Type|Categories|Explanation|Rules|Example|Opposite|Synonym|Extra keywords|
doko, dochira, docchi, izuko, 何処, 何方, where, |doko, dochira, docchi, izuko|何処, 何方|where|Special|Interrogative||Use "doko" for normal form.|694||||
||||Special|Interrogative||Use "dochira" for polite form.|||||
dou, ikaga, nanto, 如何, 如何, 何と, how, |dou, ikaga, nanto|如何, 如何, 何と|how|Special|Interrogative||Use "dou" in normal form, "kou" in reply to "dou".|695, 696||||
||||Special|Interrogative||Use "ikaga" for polite form.|697||||
||||Special|Interrogative||Use "to" in reply to "nanto".|698||||
nan, ikutsu, 何, 幾つ, how many, nanbonka, nankoka, nanmaika, nantsuka|nan, ikutsu|何, 幾つ|how many|Special|Interrogative||"itsu" usage.|699|||nanbonka, nankoka, nanmaika, nantsuka|
||||Special|Interrogative||"nan" + counter usage.|700||||
itsu, 何時, when, |itsu|何時|when|Special|Interrogative|||701||nanji, nanyoubi, nanshuu, nangetsu, nantoshi, nannichi||
nanji, 何時, what hour, what time, ji|nanji|何時|what hour, what time|Special|Interrogative|||702|||ji|
nanyoubi, 何曜日, what day, youbi|nanyoubi|何曜日|what day|Special|Interrogative||||||youbi|
nanshuu, 何週, what week, shuu|nanshuu|何週|what week|Special|Interrogative||||||shuu|
nangetsu, 何月, what month, getsu|nangetsu|何月|what month|Special|Interrogative||||||getsu|
nantoshi, 何年, what year, tochi|nantoshi|何年|what year|Special|Interrogative||||||tochi|
nannichi, 何日, what date, which day of the month, nichi|nannichi|何日|what date, which day of the month|Special|Interrogative|||703|||nichi|
ikura, 幾ら, how much, price|ikura|幾ら|how much|Special|Interrogative|Used mainly for money-related issues.||704|||price|
nankai, 何回, how many times, kai|nankai|何回|how many times|Special|Interrogative|||1427|||kai|
nanjikan, 何時間, how much time, |nanjikan|何時間|how much time|Special|Interrogative|||1429||||
nanto iu, 何という, name of an object or person, |nanto iu|何という|name of an object or person|Special|Interrogative|What is it called?||705||||
||||Special|Interrogative|What is X's name?||706, 698||||
doushite, 如何して, why, what for, how come, for what reason, in what way, for what purpose|doushite|如何して|why, what for, how come|Special|Interrogative|||707|||for what reason, in what way, for what purpose|
naze, naniyue, 何故, why, how come, what for, for what reason, in what way, for what purpose|naze, naniyue|何故|why, how come|Special|Interrogative||||||what for, for what reason, in what way, for what purpose|
nande, 何で, why, what for, for what reason, in what way, for what purpose|nande|何で|why, what for|Special|Interrogative||||||for what reason, in what way, for what purpose|
douiu, 如何いう, somehow, how, in what way, why, what kind of, |douiu|如何いう|somehow, how, in what way, why, what kind of|Special|Interrogative||Use "toiu" in reply to "douiu".|||||
