Index|KEYWORDS|Roumaji construction|Kana construction|Meaning|Alternate Spellings|Extra keywords|Preposition|Kanji Root|Latin Root|Exception index|
20091|shageki suru, 射撃する, fire, shoot, 射撃, を|shageki suru|射撃する|11349||射撃|を|射撃|shageki |107|
20092|sentou suru, 戦闘する, battle, fight, combat, 戦闘|sentou suru|戦闘する|11348||戦闘||戦闘|sentou |107|
20093|senshi suru, 戦死する, die in battle, 戦死|senshi suru|戦死する|11347||戦死||戦死|senshi |107|
20094|seitsuu suru, 精通する, have deep knowledge of, be an expert in, be well versed in, be conversant with, ejaculate for the first time, 精通|seitsuu suru|精通する|11345;11346||精通||精通|seitsuu |107|
20095|seisei suru, 精製する, refine, purify, 精製, を|seisei suru|精製する|11344||精製|を|精製|seisei |107|
20096|sappari suru, さっぱりする, feel refreshed, feel relieved, be neat, be tidy, be clean, be frank, be open-hearted, be plain, be simple, be light, さっぱり|sappari suru|さっぱりする|11341;11342;11343||さっぱり||さっぱり|sappari |107|
20097|sakubun suru, 作文する, write (an essay, prose, etc.), compose, write formally with little real meaning, 作文, を|sakubun suru|作文する|11339;11340||作文|を|作文|sakubun |107|
20098|sakkyoku suru, 作曲する, compose, set (of music), 作曲, を|sakkyoku suru|作曲する|11338||作曲|を|作曲|sakkyoku |107|
20099|sakkin suru, 殺菌する, sterilize, sterilise, disinfect, 殺菌, を|sakkin suru|殺菌する|11337||殺菌|を|殺菌|sakkin |107|
20100|sakkaku suru, 錯覚する, hallucinate, misapprehend, mistake for someone or something else, 錯覚|sakkaku suru|錯覚する|11335;11336||錯覚||錯覚|sakkaku |107|
20101|oshikko suru, おしっこする, pee, おしっこ|oshikko suru|おしっこする|11334||おしっこ||おしっこ|oshikko |107|
20102|negaeri suru, 寝返りする, turn over while sleeping in bed, betray, double-cross, 寝返り, を|negaeri suru|寝返りする|11332;11333||寝返り|を|寝返り|negaeri |107|
20103|musou suru, 夢想する, dream, have a vision, 夢想|musou suru|夢想する|11331||夢想||夢想|musou |107|
20104|mokugeki suru, 目撃する, witness, observe, see, 目撃, を|mokugeki suru|目撃する|11330||目撃|を|目撃|mokugeki |107|
20105|miugoki suru, 身動きする, move about, stir about, 身動き|miugoki suru|身動きする|11329||身動き||身動き|miugoki |107|
20106|mikata suru, 味方する, take sides with, support, stand by, back up, 味方, を|mikata suru|味方する|11328||味方|を|味方|mikata |107|
20107|kyuushuu suru, 吸収する, absorb, suck, attract, 吸収, を|kyuushuu suru|吸収する|11327||吸収|を|吸収|kyuushuu |107|
20108|kyuuseichou suru, 急成長する, grow rapidly, 急成長|kyuuseichou suru|急成長する|11326||急成長||急成長|kyuuseichou |107|
20109|kyojuu suru, 居住する, reside, dwell, 居住|kyojuu suru|居住する|11325||居住||居住|kyojuu |107|
20110|kushakusha suru, くしゃくしゃする, be annoyed, be irritated, be upset, くしゃくしゃ|kushakusha suru|くしゃくしゃする|11324||くしゃくしゃ||くしゃくしゃ|kushakusha |107|
20111|koutetsu suru, 更迭する, change (personnel), reshuffle (e.g. a cabinet), shake-up, dismiss (e.g. a minister), replace, 更迭, を|koutetsu suru|更迭する|11323||更迭|を|更迭|koutetsu |107|
20112|koushin suru, 更新する, be renewed, be updated, be improved, 更新|koushin suru|更新する|11322||更新||更新|koushin |107|
20113|kousen suru, 交戦する, do war, do battle, engage in hostilities, 交戦|kousen suru|交戦する|11321||交戦||交戦|kousen |107|
20114|kousei suru, 更生する, rehabilitate, remake one's life, start life anew, be reborn, regenerate, be reorganized, be rebuilt, recover, be restored, be remade, come back to life, be revived, resuscitate, 更生|kousei suru|更生する|11318;11319;11320||更生||更生|kousei |107|
20115|kousei suru, 更正する, correct, revise, rectify, 更正, を|kousei suru|更正する|11317||更正|を|更正|kousei |107|
20116|koukai suru, 更改する, renew, extend, revise, 更改, を|koukai suru|更改する|11316||更改|を|更改|koukai |107|
20117|kouka suru, 硬化する, harden, vulcanize, vulcanise, cure, harden (of attitude, stance, etc.), stiffen, toughen, have an upturn (in the market), firm up, 硬化|kouka suru|硬化する|11313;11314;11315||硬化||硬化|kouka |107|
20118|kouchoku suru, 硬直する, stiffen, become rigid, be rigorous, be stiff, ossify, be petrified, 硬直|kouchoku suru|硬直する|11312||硬直||硬直|kouchoku |107|
20119|koromogae suru, 衣替えする, change clothing seasonally, be renovated, have a facelift, change appearance, 衣替え|koromogae suru|衣替えする|11310;11311||衣替え||衣替え|koromogae |107|
20120|kiyou suru, 起用する, appoint (to a position, job, etc.), use for a role, promote, 起用|kiyou suru|起用する|11309||起用||起用|kiyou |107|
20121|kiso suru, 起訴する, prosecute, indict, 起訴|kiso suru|起訴する|11308||起訴||起訴|kiso |107|
20122|kishou suru, 起床する, rise, get out of bed, 起床|kishou suru|起床する|11307||起床||起床|kishou |107|
20123|kiritsu suru, 起立する, stand up, 起立|kiritsu suru|起立する|11306||起立||起立|kiritsu |107|
20124|kinko suru, 禁錮する, imprison (without forced labour), incarcerate, confine, 禁錮, を|kinko suru|禁錮する|11305||禁錮|を|禁錮|kinko |107|
20125|kiin suru, 起因する, arise from, be caused by, 基因する, 起因, を|kiin suru|起因する|11304|基因する|起因|を|起因|kiin |107|
20126|kifuku suru, 起伏する, undulate, have ups and downs, have highs and lows, 起伏|kifuku suru|起伏する|11302;11303||起伏||起伏|kifuku |107|
20127|keizai suru, 経済する, do business, do finance, 経済|keizai suru|経済する|11301||経済||経済|keizai |107|
20128|keikaku suru, 計画する, plan, project, schedule, scheme, program, 計画, を|keikaku suru|計画する|11300||計画|を|計画|keikaku |107|
20129|kassen suru, 合戦する, battle, fight, engage, contest, 合戦, を|kassen suru|合戦する|11299||合戦|を|合戦|kassen |107|
20130|jimejime suru, じめじめする, be damp, be humid, be wet, be clammy, be muggy, be soggy, be gloomy, be melancholic, be depressing, じめじめ|jimejime suru|じめじめする|11297;11298||じめじめ||じめじめ|jimejime |107|
20131|itazura suru, 悪戯する, perform mischief, do a prank, trick, joke, do as a pastime, do as a hobby, play with (a lighter, etc.), fool around with, mess around with, amuse oneself with, tamper with, behave lewdly toward, misbehave sexually toward, assault sexually, molest, rape, itadurasuru, 惡戲する, 悪戯, を|itazura suru|悪戯する|11293;11294;11295;11296|itadurasuru, 惡戲する|悪戯|を|悪戯|itazura |107|
20132|issen suru, 一戦する, do battle, game, bout (with), 一戦|issen suru|一戦する|11292||一戦||一戦|issen |107|
20133|inemuri suru, 居眠りする, nod off (while sitting), doze, 居眠り|inemuri suru|居眠りする|11291||居眠り||居眠り|inemuri |107|
20134|henshin suru, 変身する, metamorphose, be disguised, transform, shapeshift, morph, 変身|henshin suru|変身する|11290||変身||変身|henshin |107|
20135|hensen suru, 変遷する, change, transition, 変遷|hensen suru|変遷する|11289||変遷||変遷|hensen |107|
20136|henkei suru, 変形する, transform, vary, metamorphose, be modified, deform, 変形|henkei suru|変形する|11288||変形||変形|henkei |107|
20137|henkan suru, 変換する, change, convert, transform, 変換|henkan suru|変換する|11287||変換||変換|henkan |107|
20138|henkaku suru, 変革する, change, transform, innovate, reform, revolutionize, upheave, 変革|henkaku suru|変革する|11285||変革||変革|henkaku |107|
20139|hendou suru, 変動する, change, fluctuate, 変動|hendou suru|変動する|11280||変動||変動|hendou |107|
20140|henbou suru, 変貌する, transfigure, transform, change appearance, 変貌|henbou suru|変貌する|11279||変貌||変貌|henbou |107|
20141|hakyuu suru, 波及する, spread, extend, ripple, 波及, を|hakyuu suru|波及する|11278||波及|を|波及|hakyuu |107|
20142|haki suru, 破棄する, tear up and discard (e.g. documents), dispose of (e.g. weaponry), destroy, annul, cancel, abrogate, void, break (e.g. treaty), reverse (an original ruling), 破棄, を|haki suru|破棄する|11275;11276;11277||破棄|を|破棄|haki |107|
20143|haisen suru, 敗戦する, suffer defeat, lose a battle, lose a war, 敗戦|haisen suru|敗戦する|11274||敗戦||敗戦|haisen |107|
20144|goraku suru, 娯楽する, have pleasure, be amused, 娯楽|goraku suru|娯楽する|11273||娯楽||娯楽|goraku |107|
20145|gekisen suru, 激戦する, battle fiercly, battle hard, hotly contest, fight severely, 劇戦する, 激戦, を|gekisen suru|激戦する|11272|劇戦する|激戦|を|激戦|gekisen |107|
20146|gacchiri suru, がっちりする, be solid, be robust, be well-built, be tight, be taut, be shrewd, be calculating, be astute, がっちり|gacchiri suru|がっちりする|11269;11270;11271||がっちり||がっちり|gacchiri |107|
20147|gacchi suru, 合致する, agree, concur, conform, comply, 合致|gacchi suru|合致する|11268||合致||合致|gacchi |107|
20148|ekika suru, 液化する, liquefy, 液化|ekika suru|液化する|11267||液化||液化|ekika |107|
20149|ecchingu suru, エッチングする, etch, エッチング|ecchingu suru|エッチングする|11266||エッチング||エッチング|ecchingu |107|
20150|ecchi suru, エッチする, have sexual intercourse, copulate, fuck, エッチ|ecchi suru|エッチする|11265||エッチ||エッチする|ecchi |107|
20151|doujou suru, 同情する, have sympathy, have compassion, feel pity for, 同情|doujou suru|同情する|11264||同情||同情|doujou |107|
20152|douchou suru, 同調する, have sympathy, agree with, align, conform, tune, 同調|douchou suru|同調する|11263||同調||同調|douchou |107|
20153|dorodoro suru, 泥々する, be sordid, be muddy, 泥泥する, 泥々|dorodoro suru|泥々する|11262|泥泥する|泥々||泥々|dorodoro |107|
20154|deshiiri suru, 弟子入りする, become a pupil (of), become an apprentice, 弟子入り|deshiiri suru|弟子入りする|11261||弟子入り||弟子入り|deshiiri |107|
20155|daikou suru, 代行する, act as agent, act on (someone's) behalf, execute business for, 代行|daikou suru|代行する|11260||代行||代行|daikou |107|
20156|chinchin suru, ちんちんする, beg (animal), ちんちん|chinchin suru|ちんちんする|11259||ちんちん||ちんちん|chinchin |107|
20157|akkou suru, 悪口する, abuse, insult, slander, speak evil, bad mouth, waruguchisuru, 惡口する, warukuchisuru, 悪口, を|akkou suru|悪口する|11258|waruguchisuru, 惡口する, warukuchisuru|悪口|を|悪口|akkou |107|
20158|akka suru, 悪化する, deteriorate, grow worse, aggrave, degenerate, be corrupted, あっ化する, 悪化|akka suru|悪化する|11257|あっ化する|悪化||悪化|akka |107|
20159|zouzei suru, 増税する, increase (tax), 増税|zouzei suru|増税する|12233||増税||増税|zouzei |107|
20160|zousui suru, 増水する, rise (of river, lake, etc.), swell (water), increase (water), 増水|zousui suru|増水する|12232||増水||増水|zousui |107|
20161|zoushin suru, 増進する, promote, increase, advance, 増進, を|zoushin suru|増進する|12231||増進|を|増進|zoushin |107|
20162|zousetsu suru, 増設する, extend, expand, add (equipment, facilities, etc.), 増設, を|zousetsu suru|増設する|12230||増設|を|増設|zousetsu |107|
20163|zoukyou suru, 増強する, augment, reinforce, increase, 増強, を|zoukyou suru|増強する|12229||増強|を|増強|zoukyou |107|
20164|zouhatsu suru, 増発する, increase the number of trains in operation, increase bond issues, 増発|zouhatsu suru|増発する|12227||増発||増発|zouhatsu |107|
20165|zougaku suru, 増額する, create an increased amount, 増額|zougaku suru|増額する|12226||増額||増額|zougaku |107|
20166|zoudai suru, 増大する, enlarge, increase, 増大, を|zoudai suru|増大する|12225||増大|を|増大|zoudai |107|
20167|yubikiri suru, 指切りする, pinky swear, pinky promise, hook each other's little fingers to confirm a promise, 指切り|yubikiri suru|指切りする|12224||指切り||指切り|yubikiri |107|
20168|tsukaiwake suru, 使い分けする, use properly, use (different things) for different purposes, 使い分け, を|tsukaiwake suru|使い分けする|12223||使い分け|を|使い分け|tsukaiwake |107|
20169|totsunyuu suru, 突入する, rush into, break into, storm, plunge into (war, etc.), embark on (a new venture), 突入|totsunyuu suru|突入する|12221;12222||突入||突入|totsunyuu |107|
20170|torihiki suru, 取引する, transact, deal, do business, 取引|torihiki suru|取引する|12220||取引||取引|torihiki |107|
20171|tokushuu suru, 特集する, publish (a feature e.g. newspaper, a special edition, a report), 特輯する, 特集|tokushuu suru|特集する|12219|特輯する|特集||特集|tokushuu |107|
20172|tettai suru, 撤退する, evacuate, withdraw, revocate, repeal, retreat, 撤退, を|tettai suru|撤退する|12218||撤退|を|撤退|tettai |107|
20173|tenkyo suru, 転居する, move, change residence, 転居|tenkyo suru|転居する|12217||転居||転居|tenkyo |107|
20174|teisei suru, 訂正する, correct, revise, amend, 訂正, を|teisei suru|訂正する|12216||訂正|を|訂正|teisei |107|
20175|tebiki suru, 手引きする, guide, lead, act as guide, have influence, have connections, have good offices, 手引き|tebiki suru|手引きする|12213;12215||手引き||手引き|tebiki |107|
20176|tanaage suru, 棚上げする, shelve, pigeonhole, 棚上げ, を|tanaage suru|棚上げする|12212||棚上げ|を|棚上げ|tanaage |107|
20177|taikan suru, 退官する, retire from office, 退官|taikan suru|退官する|12211||退官||退官|taikan |107|
20178|taikan suru, 体感する, sense, experience, 体感, を|taikan suru|体感する|12210||体感|を|体感|taikan |107|
20179|taijin suru, 退陣する, resign, step down, retire, retreat, decamp, withdraw, 退陣|taijin suru|退陣する|12208;12209||退陣||退陣|taijin |107|
20180|soufu suru, 送付する, send (esp. email attachments), forward, remit, 送付, を|soufu suru|送付する|12207||送付|を|送付|soufu |107|
20181|shuusei suru, 修正する, amend, correct, revise, modify, alter, retouch, update, fix, 修正, を|shuusei suru|修正する|12206||修正|を|修正|shuusei |107|
20182|shougai suru, 傷害する, wound, injure, assault, inflict bodily injury, 傷害, を|shougai suru|傷害する|12204;12205||傷害|を|傷害|shougai |107|
20183|shouchi suru, 承知する, know, be aware, consent, accept, assent, admit, comply, agree, acknowledge, acknowledge, forgive, pardon, excuse, 承知, を|shouchi suru|承知する|12201;12202;12203||承知|を|承知|shouchi |107|
20184|shikousakugo suru, 試行錯誤する, perform trial and error, 試行錯誤|shikousakugo suru|試行錯誤する|12200||試行錯誤||試行錯誤|shikousakugo |107|
20185|shikou suru, 試行する, make an attempt, perform a trial run, 試行|shikou suru|試行する|12199||試行||試行|shikou |107|
20186|shikou suru, 施行する, execute, enforce, carry out, give alms, give food to the poor or monks, sekousuru, shigyousuru, segyousuru, 施行|shikou suru|施行する|12197;12198|sekousuru, shigyousuru, segyousuru|施行||施行|shikou |107|
20187|shikou suru, 思考する, think, consider, 思考|shikou suru|思考する|12196||思考||思考|shikou |107|
20188|shikou suru, 志向する, intend to, aim at, have a preference (for), have an orientation (towards a goal), 志向, を|shikou suru|志向する|12195||志向|を|志向|shikou |107|
20189|shikou suru, 嗜好する, match a taste, be liked, be preferred, 嗜好|shikou suru|嗜好する|12194||嗜好||嗜好|shikou |107|
20190|shikkou suru, 執行する, execute, carry out, perform, enforce, shuugyousuru, shigyousuru, shugyousuru, 執行, を|shikkou suru|執行する|12193|shuugyousuru, shigyousuru, shugyousuru|執行|を|執行|shikkou |107|
20191|shigyou suru, 始業する, start work, commence, 始業|shigyou suru|始業する|12192||始業||始業|shigyou |107|
20192|sento suru, 遷都する, relocate the capital, transfer the capital, 遷都|sento suru|遷都する|12191||遷都||遷都|sento |107|
20193|sekimen suru, 赤面する, blush, get red in the face, embarrass, 赤面, を|sekimen suru|赤面する|12189;12190||赤面|を|赤面|sekimen |107|
20194|satsuei suru, 撮影する, photograph, film, shoot, record, 撮影, を|satsuei suru|撮影する|12188||撮影|を|撮影|satsuei |107|
20195|satei suru, 査定する, assess (value, damages, etc.), revise (a budget), 査定, を|satei suru|査定する|12187||査定|を|査定|satei |107|
20196|saiki suru, 再起する, make a comeback, make a recovery, be restored, rally, 再起|saiki suru|再起する|12186||再起||再起|saiki |107|
20197|riido suru, リードする, lead, read, リード, を|riido suru|リードする|12184;12185||リード|を|リード|riido |107|
20198|rakkan suru, 楽観する, be optimistic, take an optimistic view, 楽観|rakkan suru|楽観する|12183||楽観||楽観|rakkan |107|
20199|ninshiki suru, 認識する, recognize, be aware of, perceive, understand, 認識, を|ninshiki suru|認識する|12182||認識|を|認識|ninshiki |107|
20200|mudadukai suru, 無駄遣いする, waste (money, time, etc.), squander, fritter away, むだ使いする, 無駄使いする, むだ遣いする, 徒遣いする, 無駄づかいする, 無駄遣い, を|mudadukai suru|無駄遣いする|12181|むだ使いする, 無駄使いする, むだ遣いする, 徒遣いする, 無駄づかいする|無駄遣い|を|無駄遣い|mudadukai |107|
20201|moushiwake suru, 申し訳する, apologise, apologize, excuse oneself, 申し分けする, 申分する, 申訳する, 申しわけする, 申し訳けする, 申分けする, 申し訳|moushiwake suru|申し訳する|12180|申し分けする, 申分する, 申訳する, 申しわけする, 申し訳けする, 申分けする|申し訳||申し訳|moushiwake |107|
20202|kuuyu suru, 空輸する, air lift, 空輸, を|kuuyu suru|空輸する|12179||空輸|を|空輸|kuuyu |107|
20203|kuushuu suru, 空襲する, perform an air raid, 空襲|kuushuu suru|空襲する|12178||空襲||空襲|kuushuu |107|
20204|kuubaku suru, 空爆する, bomb, 空爆, を|kuubaku suru|空爆する|12177||空爆|を|空爆|kuubaku |107|
20205|kukaku suru, 区画する, divide, partition, 區劃する, 区劃する, 区画, を|kukaku suru|区画する|12176|區劃する, 区劃する|区画|を|区画|kukaku |107|
20206|kotobadukai suru, 言葉遣いする, give a speech, express oneself, 言葉づかいする, 言葉使いする, 言葉遣い|kotobadukai suru|言葉遣いする|12175|言葉づかいする, 言葉使いする|言葉遣い||言葉遣い|kotobadukai |107|
20207|kosokoso suru, こそこそする, perform sneakily, perform secretly, perform stealthily, sneak, こそこそ|kosokoso suru|こそこそする|12174||こそこそ||こそこそ|kosokoso |107|
20208|kosodate suru, 子育てする, rear a child, raise a child, raise children, parent, 子育て|kosodate suru|子育てする|12173||子育て||子育て|kosodate |107|
20209|kokorogamae suru, 心構えする, be prepared, be ready, 心構え|kokorogamae suru|心構えする|12172||心構え||心構え|kokorogamae |107|
20210|kizou suru, 寄贈する, donate, present, gift, 寄贈, を|kizou suru|寄贈する|12171||寄贈|を|寄贈|kizou |107|
20211|kisu suru, キスする, kiss, キス, を|kisu suru|キスする|12170||キス|を|キス|kisu |107|
20212|kinen suru, 記念する, commemorate, celebrate, honor the memory of something, turn something into a memento, 紀念する, 記念, を|kinen suru|記念する|12169|紀念する|記念|を|記念|kinen |107|
20213|katsuyaku suru, 活躍する, flourish, participate actively, play an active role, 活躍|katsuyaku suru|活躍する|12168||活躍||活躍|katsuyaku |107|
20214|katsudou suru, 活動する, act, operate, work, 活動|katsudou suru|活動する|12167||活動||活動|katsudou |107|
20215|kanyuu suru, 加入する, become a member, join, enter, be admitted, subscribe, affiliate with, adhere, sign, 加入|kanyuu suru|加入する|12164||加入||加入|kanyuu |107|
20216|kaitou suru, 解答する, answer, solve, 解答, を|kaitou suru|解答する|12163||解答|を|解答|kaitou |107|
20217|kaishou suru, 解消する, cancel, liquidate, resolve, reduce (e.g. stress), 解消, を|kaishou suru|解消する|12162||解消|を|解消|kaishou |107|
20218|kaisetsu suru, 解説する, explain, comment, expose, elucidate, 解説, を|kaisetsu suru|解説する|12160||解説|を|解説|kaisetsu |107|
20219|kaisei suru, 改正する, revise, amend, alter, 改正, を|kaisei suru|改正する|12159||改正|を|改正|kaisei |107|
20220|kaisan suru, 解散する, break up (e.g. meeting), disperse (e.g. crowd), dissolve (company, organization, etc.), liquidate, disband, dissolve (diet, parliament, etc.), 解散, を|kaisan suru|解散する|12156;12157;12158||解散|を|解散|kaisan |107|
20221|kaikou suru, 開港する, open a port (seaport, airport, etc.), start operations at a port, open a port to foreign vessels or trade, 開港|kaikou suru|開港する|12154;12155||開港||開港|kaikou |107|
20222|kaikou suru, 開校する, open a school, 開校|kaikou suru|開校する|12153||開校||開校|kaikou |107|
20223|kaikou suru, 開口する, open of a country (e.g. Japan) to the world, open one's mouth, begin to speak, 開口|kaikou suru|開口する|12150;12152||開口||開口|kaikou |107|
20224|kaikoku suru, 開国する, found a country, 開国|kaikoku suru|開国する|12149||開国||開国|kaikoku |107|
20225|kaikoku suru, 戒告する, warn, caution, 戒告, を|kaikoku suru|戒告する|12148||戒告|を|戒告|kaikoku |107|
20226|kaiko suru, 回顧する, recollect, reminisce, look back, retrospect, review, 回顧, を|kaiko suru|回顧する|12147||回顧|を|回顧|kaiko |107|
20227|kaiketsu suru, 解決する, settle, solve, resolve, be solved, be settled, 解決, を|kaiketsu suru|解決する|12146;12151||解決|を|解決|kaiketsu |107|
20228|kaijo suru, 解除する, cancel, rescind, release, call off, lift (sanctions), delist, 解除, を|kaijo suru|解除する|12145||解除|を|解除|kaijo |107|
20229|kaihou suru, 解放する, release, unleash, liberate, emancipate, set free, deallocate (computer memory), 解放, を|kaihou suru|解放する|12143;12144||解放|を|解放|kaihou |107|
20230|kaidoku suru, 解読する, decipher, decode, 解読, を|kaidoku suru|解読する|12142||解読|を|解読|kaidoku |107|
20231|kaibou suru, 解剖する, dissect, perform an autopsy on, analyze, analyse, 解剖, を|kaibou suru|解剖する|12140;12141||解剖|を|解剖|kaibou |107|
20232|jitsuzai suru, 実在する, be real, exist, 実在|jitsuzai suru|実在する|12139||実在||実在|jitsuzai |107|
20233|jitsuen suru, 実演する, demonstrate, present, stage a show, perform, 実演|jitsuen suru|実演する|12136;12137||実演||実演|jitsuen |107|
20234|jikkan suru, 実感する, actually feel, have a real feeling (that ...), experience personally, 実感, を|jikkan suru|実感する|12135||実感|を|実感|jikkan |107|
20235|ishiki suru, 意識する, become aware (of), sense, 意識, を|ishiki suru|意識する|12134||意識|を|意識|ishiki |107|
20236|gyouretsu suru, 行列する, line up, queue, 行列|gyouretsu suru|行列する|12132||行列||行列|gyouretsu |107|
20237|fushou suru, 負傷する, be injured, be wounded, 負傷, を|fushou suru|負傷する|12131||負傷|を|負傷|fushou |107|
20238|fukusei suru, 複製する, reproduce, duplicate, reprint, 複製, を|fukusei suru|複製する|12130||複製|を|複製|fukusei |107|
20239|fukugou suru, 複合する, be composite, be combined, be complex, 複合|fukugou suru|複合する|12129||複合||複合|fukugou |107|
20240|fukkoku suru, 復刻する, republish, reissue, reproduce, 復刻, を|fukkoku suru|復刻する|12128||復刻|を|復刻|fukkoku |107|
20241|doujou suru, 同乗する, ride together, ride with, 同乗|doujou suru|同乗する|12127||同乗||同乗|doujou |107|
20242|dekoboko suru, 凸凹する, be uneven, be rough, be rugged, be unequal, 凸凹|dekoboko suru|凸凹する|12125;12126||凸凹||凸凹|dekoboko |107|
20243|chokkan suru, 直感する, sense, have a hunch about, 直感|chokkan suru|直感する|12124||直感||直感|chokkan |107|
20244|burokku suru, ブロックする, block (e.g. the way), ブロック|burokku suru|ブロックする|12122||ブロック||ブロック|burokku |107|
20245|bubetsu suru, 侮蔑する, scorn, slight, 侮蔑, を|bubetsu suru|侮蔑する|12121||侮蔑|を|侮蔑|bubetsu |107|
20246|anaume suru, 穴埋めする, fill in gaps, fill in blanks (in a form, etc.), cover up a deficit, make up for something (e.g. one's mistake), 穴埋め|anaume suru|穴埋めする|12119;12120||穴埋め||穴埋め|anaume |107|
20247|aigo suru, 愛護する, protect, care for, 愛護, を|aigo suru|愛護する|12118||愛護|を|愛護|aigo |107|
20248|ka suru, 課する, levy, charge, assess, impose, assign, 課, を|ka suru|課する|453||課|を|課|ka |107|
20249|ka suru, 科する, inflict, impose (a fine, etc.), 科, を|ka suru|科する|230||科|を|科|ka |107|
