Index|KEYWORDS|Romaji construction|Kana construction|Meaning|Alternate Spellings|
7294|tara ii desu ka, たらいいですか, What do (you) think/suggest if (he) does/is X?, dara ii desu ka|tara ii desu ka|たらいいですか|324||
7295|deshou ka, でしょうか, Shouldn't (you) do/be X?|deshou ka|でしょうか|325||
7296|masen ka, ませんか, Why don't (you) do/be X?, nai ka, naika|masen ka|ませんか|326||
7297|nai ka, ないか, Why don't (you) do/be X?, masen ka, naika|nai ka|ないか|326||
7298|mashou ka, ませんか, May (he) do/be X?|mashou ka|ませんか|327||
7299|dake, だけ, only do X, dake da, dake desu|dake|だけ|328||
7300|ta bakari, たばかり, have (just) recently done X, bakari, bakkari, bakashi, bakkashi, just done, recently done, just recently done, just did|ta bakari|たばかり|329||
7301|bakari, ばかり, ready to do/be X, bakkari, bakashi, bakkashi|bakari|ばかり|330||
7302|ta tokoro da, たところだ, to have done/been X just now, tokoro da, ta tokoro desu|ta tokoro da|たところだ|331||
7303|tokoro da, ところだ, just about to do/be X|tokoro da|ところだ|332||
7304|teiru tokoro da, ているところだ, to be just in the middle of X-ing, tokoro da, teiru tokoro desu|teiru tokoro da|ているところだ|333||
7305|koto ga aru, ことがある, occasionally do/be X, nai koto ga aru, nai koto ga arimasu, koto ga nai, koto ga nakatta|koto ga aru|ことがある|334||
7306|koto ga dearu, ことがである, allowed to do/be X, nai koto ga dearu, nai koto ga dearimasu|koto ga dearu|ことがである|335||
7307|ta koto ga aru, たことがある, to have experienced X-ing, koto ga aru, have done before|ta koto ga aru|たことがある|336||
7308|ta koto ni naru, たことになる, to have happened to do/be X, koto ni naru|ta koto ni naru|たことになる|337||
7309|ta to shite mo, たとしても, even if there was|ta to shite mo|たとしても|7067||
7310|koto ni natteiru, ことになっている, to be scheduled/due to do X, nai koto ni natteiru, nai koto ni natteimasu, scheduled to do, due to do|koto ni natteiru|ことになっている|338||
7311|ou to shiteiru, おうとしている, about to do/be X, ou to suru, ou to shimasu, ou to shiteimasu, intend to do/be|ou to shiteiru|おうとしている|339||
7312|ou to suru, おうとする, about to do/be X, ou to shiteiru, ou to shimasu, ou to shiteimasu, intend to do/be|ou to suru|おうとする|339||
7313|ou to shita, おうとした, was just about to do X, tried to do X, ou to shimashita|ou to shita|おうとした|340||
7314|ou to omou, おうと思う, plan to do/be X, intend to do/be X, ou to omotteiru, ou to omoimasu, plan to be, considering to do, considering to be, ou to moimasu, ou to mou|ou to omou|おうと思う|341||
7315|ou to omotteiru, おうと思っている, planning to do/be X, ou to omou, ou to omotteimasu, plan to be, considering to do, considering to be, ou to motteimasu, ou to motteiru|ou to omotteiru|おうと思っている|342||
7316|tomonaku, ともなく, not intending to do/be X, absentmindedly, without planning to, without intending to|tomonaku|ともなく|343||
7317|tsumori, 積もり, intend to do/be X, 積り|tsumori|積もり|344|積り|
7318|ba ii noni, ばいいのに, (He) should do/be X, ii noni|ba ii noni|ばいいのに|345||
7319|ba yokatta noni, ばよかったのに, (He) should do/be X, yokatta noni|ba yokatta noni|ばよかったのに|346||
7320|ba yokatta, ばよかった, (He) should have done/been X, yokatta|ba yokatta|ばよかった|347||
7321|i, い, am, is, present tense, keiyoushi, i keiyoushi, i-adjective|i|い|348||
7322|i desu, いです, am, is, present tense (polite), keiyoushi, i keiyoushi, i-adjective|i desu|いです|349||
7323|kunai desu, くないです, am not, is not, present negative tense, keiyoushi, i keiyoushi, i-adjective|kunai desu|くないです|350||
7324|ku arimasen, くありません, am not, is not, present negative tense (polite), keiyoushi, i keiyoushi, i-adjective|ku arimasen|くありません|351||
7325|katta desu, かったです, was, past tense, keiyoushi, i keiyoushi, i-adjective|katta desu|かったです|352||
7326|kunakatta desu, くなかったです, was not, past negative tense, keiyoushi, i keiyoushi, i-adjective|kunakatta desu|くなかったです|353||
7327|ku arimasen deshita, くありませんでした, was not, past negative tense (polite), keiyoushi, i keiyoushi, i-adjective|ku arimasen deshita|くありませんでした|354||
7328|ku, く, adverb form, keiyoushi, i keiyoushi, i-adjective|ku|く|355||
7329|kute, くて, X and Y, is so X that, keiyoushi, i keiyoushi, i-adjective|kute|くて|356;357||
7330|kutemo, くて, even if, keiyoushi, i keiyoushi, i-adjective|kutemo|くて|6206||
7331|ku naru, くなる, to turn into X, keiyoushi, i keiyoushi, i-adjective|ku naru|くなる|358||
7332|ku suru, くする, to make X, keiyoushi, i keiyoushi, i-adjective|ku suru|くする|359||
7333|mi, み, noun form, keiyoushi, i keiyoushi, i-adjective|mi|み|360||
7334|kereba, ければ, if X, kereba desu, conditional, keiyoushi, i keiyoushi, i-adjective|kereba|ければ|361||
7335|karou, かろう, should be X, must be X, ought to be X, volitional, suggestive, keiyoushi, i keiyoushi, i-adjective|karou|かろう|362||
7336|sa, さ, level, degree of something, indicates assertion, come, come now, keiyoushi, i keiyoushi, i-adjective|sa|さ|6197;11069;11070||
7337|[root], , am, is, present tense, keiyoudoushi, na keiyoushi, na-adjective|[root]||363||
7338|desu, です, am, is, present tense (polite), keiyoudoushi, na keiyoushi, na-adjective|desu|です|364||
7339|dewa arimasen, ではありません, am not, is not, present negative tense (most polite), keiyoudoushi, na keiyoushi, na-adjective|dewa arimasen|ではありません|365||
7340|ja nai desu, じゃないです, am not, is not, present negative tense (polite), keiyoudoushi, na keiyoushi, na-adjective|ja nai desu|じゃないです|366||
7341|dewa nai, ではない, am not, is not, present negative tense (neutral), am/is not X, am not, is not, keiyoudoushi, na keiyoushi, na-adjective|dewa nai|ではない|367;643||
7342|ja nai, じゃない, am not, is not, present negative tense (impolite), keiyoudoushi, na keiyoushi, na-adjective|ja nai|じゃない|368||
7343|deshita, でした, was, past tense, keiyoudoushi, na keiyoushi, na-adjective|deshita|でした|369||
7344|ja arimasen deshita, じゃありませんでした, was not, past negative tense, keiyoudoushi, na keiyoushi, na-adjective|ja arimasen deshita|じゃありませんでした|370||
7345|de wa arimasen deshita, じゃありませんでした, was not, past negative tense (polite), keiyoudoushi, na keiyoushi, na-adjective|de wa arimasen deshita|じゃありませんでした|371||
7346|de (next adj.), で, X and Y, keiyoudoushi, na keiyoushi, na-adjective|de (next adj.)|で|372||
7347|demo, くて, even if, keiyoudoushi, na keiyoushi, na-adjective|demo|くて|6207||
7348|ni naru, になる, to turn into X , keiyoudoushi, na keiyoushi, na-adjective|ni naru|になる|373||
7349|ni suru, にする, to make X, keiyoudoushi, na keiyoushi, na-adjective|ni suru|にする|374||
7350|deareba, であれば, if X, deareba desu, conditional, keiyoudoushi, na keiyoushi, na-adjective|deareba|であれば|375||
7351|yotei da, 予定だ, I plan to X, to yotei da, to yotei desu|yotei da|予定だ|6149||
7352|ni kyoumi ga aru, に興味がある, I am interested in X|ni kyoumi ga aru|に興味がある|6612||
7353|dewa nakatta, ではなかった, was not X|dewa nakatta|ではなかった|6883||
