Index|KEYWORDS|Roumaji construction|Kana construction|Meaning|Alternate Spellings|Extra keywords|Preposition|Kanji Root|Latin Root|Exception index|
21591|hanraku suru, 反落する, fall reactionarily (e.g. in stock prices), 反落|hanraku suru|反落する|26120||反落||反落|hanraku |107|
21592|hannyuu suru, 搬入する, carry in a building, 搬入|hannyuu suru|搬入する|26119||搬入||搬入|hannyuu |107|
21593|hanmei suru, 判明する, be established, be proven, be ascertained, be identified, be confirmed, 判明|hanmei suru|判明する|26118||判明||判明|hanmei |107|
21594|hanjou suru, 繁盛する, prosper, flourish, thrive, 繁昌する, hanseisuru, 繁盛|hanjou suru|繁盛する|26117|繁昌する, hanseisuru|繁盛||繁盛|hanjou |107|
21595|hangyaku suru, 反逆する, commit treason, mutiny, rebel insurrect, 叛逆する, 反逆|hangyaku suru|反逆する|26116|叛逆する|反逆||反逆|hangyaku |107|
21596|hanami suru, 花見する, view cherry blossoms or flowers, 花見|hanami suru|花見する|26115||花見||花見|hanami |107|
21597|han'you suru, 汎用する, be generic, 汎用|han'you suru|汎用する|26114||汎用||汎用|han'you |107|
21598|hamigaki suru, 歯磨きする, brush one's teeth, 歯磨する, 歯磨き|hamigaki suru|歯磨きする|26113|歯磨する|歯磨き||歯磨き|hamigaki |107|
21599|hametsu suru, 破滅する, be ruined, be destroyed, fall into ruin, 破滅|hametsu suru|破滅する|26112||破滅||破滅|hametsu |107|
21600|hakugeki suru, 迫撃する, attack closely, 迫撃|hakugeki suru|迫撃する|26111||迫撃||迫撃|hakugeki |107|
21601|hakugai suru, 迫害する, persecute, 迫害|hakugai suru|迫害する|26110||迫害||迫害|hakugai |107|
21602|hakkyuu suru, 発給する, issue (e.g. a passport), 発給|hakkyuu suru|発給する|26109||発給||発給|hakkyuu |107|
21603|hakkutsu suru, 発掘する, excavate, exhume, discover (e.g. new talent), 発掘|hakkutsu suru|発掘する|26107;26108||発掘||発掘|hakkutsu |107|
21604|hakkou suru, 発酵する, ferment, 醗酵する, 発酵|hakkou suru|発酵する|26106|醗酵する|発酵||発酵|hakkou |107|
21605|hakkou suru, 発効する, come into effect, 発効|hakkou suru|発効する|26105||発効||発効|hakkou |107|
21606|hakkou suru, 発光する, emit (light), 発光|hakkou suru|発光する|26104||発光||発光|hakkou |107|
21607|hakki suru, 発揮する, exhibit, display, manifest, 発揮|hakki suru|発揮する|26103||発揮||発揮|hakki |107|
21608|hakkan suru, 発刊する, publish, issue, 発刊|hakkan suru|発刊する|26102||発刊||発刊|hakkan |107|
21609|hakkaku suru, 発覚する, detect, expose, 発覚|hakkaku suru|発覚する|26101||発覚||発覚|hakkaku |107|
21610|hakka suru, 発火する, be ignited, catch fire, be fired (e.g. gun), be discharged, 発火|hakka suru|発火する|26099;26100||発火||発火|hakka |107|
21611|hakamairi suru, 墓参りする, visit a grave, 墓参する, bosansuru, 墓参り|hakamairi suru|墓参りする|26098|墓参する, bosansuru|墓参り||墓参り|hakamairi |107|
21612|haizoku suru, 配属する, assign, attach, 配属|haizoku suru|配属する|26097||配属||配属|haizoku |107|
21613|haizetsu suru, 廃絶する, abolish, eliminate, discontinue, 廃絶|haizetsu suru|廃絶する|26095;26096||廃絶||廃絶|haizetsu |107|
21614|haitou suru, 配当する, distribute proceeds, 配当|haitou suru|配当する|26093||配当||配当|haitou |107|
21615|haisui suru, 排水する, drain, pump out (water), displace, 排水|haisui suru|排水する|26091;26092||排水||排水|haisui |107|
21616|haisou suru, 配送する, be delivered, 配送|haisou suru|配送する|26090||配送||配送|haisou |107|
21617|haishutsu suru, 輩出する, turn out in great numbers, appear one after the other, 輩出|haishutsu suru|輩出する|26089||輩出||輩出|haishutsu |107|
21618|haishutsu suru, 排出する, emit, produce, excrete, discharge, 排出|haishutsu suru|排出する|26088||排出||排出|haishutsu |107|
21619|haishin suru, 背信する, betray, 背信|haishin suru|背信する|26087||背信||背信|haishin |107|
21620|haisen suru, 配線する, wire, 配線|haisen suru|配線する|26086||配線||配線|haisen |107|
21621|haiseki suru, 排斥する, reject, exclude, boycott, 排斥|haiseki suru|排斥する|26085||排斥||排斥|haiseki |107|
21622|hairyo suru, 配慮する, be considerate, be concerned, be attentive, be thoughtful, make arrangements, care, trouble oneself, 配慮|hairyo suru|配慮する|26084||配慮||配慮|hairyo |107|
21623|hairetsu suru, 配列する, put in order, arrange, lay out, 排列する, 配列|hairetsu suru|配列する|26083|排列する|配列||配列|hairetsu |107|
21624|hainin suru, 背任する, breach trust, be malfeasant, malpractice, be misappropriating, 背任|hainin suru|背任する|26082||背任||背任|hainin |107|
21625|haikyuu suru, 配給する, distribute (e.g. films, rice), ration (e.g. food, gasoline), 配給|haikyuu suru|配給する|26079;26080||配給||配給|haikyuu |107|
21626|haiki suru, 排気する, emit,  exhaust, expulse (air), ventilate, 排気|haiki suru|排気する|26077;26078||排気||排気|haiki |107|
21627|haiki suru, 廃棄する, dispose of, scrap, annul, cancel, 廃棄|haiki suru|廃棄する|26075||廃棄||廃棄|haiki |107|
21628|haikan suru, 配管する, plumb, install plumbing or pipework, 配管|haikan suru|配管する|26074||配管||配管|haikan |107|
21629|haihon suru, 配本する, be distributed (books), 配本|haihon suru|配本する|26073||配本||配本|haihon |107|
21630|haigyou suru, 廃業する, discontinue business, close down, give up (one's practice), retire, 廃業|haigyou suru|廃業する|26072||廃業||廃業|haigyou |107|
21631|haifu suru, 配布する, distribute, 配布|haifu suru|配布する|26071||配布||配布|haifu |107|
21632|haiden suru, 配電する, be distributed (electricity), 配電|haiden suru|配電する|26070||配電||配電|haiden |107|
21633|haibun suru, 配分する, distribute, allot, divide,  among, 配分|haibun suru|配分する|26069||配分||配分|haibun |107|
21634|haibi suru, 配備する, deploy, 配備|haibi suru|配備する|26068||配備||配備|haibi |107|
21635|hadome suru, 歯止めする, be restrained, be curtailed, 歯止め|hadome suru|歯止めする|26067||歯止め||歯止め|hadome |107|
21636|hachimaki suru, 鉢巻する, wear a headband, 鉢巻きする, 鉢巻|hachimaki suru|鉢巻する|26066|鉢巻きする|鉢巻||鉢巻|hachimaki |107|
21637|hikkoshi suru, 引っ越しする, move (dwelling, office, etc.), change residence, 引越する, 引越しする, 引っ越し|hikkoshi suru|引っ越しする|26443|引越する, 引越しする|引っ越し||引っ越し|hikkoshi |107|
21638|hikki suru, 筆記する, take notes, copy, 筆記|hikki suru|筆記する|26442||筆記||筆記|hikki |107|
21639|hikitori suru, 引き取りする, leave, accept, 引取りする, 引取する, 引き取り, を|hikitori suru|引き取りする|26441|引取りする, 引取する|引き取り|を|引き取り|hikitori |107|
21640|hiketsu suru, 否決する, reject, refuse, 否決|hiketsu suru|否決する|26440||否決||否決|hiketsu |107|
21641|hijun suru, 批准する, ratify, 批准|hijun suru|批准する|26439||批准||批准|hijun |107|
21642|hihyou suru, 批評する, review, evaluate, criticize, criticise, 批評|hihyou suru|批評する|26438||批評||批評|hihyou |107|
21643|hihei suru, 疲弊する, be exhausted, be fatigued, be impoverished, be exhausted (financial), be ruined, 疲弊|hihei suru|疲弊する|26436;26437||疲弊||疲弊|hihei |107|
21644|hidai suru, 肥大する, swell, enlarge, become fat, hypertrophy, 肥大|hidai suru|肥大する|26434;26435||肥大||肥大|hidai |107|
21645|hibaku suru, 被爆する, be bombed, be A-bombed, be nuked, be exposed to radiation (from an atomic blast), 被爆|hibaku suru|被爆する|26432;26433||被爆||被爆|hibaku |107|
21646|henzou suru, 変造する, be altered, be defaced, be debased, be falsified, be forged, 変造|henzou suru|変造する|26431||変造||変造|henzou |107|
21647|hentou suru, 返答する, reply, answer, 返答|hentou suru|返答する|26430||返答||返答|hentou |107|
21648|henshitsu suru, 変質する, be altered (character, essence), change in quality, transform, deteriorate, degenerate, transmute, 変質|henshitsu suru|変質する|26429||変質||変質|henshitsu |107|
21649|henshin suru, 返信する, reply, 返信|henshin suru|返信する|26428||返信||返信|henshin |107|
21650|hensai suru, 返済する, repay, reimburse, return (something loaned), 返済|hensai suru|返済する|26427||返済||返済|hensai |107|
21651|henkyaku suru, 返却する, be returned, be repaid, 返却|henkyaku suru|返却する|26426||返却||返却|henkyaku |107|
21652|hen'you suru, 変容する, change in appearance, transform, 変容|hen'you suru|変容する|26425||変容||変容|hen'you |107|
21653|hen'i suru, 変移する, change, alter, mutate, 変移|hen'i suru|変移する|26424||変移||変移|hen'i |107|
21654|heiyou suru, 併用する, use together, use both at the same time, 並用する, 併用|heiyou suru|併用する|26423|並用する|併用||併用|heiyou |107|
21655|heiten suru, 閉店する, close up shop (for the day), stop business, go out of business, 閉店|heiten suru|閉店する|26421;26422||閉店||閉店|heiten |107|
21656|heisetsu suru, 併設する, join, juxtapose, placed side by side, 併設|heisetsu suru|併設する|26420||併設||併設|heisetsu |107|
21657|heisatsu suru, 併殺する, perform a double play, 併殺|heisatsu suru|併殺する|26419||併殺||併殺|heisatsu |107|
21658|heisa suru, 閉鎖する, close an entrance, close down (facility, company, etc.), 閉鎖|heisa suru|閉鎖する|26418||閉鎖||閉鎖|heisa |107|
21659|heiritsu suru, 並立する, stand abreast, 併立する, 並立|heiritsu suru|並立する|26417|併立する|並立||並立|heiritsu |107|
21660|heiretsu suru, 並列する, be arranged in a line, stand in a row, 並列|heiretsu suru|並列する|26416||並列||並列|heiretsu |107|
21661|heimaku suru, 閉幕する, fall of the curtain, come to an end, 閉幕|heimaku suru|閉幕する|26415||閉幕||閉幕|heimaku |107|
21662|heikou suru, 閉口する, be dumbfounded, be stumped, be at one's wits' end, be nonplussed, be annoyed, 閉口|heikou suru|閉口する|26413;26414||閉口||閉口|heikou |107|
21663|heikou suru, 平行する, run parallel (to, with), run concurrently, occur at the same time, keep pace with, not reach an agreement (e.g. of a debate), 平行|heikou suru|平行する|26410;26411;26412||平行||平行|heikou |107|
21664|heikai suru, 閉会する, close a meeting, end a meeting, 閉会|heikai suru|閉会する|26409||閉会||閉会|heikai |107|
21665|heigou suru, 併合する, merge, annex, 併合|heigou suru|併合する|26408||併合||併合|heigou |107|
21666|hayaoki suru, 早起きする, rise early, 早起き|hayaoki suru|早起きする|26407||早起き||早起き|hayaoki |107|
21667|hayane suru, 早寝する, go to bed early, 早寝|hayane suru|早寝する|26406||早寝||早寝|hayane |107|
21668|hayabike suru, 早引けする, leave work (office, school) early, 早引きする, hayabikisuru, 早引け|hayabike suru|早引けする|26405|早引きする, hayabikisuru|早引け||早引け|hayabike |107|
21669|hatsurei suru, 発令する, announce, officially issue, 発令|hatsurei suru|発令する|26404||発令||発令|hatsurei |107|
21670|hatsunetsu suru, 発熱する, heat up, have a fever, 発熱|hatsunetsu suru|発熱する|26402;26403||発熱||発熱|hatsunetsu |107|
21671|hatsuga suru, 発芽する, germinate, sprout, bud, 発芽|hatsuga suru|発芽する|26401||発芽||発芽|hatsuga |107|
21672|hatsudou suru, 発動する, put (a machine) into operation, put into effect, invoke, 発動|hatsudou suru|発動する|26399;26400||発動||発動|hatsudou |107|
21673|hatsubyou suru, 発病する, fall ill, become ill, 発病, を|hatsubyou suru|発病する|26398||発病|を|発病|hatsubyou |107|
21674|hatsuan suru, 発案する, suggest, move, submit (a bill), 発案|hatsuan suru|発案する|26397||発案||発案|hatsuan |107|
21675|hatan suru, 破綻する, fail, collapse, break down, 破たんする, 破綻|hatan suru|破綻する|26396|破たんする|破綻||破綻|hatan |107|
21676|hassou suru, 発送する, dispatch, ship, 発送|hassou suru|発送する|26395||発送||発送|hassou |107|
21677|hasshou suru, 発祥する, originate, appear (auspicious omen), 発祥|hasshou suru|発祥する|26393;26394||発祥||発祥|hasshou |107|
21678|hassei suru, 発声する, utter, speak, vocalize, vocalise, enunciate, pronounce, lead a group of people (in cheering, singing, etc.), 発声|hassei suru|発声する|26391;26392||発声||発声|hassei |107|
21679|hassan suru, 発散する, emanate, give out, radiate, diffuse, let out (feelings), vent, 発散|hassan suru|発散する|26387;26388||発散||発散|hassan |107|
21680|hason suru, 破損する, damage, 破損|hason suru|破損する|26386||破損||破損|hason |107|
21681|hasan suru, 破産する, go bankrupt, be insolvent, 破産|hasan suru|破産する|26385||破産||破産|hasan |107|
21682|hasamiuchi suru, 挟み撃ちする, attack on both sides (flanks), 挟み打ちする, 挟み撃ち|hasamiuchi suru|挟み撃ちする|26384|挟み打ちする|挟み撃ち||挟み撃ち|hasamiuchi |107|
21683|haraimodoshi suru, 払い戻しする, be repaid, be refunded, 払戻しする, 払戻する, 払い戻し|haraimodoshi suru|払い戻しする|26383|払戻しする, 払戻する|払い戻し||払い戻し|haraimodoshi |107|
21684|happou suru, 発砲する, fire, discharge (gun), 発砲|happou suru|発砲する|26382||発砲||発砲|happou |107|
21685|hansou suru, 搬送する, transport, convey, transfer to a hospital, 搬送|hansou suru|搬送する|26380;26381||搬送||搬送|hansou |107|
21686|chuuton suru, 駐屯する, be stationed (troops), 駐屯|chuuton suru|駐屯する|26379||駐屯||駐屯|chuuton |107|
21687|housui suru, 放水する, be hosed down, be drained, be discharged (water), be sprayed with water, 放水|housui suru|放水する|26826||放水||放水|housui |107|
21688|houshutsu suru, 放出する, release, emit, let out, vent, discharge, give out, 放出|houshutsu suru|放出する|26825||放出||放出|houshutsu |107|
21689|houshoku suru, 飽食する, satiate, 飽食|houshoku suru|飽食する|26824||飽食||飽食|houshoku |107|
21690|houshi suru, 奉仕する, offer goods at a reduced price, provide a service for free, 奉仕|houshi suru|奉仕する|26823||奉仕||奉仕|houshi |107|
21691|housha suru, 放射する, emit, radiate, 放射|housha suru|放射する|26821||放射||放射|housha |107|
21692|housei suru, 縫製する, sew, 縫成する, 縫製|housei suru|縫製する|26820|縫成する|縫製||縫製|housei |107|
21693|houryuu suru, 放流する, be discharged (e.g. of water from a dam), be liberated, be stocked (e.g. a river with fish), 放流|houryuu suru|放流する|26818;26819||放流||放流|houryuu |107|
21694|hourou suru, 放浪する, wander, 放浪|hourou suru|放浪する|26817||放浪||放浪|hourou |107|
21695|houraku suru, 崩落する, collapse, break, cave in, crash, decline (market), 崩落|houraku suru|崩落する|26816||崩落||崩落|houraku |107|
21696|houou suru, 訪欧する, visit Europe, 訪欧|houou suru|訪欧する|26815||訪欧||訪欧|houou |107|
21697|hounin suru, 放任する, leave something to take its own course, give someone a free hand with something, 放任|hounin suru|放任する|26814||放任||放任|hounin |107|
21698|hounichi suru, 訪日する, visit Japan, 訪日|hounichi suru|訪日する|26813||訪日||訪日|hounichi |107|
21699|houkou suru, 奉公する, serve, 奉公|houkou suru|奉公する|26812||奉公||奉公|houkou |107|
21700|houki suru, 放棄する, abandon, renounce, resign, abdicate, 抛棄する, 放棄, を|houki suru|放棄する|26810|抛棄する|放棄|を|放棄|houki |107|
21701|houkatsu suru, 包括する, include, comprehend, embrace, 包括|houkatsu suru|包括する|26809||包括||包括|houkatsu |107|
21702|houka suru, 放火する, set fire to, 放火|houka suru|放火する|26808||放火||放火|houka |107|
21703|houi suru, 包囲する, siege, encircle, envelop, surround, besiege, 包囲|houi suru|包囲する|26807||包囲||包囲|houi |107|
21704|hougeki suru, 砲撃する, bombard, shell, 砲撃|hougeki suru|砲撃する|26806||砲撃||砲撃|hougeki |107|
21705|houchuu suru, 訪中する, visit China, 訪中|houchuu suru|訪中する|26805||訪中||訪中|houchuu |107|
21706|houchi suru, 放置する, neglect, to leave alone, abandon, 放置|houchi suru|放置する|26804||放置||放置|houchi |107|
21707|houbei suru, 訪米する, visit America, 訪米|houbei suru|訪米する|26803||訪米||訪米|houbei |107|
21708|hosou suru, 舗装する, pave, 舗装|hosou suru|舗装する|26802||舗装||舗装|hosou |107|
21709|hosoku suru, 補足する, supplement, complement, 補足|hosoku suru|補足する|26801||補足||補足|hosoku |107|
21710|hoshuu suru, 補修する, repair, mend, 補修|hoshuu suru|補修する|26800||補修||補修|hoshuu |107|
21711|hoshu suru, 保守する, maintain, 保守|hoshu suru|保守する|26799||保守||保守|hoshu |107|
21712|hoshaku suru, 保釈する, release on bail, 保釈|hoshaku suru|保釈する|26798||保釈||保釈|hoshaku |107|
21713|hosei suru, 補正する, supplement and correct, compensate, 補正|hosei suru|補正する|26797||補正||補正|hosei |107|
21714|hosa suru, 補佐する, assist, offer counsel to, 輔佐する, 補佐|hosa suru|補佐する|26796|輔佐する|補佐||補佐|hosa |107|
21715|horyuu suru, 保留する, defer, suspend, 保留|horyuu suru|保留する|26795||保留||保留|horyuu |107|
21716|hoon suru, 保温する, keep heat (in), 保温|hoon suru|保温する|26794||保温||保温|hoon |107|
21717|hokyuu suru, 補給する, supply, replenish, 補給|hokyuu suru|補給する|26793||補給||補給|hokyuu |107|
21718|hokyou suru, 補強する, supplement, reinforce, 補強|hokyou suru|補強する|26792||補強||補強|hokyou |107|
21719|hojuu suru, 補充する, supplement, replace, refill, replenish, 補充|hojuu suru|補充する|26791||補充||補充|hojuu |107|
21720|hojo suru, 補助する, assist, support, aid, help, subsidize, subsidise, supplement, spot (in bodybuilding), 補助|hojo suru|補助する|26787;26788;26790||補助||補助|hojo |107|
21721|hoji suru, 保持する, keep, hold, conserve, maintain, 保持|hoji suru|保持する|26786||保持||保持|hoji |107|
21722|hoiku suru, 保育する, take care (of an infant), nurse (an infant), 哺育する, 保育|hoiku suru|保育する|26785|哺育する|保育||保育|hoiku |107|
21723|hiyaku suru, 飛躍する, leap, be active, leapfrog (over a problem), make a leap (e.g. in logic), make great strides, make rapid progress, emerge, become active, play an active part, 飛躍|hiyaku suru|飛躍する|26780;26781;26782;26783;26784||飛躍||飛躍|hiyaku |107|
21724|hitoyasumi suru, 一休みする, rest, have a break, ひと休みする, 一休み|hitoyasumi suru|一休みする|26779|ひと休みする|一休み||一休み|hitoyasumi |107|
21725|hitorijime suru, 独り占めする, monopolise, monopolize, hog, have all to oneself, 一人占めする, 独り占め, を|hitorijime suru|独り占めする|26778|一人占めする|独り占め|を|独り占め|hitorijime |107|
21726|hitoriaruki suru, 独り歩きする, walk alone, walk unaided, go alone, stand on one's own, 一人歩きする, ひとり歩きする, 独り歩き|hitoriaruki suru|独り歩きする|26777|一人歩きする, ひとり歩きする|独り歩き||独り歩き|hitoriaruki |107|
21727|hitomishiri suru, 人見知りする, be shy, fear strangers, 人見知り|hitomishiri suru|人見知りする|26776||人見知り||人見知り|hitomishiri |107|
21728|hitomawari suru, 一回りする, go around, make a circuit, take a turn, ひと回りする, 一回り|hitomawari suru|一回りする|26775|ひと回りする|一回り||一回り|hitomawari |107|
21729|hitodakari suru, 人だかりする, be crowded, 人集りする, 人だかり|hitodakari suru|人だかりする|26774|人集りする|人だかり||人だかり|hitodakari |107|
21730|hitochigai suru, 人違いする, mistake one person for another, 人違い|hitochigai suru|人違いする|26773||人違い||人違い|hitochigai |107|
21731|hisai suru, 被災する, be a victim of (some disaster), suffer from, 被災|hisai suru|被災する|26772||被災||被災|hisai |107|
21732|hirou suru, 疲労する, be fatigued, be weary, 疲労|hirou suru|疲労する|26771||疲労||疲労|hirou |107|
21733|hirou suru, 披露する, announce, express, 披露|hirou suru|披露する|26770||披露||披露|hirou |107|
21734|hinpatsu suru, 頻発する, occur frequently, 頻発|hinpatsu suru|頻発する|26769||頻発||頻発|hinpatsu |107|
21735|hinin suru, 否認する, deny, repudiate, negate, 否認|hinin suru|否認する|26768||否認||否認|hinin |107|
21736|himen suru, 罷免する, dismiss (from a position), discharge, 罷免|himen suru|罷免する|26767||罷免||罷免|himen |107|
21737|jouzou suru, 醸造する, brew, 醸造|jouzou suru|醸造する|27631||醸造||醸造|jouzou |107|
21738|joushin suru, 上申する, report to a superior, 上申|joushin suru|上申する|27630||上申||上申|joushin |107|
21739|jousei suru, 醸成する, brew, ferment, 醸成|jousei suru|醸成する|27629||醸成||醸成|jousei |107|
21740|jouriku suru, 上陸する, land, disembark, make landfall, 上陸|jouriku suru|上陸する|27628||上陸||上陸|jouriku |107|
21741|jounin suru, 常任する, be regular, be permanent, serve permanently on a committee, 常任|jounin suru|常任する|27627||常任||常任|jounin |107|
21742|joukou suru, 乗降する, get on and off, embark and disembark, 乗降|joukou suru|乗降する|27626||乗降||乗降|joukou |107|
21743|joukoku suru, 上告する, appeal finally to the highest court, 上告|joukoku suru|上告する|27625||上告||上告|joukoku |107|
21744|jouka suru, 浄化する, purify, cleanse, clean up (e.g. politics), purge, 浄化|jouka suru|浄化する|27623;27624||浄化||浄化|jouka |107|
21745|joujou suru, 上場する, list (on the stock exchange, be etc.), take a company public, present (e.g. of a play, opera), perform, 上場|joujou suru|上場する|27621;27622||上場||上場|joujou |107|
21746|jouhatsu suru, 蒸発する, evaporate, disappear (intendingly conceal one's whereabouts), 蒸発|jouhatsu suru|蒸発する|27619;27620||蒸発||蒸発|jouhatsu |107|
21747|jouge suru, 上下する, go up and down, rise and fall, fluctuate, go and come back, 上下|jouge suru|上下する|27617;27618||上下||上下|jouge |107|
21748|jouchuu suru, 常駐する, stay permanently, be stationed, reside, 常駐|jouchuu suru|常駐する|27616||常駐||常駐|jouchuu |107|
21749|josou suru, 除草する, weed, 除草|josou suru|除草する|27615||除草||除草|josou |107|
21750|josei suru, 助成する, be assisted, be fostered, be aided, 助成|josei suru|助成する|27614||助成||助成|josei |107|
21751|jomei suru, 除名する, be expulsed, be excommunicated, 除名|jomei suru|除名する|27613||除名||除名|jomei |107|
21752|jokyo suru, 除去する, clean up, weed out, remove, get rid of, 除去, を|jokyo suru|除去する|27612||除去|を|除去|jokyo |107|
21753|jokou suru, 徐行する, go slowly, 徐行|jokou suru|徐行する|27611||徐行||徐行|jokou |107|
21754|jogen suru, 助言する, give advice, give suggestions, jogonsuru, 助言|jogen suru|助言する|27610|jogonsuru|助言||助言|jogen |107|
21755|jogai suru, 除外する, except, exclude, 除外|jogai suru|除外する|27609||除外||除外|jogai |107|
21756|joen suru, 助演する, be a co-star, 助演|joen suru|助演する|27608||助演||助演|joen |107|
21757|jizoku suru, 持続する, continue, persist, last, be sustained, endure, 持続|jizoku suru|持続する|27607||持続||持続|jizoku |107|
21758|jitai suru, 辞退する, turn down, decline, refuse, pass up, 辞退|jitai suru|辞退する|27606||辞退||辞退|jitai |107|
21759|jisui suru, 自炊する, cook for oneself, make oneself food, self-cater, scan a book or magazine to create an ebook by oneself, 自炊|jisui suru|自炊する|27604;27605||自炊||自炊|jisui |107|
21760|jisshou suru, 実証する, demonstrate, verify, substantiate, 実証|jisshou suru|実証する|27603||実証||実証|jisshou |107|
21761|jishuu suru, 自習する, study by oneself, teach oneself, 自修する, 自習|jishuu suru|自習する|27602|自修する|自習||自習|jishuu |107|
21762|jishuku suru, 自粛する, voluntarily refrain from, be moderate in, 自粛|jishuku suru|自粛する|27601||自粛||自粛|jishuku |107|
21763|jishu suru, 自主する, be independent, be autonomous, be self-relying, 自主|jishu suru|自主する|27600||自主||自主|jishu |107|
21764|jishou suru, 自称する, profess oneself to be, call oneself, describe oneself as, 自称|jishou suru|自称する|27599||自称||自称|jishou |107|
21765|jisan suru, 持参する, bring, carry, take, 持参|jisan suru|持参する|27598||持参||持参|jisan |107|
21766|jisaku suru, 自作する, make by oneself, 自作|jisaku suru|自作する|27597||自作||自作|jisaku |107|
21767|jinsen suru, 人選する, select personnel, 人選|jinsen suru|人選する|27596||人選||人選|jinsen |107|
21768|jinmon suru, 尋問する, question, interrogate, cross examine, 訊問する, 尋問|jinmon suru|尋問する|27595|訊問する|尋問||尋問|jinmon |107|
