Index|KEYWORDS|Roumaji construction|Kana construction|Meaning|Alternate Spellings|
5045|kaesu, 帰す, send back (someone), send home (someone) |kaesu|帰す|4476||
5046|hanasu, 話す, speak (e.g. a language), talk|hanasu|話す|4477||
5047|okosu, 起こす, raise, cause, wake someone|okosu|起こす|4478||
5048|chirasu, 散らす, scatter, disperse, distribute, spread, resolve, relieve, get rid of, cure, distract, divert|chirasu|散らす|4479||
5049|kasu, 貸す, lend, loan, rent out, hire out|kasu|貸す|4480||
5050|osu, 押す, push, press|osu|押す|4481||
5051|kawasu, 交わす, exchange (words), intersect, cross, interlace|kawasu|交わす|4482||
5052|nokosu, 残す, leave (something behind), set aside, bequeath, save (e.g. for later), reserve (e.g. for later), leave (behind, over), bequeath, save, reserve, 遺す|nokosu|残す|4483;6964|遺す|
5053|kesu, 消す, turn off, extinguish, erase|kesu|消す|4484||
5054|sagasu, 探す, search for, look for, seek|sagasu|探す|4485||
5055|itasu, 致す, do|itasu|致す|4486||
5056|mousu, 申す, say, be called|mousu|申す|4487||
5057|tokasu, 梳かす, brush, comb out, 解かす, 融かす|tokasu|梳かす|4488|解かす, 融かす|
5058|tokasu, 溶かす, melt, dissolve|tokasu|溶かす|4489||
5059|motarasu, 齎す, produce (e.g. results), bring about|motarasu|齎す|4490||
5060|yakusu, 訳す, translate, interpret|yakusu|訳す|4491||
5061|kobosu, 零す, spill, drop, shed (tears), grumble, complain, let one's feelings show, 溢す|kobosu|零す|4492|溢す|
5062|dasu, 出す, take out, put out, reveal, show, submit, turn in, publish, make public, send, produce (a sound), start (a fire), serve (food)|dasu|出す|4493||
5063|hakidasu, 吐き出す, spit out, vomit|hakidasu|吐き出す|4494||
5064|kowasu, 壊す, break, smash, destroy, demolish, wreck, ruin, spoil, damage, break, destroy, demolish, break (a bill, etc.)|kowasu|壊す|4495;7454;7455||
5065|miidasu, 見出す, find out, discover, notice, detect, select, pick out, look outside, be wide-eyed (in surprise, anger…), 見いだす, 見出す|miidasu|見出す|4496|見いだす, 見出す|
5066|wakasu, 沸かす, boil, heat (a liquid), excite|wakasu|沸かす|4497||
5067|omoidasu, 思い出す, recall, remember, recollect (lit. pull out a memory)|omoidasu|思い出す|4498||
5068|hikkosu, 引っ越す, move (residence)|hikkosu|引っ越す|4499||
5069|damasu, 騙す, trick, cheat, deceive|damasu|騙す|4500||
5070|hagemasu, 励ます, encourage, cheer, raise (the voice)|hagemasu|励ます|4501||
5071|hazusu, 外す, unfasten, undo, remove, take off, uninstall, leave, step out, slip away, miss (a target)|hazusu|外す|4502||
5072|herasu, 減らす, abate, decrease, diminish, shorten|herasu|減らす|4503||
5073|hiyakasu, 冷やかす, banter, make fun of, jeer at, cool, refrigerate|hiyakasu|冷やかす|4504||
5074|hiyasu, 冷やす, cool (from room temperature), chill, refrigerate, calm down, cool off, regain one's composure, relax, be frightened (at), be scared (of)|hiyasu|冷やす|4505||
5075|horobosu, 滅ぼす, destroy, overthrow, wreck, ruin|horobosu|滅ぼす|4506||
5076|hosu, 干す, air, dry, desiccate, drain (off), drink up, deprive (of a role, job, etc.)|hosu|干す|4507||
5077|iiarawasu, 言い表す, express (in words), confess|iiarawasu|言い表す|4508||
5078|iidasu, 言い出す, start talking, speak, tell, propose, suggest, break the ice|iidasu|言い出す|4509||
5079|iifurasu, 言い触らす, spread a rumor, spread a rumour, talk about|iifurasu|言い触らす|4510||
5080|iikaesu, 言い返す, talk back, answer back, retort, say again, repeat words, say repeatedly|iikaesu|言い返す|4511||
5081|musu, 蒸す, steam, poultice, be sultry|musu|蒸す|4512||
5082|jukusu, 熟す, ripen, mature, be ready for action, be the right time (act), be in common use, come sound natural, become skilled|jukusu|熟す|4513||
5083|kaesu, 返す, return (something), restore, put back, turn over, turn upside down, overturn, pay back, retaliate, reciprocate|kaesu|返す|4514||
5084|kaesu, 孵す, hatch, incubate|kaesu|孵す|4515||
5085|kakusu, 隠す, hide, conceal (something)|kakusu|隠す|4516||
5086|kawakasu, 乾かす, dry (clothes, etc.), desiccate|kawakasu|乾かす|4517||
5087|kokorozasu, 志す, plan, intend, aspire to, set aims on, set sights on|kokorozasu|志す|4518||
5088|korasu, 凝らす, concentrate, devote (oneself), apply (oneself), strain, rack|korasu|凝らす|4519||
5089|korosu, 殺す, kill|korosu|殺す|4520||
5090|kosu, 越す, cross over (e.g. mountain), go across, pass time (e.g. a winter), move house|kosu|越す|4521||
5091|kurasu, 暮らす, live, get along, spend (time)|kurasu|暮らす|4522||
5092|kurikaesu, 繰り返す, repeat, do something over again|kurikaesu|繰り返す|4523||
5093|kuzusu, 崩す, destroy, pull down, make change (money), destroy, demolish, pull down, tear down, level, disturb, put into disorder, throw off balance, make shaky, relax (one's pose), make oneself at ease, break (a bill), change, make change, write in cursive style, write in running style, break into a smile, let off a smile, lower (a price)|kuzusu|崩す|4524;7804;7805;7806;7807;7808;7809;7810||
5094|makasu, 負かす, defeat|makasu|負かす|4525||
5095|minasu, 見なす, consider as, regard (as equivalent), deem (as), equate|minasu|見なす|4526||
5096|minogasu, 見逃す, miss, overlook, leave at large, let pass|minogasu|見逃す|4527||
5097|modosu, 戻す, restore, put back, return, give back|modosu|戻す|4528||
5098|morasu, 漏らす, let leak, reveal, leak, give utterance, vent, express, wet one's pants, omit, leave out|morasu|漏らす|4529||
5099|nagasu, 流す, drain, pour, spill, shed (blood, tears), wash away, distribute (e.g. electricity over wires), circulate, broadcast, beam, cruise (e.g. taxi), float, set adrift, call off (a meeting, etc.)|nagasu|流す|4530||
5100|nakusu, 無くす, lose something, get rid of|nakusu|無くす|4531||
5101|naosu, 治す, cure, heal, fix, correct, repair|naosu|治す|4532;6960||
5102|nobasu, 伸ばす, grow long (beard, hair, etc.), lengthen, extend, stretch, reach out, hold out, straighten, smooth out, spread evenly (dough, cream, etc.), dilute, thin out, prolong, strengthen, develop, expand, grow long (e.g. hair, nails), reach out, hold out, straighten, smooth out, spread evenly (dough, cream, etc.), dilute, thin out, postpone, prolong, strengthen, develop, expand|nobasu|伸ばす|4533;8366;8367;8368;8369;8370;8371;8372;8373||
5103|otosu, 落とす, drop, lose, fail, let fall, shed (light), cast (one's gaze), pour in (liquid), leave (out, behind), clean off (dirt), remove (stains), omit, secretly let escape, reject (an applicant), defeat, lower (voice), lessen (body weight), worsen (quality), reduce (popularity), speak badly of, make one's own, conquer, force (a confession), deal with, download, copy (IT term), finish (a story)|otosu|落とす|4534||
5104|sasu, 射す, shine|sasu|射す|4535||
5105|shimesu, 示す, denote, show, point out, indicate, exemplify|shimesu|示す|4536||
5106|tamesu, 試す, attempt, test, try out|tamesu|試す|4537||
5107|taosu, 倒す, throw down, bring down, fell, knock down / over, kill, defeat, beat, overthrow, trip up, ruin, leave unpaid, cheat|taosu|倒す|4538||
5108|tasu, 足す, add (numbers, something), take care of (e.g. one's business)|tasu|足す|4539||
5109|ugokasu, 動かす, move (object, feelings), shift, operate, set in motion, mobilize, mobilise, inspire, rouse, influence, deny, change|ugokasu|動かす|4540||
5110|utsusu, 移す, change, swap, substitute, transfer, spend time, take time, infect, permeate, move on (the next stage)|utsusu|移す|4541||
5111|watasu, 渡す, ferry across (a river, etc.), carry across, traverse, build across, hand over, hand in, pass, give, transfer, send|watasu|渡す|4542||
5112|yurusu, 許す, permit, allow, approve, exempt (from fine), excuse (from), pardon, forgive, release, let off, confide, give up, yield|yurusu|許す|4543||
5113|kakusu, 画す, demarcate, mark, divide, map out, draw (a line), plan|kakusu|画す|4544||
5114|kakusu, 馘す, behead (archaic), fire|kakusu|馘す|4545||
5115|kakusu, 角す, compare (e.g. in a competition)|kakusu|角す|4546||
5116|kakusu, 嚇す, threaten, menace (archaic)|kakusu|嚇す|4547||
5117|korasu, 懲らす, chastise, punish, discipline|korasu|懲らす|4548||
5118|kosu, 越す, cross over (e.g. mountain), go across, pass time (e.g. a winter), move house|kosu|越す|4549||
5119|kosu, 濾す, filter, strain|kosu|濾す|4550||
5120|kosu, 鼓す, beat (a drum), pluck up courage|kosu|鼓す|4551||
5121|makasu, 任す, entrust, leave a person|makasu|任す|4552||
5122|nakusu, 亡くす, lose someone (wife, child, etc.)|nakusu|亡くす|4553||
5123|naosu, 直す, fix, correct, repair, replace, convert (ina different state), transform|naosu|直す|4554||
5124|nobasu, 延ばす, grow long (beard, hair, etc.), lengthen, extend, stretch, reach out, hold out, straighten, smooth out, spread evenly (dough, cream, etc.), dilute, thin out, prolong, strengthen, develop, expand|nobasu|延ばす|4555||
5125|sasu, 差す, shine, be visible, rise (of water levels), flow in, be felt (i.e. as an emotion)|sasu|差す|4556||
5126|sasu, 注す, pour, add (liquid), serve (drinks)|sasu|注す|4557||
5127|sasu, 点す, put on (lipstick, etc.), apply, colour, dye, light (a fire), burn|sasu|点す|4558||
5128|sasu, 刺す, pierce, stab, prick, stick, thrust, sew, stitch, embroider, sting, bite|sasu|刺す|4559||
5129|sasu, 差す, hold up (an umbrella, etc.), put up, raise, insert, put in, pole (a boat), put on (lipstick, etc.), apply, colour, dye, light (a fire), burn|sasu|差す|4560||
5130|sasu, 指す, point, nominate, select someone, identify, indicate, point out, play (shogi), extend one's arm straight ahead (in dance)|sasu|指す|4561||
5131|sasu, 挿す, insert, put in, strike, arrange (flowers)|sasu|挿す|4562||
5132|sasu, 螫す, sting (i.e. bee, wasp..., archaic)|sasu|螫す|4563||
5133|sasu, 鎖す, shut, close, lock, fasten|sasu|鎖す|4564||
5134|tozasu, 閉ざす, plunge (in grief), grieve|tozasu|閉ざす|4565||
5135|shimesu, 湿す, wet, moisten, dampen|shimesu|湿す|4566||
5136|okosu, 興す, revive, retrieve (fortunes), raise up|okosu|興す|4567||
5137|okosu, 熾す, light a fire|okosu|熾す|4568||
5138|utsusu, 写す, transcribe, duplicate, copy, reproduce, imitate, trace (e.g. on paper), describe, film, picture, photograph|utsusu|写す|4569||
5139|utsusu, 映す, project, reflect, cast (shadow)|utsusu|映す|4570||
5140|kasu, 課す, levy, charge, assess, impose, assign|kasu|課す|4571||
5141|uchifusu, 打ち伏す, mask oneself, lie down|uchifusu|打ち伏す|4572||
5142|utsubusu, 俯す, lie face down (e.g. on the ground, napping on a desk), lie prone, lower (one's head, gaze, etc.) (archaic)|utsubusu|俯す|4573||
5143|fusu, 臥す, lie down (in bed)|fusu|臥す|4574||
5144|gasu, 臥す, lie down (in bed), take one's bed (archaic)|gasu|臥す|4575||
5145|shirusu, 記す, write down, note, jot down, remember|shirusu|記す|4576||
5146|tsubusu, 潰す, smash, crush, shut down, thwart, block, kill (time), waste (e.g. talents)|tsubusu|潰す|4577||
5147|mezasu, 目指す, aim at, have an eye on|mezasu|目指す|4578||
5148|neraisumasu, 狙い澄ます, aim carefully at|neraisumasu|狙い澄ます|4579||
5149|orosu, 下ろす, take down (e.g. flag), launch (e.g. boat), drop, lower (e.g. ladder), unload, discharge, withdraw money from an account, wear for the first time|orosu|下ろす|4580||
5150|orosu, 降ろす, drop off (a passenger)|orosu|降ろす|4581||
5151|orosu, 卸す, fillet (e.g. a fish), cut up, grate, sell wholesale|orosu|卸す|4582||
5152|orosu, 堕ろす, abort (an embryo or foetus), have an abortion|orosu|堕ろす|4583||
5153|hanasu, 離す, separate, part, divide, keep apart|hanasu|離す|4584||
5154|hanasu, 放す, release, let go, free, set free, let loose, turn loose|hanasu|放す|4585||
5155|moyasu, 燃やす, burn|moyasu|燃やす|4586||
5156|tsuredasu, 連れ出す, take out|tsuredasu|連れ出す|4587||
5157|oiotosu, 追い落とす, disperse, take a castle|oiotosu|追い落とす|4588||
5158|yokosu, 寄越す, send, forward, hand over|yokosu|寄越す|4589||
5159|shimekorosu, 絞め殺す, strangle death|shimekorosu|絞め殺す|4590||
5160|toridasu, 取り出す, take out, produce, pick out, fetch, retrieve|toridasu|取り出す|4591||
5161|abaredasu, 暴れ出す, grow restive, begin act violently|abaredasu|暴れ出す|4592||
5162|kagidasu, 嗅ぎ出す, scent out, detect|kagidasu|嗅ぎ出す|4593||
5163|toorikosu, 通り越す, go past (something), go beyond|toorikosu|通り越す|4594||
5164|yousu, 要す, need, require, take, demand|yousu|要す|4595||
5165|nigedasu, 逃げ出す, run away, escape from|nigedasu|逃げ出す|4596||
5166|nigasu, 逃がす, let loose, set free, let escape, set free, let go, release, miss (e.g. a chance), lose, let get away, fail to catch|nigasu|逃がす|4597;7463;7464||
5167|nogasu, 逃す, let loose, set free, let escape, miss|nogasu|逃す|4598||
5168|iotosu, 射落とす, shoot down, win, gain|iotosu|射落とす|4599||
5169|tatakiotosu, 叩き落とす, knock down, knock off|tatakiotosu|叩き落とす|4600||
5170|niburasu, 鈍らす, blunt, dull, weaken|niburasu|鈍らす|4601||
5171|motonimodosu, 鈍らす, start over, reset, restore, return the point (of a discussion), return something (that has been moved), reconstitute|motonimodosu|鈍らす|4602;4603||
5172|hikidasu, 引き出す, pull out, take out, draw out, withdraw|hikidasu|引き出す|4604||
5173|miorosu, 見下ろす, overlook, command a view of, look down on, despise, 見おろす|miorosu|見下ろす|4605|見おろす|
5174|toosu, 通す, stick through, force through, spread throughout, thoroughly diffuse, make a path between two points, proceed in a logical manner, let pass, allow through, lead (someone) in(a house, room, etc.), show in, go through (a middleman), (look, listen) through (a window, wall, etc.), pass (a law, applicant, etc.), force accept, force agreement, continue (in a state), persist in, do the entirety of, cover all of, span the whole, do from beginning end without a break, convey (one's ideas, etc.) the other party, do the end, carry through, complete, 徹す, 透す|toosu|通す|4606|徹す, 透す|
5175|tobasu, 飛ばす, fly, fire, hurl, launch, skip over, omit, drop (e.g. stitch), run or drive fast, gallop, spread a rumour (rumor), tell a story, remove, get rid of, transfer, attack, jeer at, let fly, make fly, send flying, blow off (e.g. in the wind), launch, fire, hurl, shoot, skip over, leave out, omit, drop (e.g. a stitch), run fast, drive fast, gallop, spray, splash, spatter, say without reservation, call out (e.g. a jeer), rattle of (e.g. a joke), spread (e.g. a rumour), circulate, send out (a message), issue (e.g. an appeal), transfer (to a less important post), send away (e.g. to a provincial branch), demote, dispatch quickly (e.g. a reporter), get rid of, burn off (alcohol), attack (e.g. with a leg manoeuvre), do vigorously, do roughly, do energetically|tobasu|飛ばす|4607;6991;6992;6993;6994;6995;6996;6997;6998;6999;7000;7001||
5176|tobidasu, 飛び出す, jump out, rush out, fly out, appear (suddenly), protrude, project, butt in, 飛出す, 跳び出す|tobidasu|飛び出す|4608|飛出す, 跳び出す|
5177|tarasu, 鳴らす, ring, sound, chime, beat, snort (nose)|tarasu|鳴らす|4609||
5178|sugosu, 過ごす, pass (time), spend, overdo (esp. of one's alcohol consumption), drink (alcohol), 過す|sugosu|過ごす|4610|過す|
5179|yobitasu, 呼び出す, summon, call (e.g. phone), convene, decoy, lure, invoke (e.g. subroutine), call, 喚び出す, 呼出す|yobitasu|呼び出す|4611|喚び出す, 呼出す|
5180|terasu, 照らす, shine on, illuminate, compare (with), refer to|terasu|照らす|4612;6990||
5181|hihikaesu, 引き返す, repeat, send back, bring back, retrace one's steps, 引返す, 引きかえす|hihikaesu|引き返す|4613|引返す, 引きかえす|
5182|minaosu, 見直す, look again, get a better opinion of, 見なおす|minaosu|見直す|4614|見なおす|
5183|samasu, 覚ます, awaken, disabuse, sober up, 醒ます|samasu|覚ます|4615|醒ます|
5184|arawasu, 現す, reveal, show, display, indicate, 表わす|arawasu|現す|4616|表わす|
5185|arawasu, 表す, express, represent, signify, stand for|arawasu|表す|4617||
5186|arawasu, 顕す, make widely known|arawasu|顕す|4618||
5187|ryakusu, 略す, abbreviate, omit, take, capture|ryakusu|略す|4619||
5188|nasu, 成す, build up, establish, form, become (a state), |nasu|成す|4620||
5189|nasu, 為す, accomplish, achieve, succeed in, change into, do, perform, build up, establish, form, become (a state), change into, do, perform|nasu|為す|4621;7850;7851;7852;7853||
5190|nasu, 生す, have a child|nasu|生す|4622||
5191|oyobosu, 及ぼす, exert, cause, exercise|oyobosu|及ぼす|4623||
5192|odorokasu, 驚かす, surprise, frighten, create a stir|odorokasu|驚かす|4624||
5193|odokasu, 脅かす, threaten, menace, startle, surprise, 嚇かす, 威かす|odokasu|脅かす|4625|嚇かす, 威かす|
5194|nayamasu, 悩ます, afflict, torment, harass, molest|nayamasu|悩ます|4626||
5195|mitasu, 満たす, satisfy, fulfill, appease, fill (e.g. a cup), pack, reach (a certain number), satisfy (conditions, one's appetite, etc.), meet (e.g. demands), fulfill, gratify, fill (e.g. a cup), pack, supply, 充たす|mitasu|満たす|4627;7834;7835|充たす|
5196|ikasu, 生かす, make (the best) use of, leverage (skills, attributes, experience, etc.), capitalise on (experience, etc), let live, keep alive, revive, resuscitate, 活かす|ikasu|生かす|4628|活かす|
5197|zurasu, 滑らす, shift, slide (e.g. something away from something else), move (e.g. something out of the way), put off, delay, postpone, stagger (e.g. working hours)|zurasu|滑らす|4629||
5198|hashiridasu, 走り出す, begin run, start running, 走りだす|hashiridasu|走り出す|4630|走りだす|
5199|samasu, 冷ます, cool, dampen, let cool, spoil|samasu|冷ます|4631||
5200|horidasu, 掘り出す, dig out, pick out|horidasu|掘り出す|4632||
5201|yurasu, 揺らす, rock, shake, swing|yurasu|揺らす|4633||
5202|hatasu, 果たす, accomplish, achieve, carry out, fulfill, realize, execute, perform, do, accomplish, achieve, carry out, fulfill, fulfil, realize, execute, perform, do, do ... completely, do ... entirely, 果す|hatasu|果たす|4634;7671;7672|果す|
5203|fukidasu, 吹き出す, spout out, spurt out, gush out, jet out, sprout, bud|fukidasu|吹き出す|4635||
5204|mawasu, 回す, turn, rotate, gyrate, circulate, send around, surround, 廻す|mawasu|回す|4636|廻す|
5205|torikesu, 取り消す, cancel, withdraw, retract, take back, revoke, 取消す|torikesu|取り消す|4637|取消す|
5206|furiorosu, 振り下ろす, swing downward|furiorosu|振り下ろす|4638||
5207|ketaosu, 蹴倒す, kick over, kick down|ketaosu|蹴倒す|4639||
5208|midasu, 乱す, throw out of order, disarrange, disturb|midasu|乱す|4640||
5209|kudasu, 下す, make (a decision), pass (judgement, etc), hand down (orders, etc), let go down, lower, do by oneself|kudasu|下す|4641||
5210|hagasu, 剥がす, tear off, peel off, rip off, trip off, skin, flay, disrobe, deprive of, detach, disconnect|hagasu|剥がす|4642||
5211|sosonokasu, 唆す, instigate, tempt|sosonokasu|唆す|4643||
5212|jirasu, 焦らす, irritate, tease|jirasu|焦らす|4644||
5213|kasu, 化す, change into, convert to, transform, be reduced, influence, improve|kasu|化す|4645||
5214|takusu, 託す, entrust, make an excuse of, 托す|takusu|託す|4646|托す|
5215|uchidasu, 打ち出す, begin, beat, end, close, set out (forth), work out, hammer out, emboss, print out, print, work out (e.g. policy), hammer out, come out with, set forth, strike (a drum indicating the end of a performance), begin striking, start beating|uchidasu|打ち出す|4647;8565;8566;8567;8568;8569||
5216|uchikesu, 打ち消す, deny, contradict, negate (esp. a sound), drown out, 打消す|uchikesu|打ち消す|4648|打消す|
5217|oshitaosu, 押し倒す, push down, 押倒す|oshitaosu|押し倒す|4649|押倒す|
5218|torikobosu, 取り零す, lose an easy game, suffer an unexpected defeat, lose information (IT term), 取りこぼす, 取零す|torikobosu|取り零す|4650|取りこぼす, 取零す|
5219|barasu, ばらす, expose, lay open (e.g. secret), take pieces, kill, murder|barasu|ばらす|4651||
5220|arainaosu, 洗い直す, wash again, reconsider, 洗いなおす|arainaosu|洗い直す|4652|洗いなおす|
5221|arainagasu, 洗い流す, wash away, rinse off|arainagasu|洗い流す|4653||
5222|okuridasu, 送り出す, send out, forward, show (a person) out|okuridasu|送り出す|4654||
5223|umidasu, 生み出す, create, bing forth, produce, invent, give bith to, bear, 産み出す|umidasu|生み出す|4655|産み出す|
5224|dokasu, 退かす, remove|dokasu|退かす|4656||
5225|maniawasu, 間に合わす, make something be done on time|maniawasu|間に合わす|4657||
5226|arukidasu, 歩き出す, start walk|arukidasu|歩き出す|4658||
5227|noridasu, 乗り出す, set out, sail, begin ride, lean forward, 乗出す|noridasu|乗り出す|4659|乗出す|
5228|egakidasu, 描き出す, delineate, draw, express, imagine|egakidasu|描き出す|4660||
5229|misugosu, 見過ごす, let go by, let pas, overlook, miss|misugosu|見過ごす|4661||
5230|buttobasu, ぶっ飛ばす, strike (as send flying), beat, knock, jump with force, leap|buttobasu|ぶっ飛ばす|4662||
5231|kechirasu, 蹴散らす, kick about|kechirasu|蹴散らす|4663||
5232|okurikaesu, 送り返す, send back, return|okurikaesu|送り返す|4664||
5233|furidasu, 降り出す, begin rain, start rain|furidasu|降り出す|4665||
5234|furidasu, 振り出す, shake and give, start shaking, shake out, write (draw) on a check (cheque)|furidasu|振り出す|4666||
5235|yogosu, 汚す, pollute, contaminate, soil, make dirty, stain, disgrace, dishonour, dishonor, defile|yogosu|汚す|4667||
5236|nesugosu, 寝過ごす, oversleep|nesugosu|寝過ごす|6091||
5237|matasu, 待たす, keep (a person) waiting|matasu|待たす|7821||
5238|iku, 行く, go, 往く, 逝く|iku|行く|4668|往く, 逝く|
5239|itadaku, 頂く, receive, get, accept, take, buy, eat, drink, be crowned with, eat, drink, be crowned with, wear (on one's head), have (on top), have (as one's leader), live under (a ruler), install (a president), get somebody to do something, 戴く|itadaku|頂く|4669;6892;6893;6894;6895|戴く|
5240|kaku, 書く, write, compose, pen, draw, paint|kaku|書く|4670;8242||
5241|kaku, 描く, draw, paint, sketch|kaku|描く|4671||
5242|hataraku, 働く, work, labor, labour, function, operate, commit a crime, perpetrate, be conjugated|hataraku|働く|4672||
5243|aku, 空く, be vacant, be empty, be free, be available|aku|空く|4673||
5244|tsuku, 付く, come with, stick, be attached, be connected with, adhere, cling, remain imprinted, scar, stain, dye, bear (fruit, interest, etc), be acquired (of a habit, ability, etc), increase (in strength, etc), take root, accompany, attend, follow, study with, side with, belong to|tsuku|付く|4674||
5245|tsuku, 着く, arrive, reach, sit on, sit at (e.g. table), arrive at, reach, sit on, sit at (e.g. the table)|tsuku|着く|4675;8019;8020||
5246|saku, 咲く, bloom|saku|咲く|4676||
5247|kiduku, 気づく, notice, become aware of, sense, recognize, recognise, perceive, realize, realise, kizuku|kiduku|気づく|4677|kizuku|
5248|todoku, 届く, reach, arrive, get through, get at, be attentive, pay attention, be delivered, carry (e.g. sound), be attentive, pay attention, be delivered, carry (e.g. sound)|todoku|届く|4678;7977;7978||
5249|hiku, 引く, pull, draw (attention, etc.), attract (interest, etc.), draw back, draw (a card), draw (a plan, a line...), catch (a cold), look up (e.g. dictionary), consult, inherit (a characteristic), quote, raise (as evidence), lay (a cable)|hiku|引く|4679||
5250|hiku, 弾く, play (a string instrument)|hiku|弾く|4680||
5251|kiku, 聞く, hear, listen, ask, enquire, query|kiku|聞く|4681||
5252|kiku, 聴く, listen, be told, obey, follow, ask, enquire, query, 聞く|kiku|聴く|4682|聞く|
5253|kiku, 訊く, ask, enquire, query, listen (formal), 聞く|kiku|訊く|4683|聞く|
5254|suku, 空く, be less crowded|suku|空く|4684||
5255|aruku, 歩く, walk|aruku|歩く|4685||
5256|migaku, 磨く, brush, polish|migaku|磨く|4686||
5257|ugoku, 動く, function, move|ugoku|動く|4687||
5258|aku, 開く, open, be open (esp. door)|aku|開く|4688||
5259|aku, 明く, be open, have been opened (e.g. neckline, eyes), come an end, end|aku|明く|4689||
5260|aku, 明く, open (e.g. eyes, mouth)|aku|明く|4690||
5261|naku, 泣く, cry, weep, sob, howl|naku|泣く|4691||
5262|naku, 鳴く, sing (bird), bark, purr, mew, moo, make a sound (animal)|naku|鳴く|4692||
5263|odoroku, 驚く, be surprised, be astonished|odoroku|驚く|4693||
5264|kawaku, 乾く, become dry, get dry|kawaku|乾く|4694||
5265|daku, 抱く, embrace, hold in the arms (e.g. a baby), hug, have sex with, make love to, sleep with, sit on eggs, bear (e.g. a grudge)|daku|抱く|4695||
5266|fuku, 拭く, wipe, dry|fuku|拭く|4696||
5267|fuku, 吹く, blow (wind, etc.), play a wind instrument, whistle, laugh (slang), blow (e.g. wind), play a wind instrument, laugh, burst into laughter, smelt, mint, brag, talk big|fuku|吹く|4697;7359;7360;7361;7362||
5268|haku, 掃く, sweep, brush, gather up|haku|掃く|4698||
5269|haku, 履く, put on (or wear) lower-body clothing (i.e. pants, skirt, footwear…), affix a sword one's hip, affix a bowstring a bow|haku|履く|4699||
