Index|KEYWORDS|Roumaji construction|Kana construction|Meaning|Alternate Spellings|Extra keywords|Preposition|Kanji Root|Latin Root|Exception index|
11653|ataru, 当たる, touch, be in contact, be affixed, succeed, be cruised, spoil (of a fruit), be hit, strike, be equivalent to, be applicable, apply to, be right on the money (of a prediction, criticism, etc.), be selected (in a lottery, etc.), win, be successful, go well, be a hit, face, confront, lie (in the direction of), undertake, be assigned, be stricken (by food poisoning, heat, etc.), be afflicted, be called upon (by the teacher), treat (esp. harshly), lash out at, be unnecessary, be hitting well, be on a hitting streak,  fishing) to feel a bite,  fruit, etc.) to be bruised, spoil, feel (something) out, probe into, check (i.e. by comparison), shave, be a relative of a person, stand in a relationship, feel something out, be called on (e.g. by a teacher), 中たる, 当る, 中る|ataru|当たる|5176;14276;14277;14278;14279;14280;14281;14282;14283;14284;14285;14286;14287;14288;14289;14290;14291;14292;14293;5177;20135|中たる, 当る, 中る|||当た|ata|55|
11654|hamaru, 嵌る, fit, get into, go into, be fit for, be suited for, satisfy (conditions), fall into, plunge into, get stuck, get caught, be deceived, be taken in, fall in a trap, be addicted to, be deep into, be crazy about, be stuck on, 填まる, 嵌まる, 填る|hamaru|嵌る|5178|填まる, 嵌まる, 填る|||嵌|hama|55|
11655|asaru, 漁る, fish, look for, search for, hunt for, scavenge, scrounge, look through, rummage through, go on a spree (spending, reading, etc.), binge|asaru|漁る|5179;8115;8116||||漁|asa|55|
11656|naru, 鳴る, sound, ring, resound, echo, roar, rumble|naru|鳴る|5180||||鳴|na|55|
11657|utsuru, 移る, elapse (time), spread (e.g. fire), move (house), transfer (department), change the target of interest or concern, elapse (passage of time), be permeated by a colour or scent, be infected, be contagious, spread (as in fire), 遷る|utsuru|移る|5181;10245;10246;10247;10248;10249|遷る|||移|utsu|55|
11658|tomaru, 泊まる, stay at (e.g. hotel), lodge at, be docked, be berthed, be moored, 泊る|tomaru|泊まる|5182;7224|泊る|||泊ま|toma|55|
11659|tsuru, 釣る, fish, angle, catch, lure in, tempt, attract, entice, allure, を|tsuru|釣る|5183;8549|||を|釣|tsu|55|
11660|kudaru, 下る, descend, go down, come down, be handed down (of an order, judgment, etc.), pass (of time), surrender, capitulate, be less than, be inferior to, have the runs, have diarrhea, pass (in stool), be discharged from the body, depreciate oneself, be humble, 降る|kudaru|下る|5184;15999;16000;16001;16002;16003;16004;16005|降る|||下|kuda|55|
11661|miokuru, 見送る, see off (e.g. the station, an airport, etc.), farewell, see out, send off, watch a batted ball go inthe stands, see someone off (at a station, an airport, etc.), escort (e.g. home), follow something with one's eyes until it is out of sight, let pass, pass up (an opportunity etc.), let a pitch go by (baseball), watch a batted ball go into the stands, shelve (a plan, deliberation on a bill, etc.), postpone, have someone related or close to you die, bury someone, take care of somebody until he dies, wait and see, continue (e.g. in legal contexts), を|miokuru|見送る|5186;9757;9758;9759;9760;9761;9762;9763|||を|見送|mioku|55|
11662|hakaru, 計る, measure, weigh, survey, time (sound, gauge, estimate), conjecture, infer, surmise, 測る, 量る, を|hakaru|計る|5187|測る, 量る||を|計|haka|55|
11663|hirogaru, 広がる, spread (out), extend, stretch, reach to, get around, fill (e.g. a space), 拡がる|hirogaru|広がる|5188|拡がる|||広が|hiroga|55|
11664|kuwawaru, 加わる, be subject (e.g. pressure), be added to, be appended, join in (e.g. a group of friends), participate, increase (e.g. heat), gain in (e.g. influence), grow, gather (speed), be applied (e.g. heat, pressure), be exerted|kuwawaru|加わる|5189;19251;19252;19253;19254||||加わ|kuwawa|55|
11665|kotowaru, 断る, refuse, reject, dismiss, turn down, decline, inform, give notice, tell in advance, ask leave, excuse oneself (from), 断わる, を|kotowaru|断る|5190;8820;8821|断わる||を|断|kotowa|55|
11666|tsutawaru, 伝わる, be handed down, be introduced, be transmitted, be circulated, go along, walk along|tsutawaru|伝わる|5191||||伝わ|tsutawa|55|
11667|atehamaru, 当てはまる, apply (a rule), be applicable, come under (a category), fulfill, hold true, 当て嵌まる, を|atehamaru|当てはまる|5192|当て嵌まる||を|当てはま|atehama|55|
11668|kubaru, 配る, distribute, deliver, deal (cards), を|kubaru|配る|5193|||を|配|kuba|55|
11669|donaru, 怒鳴る, shout, yell, 呶鳴る|donaru|怒鳴る|5194|呶鳴る|||怒鳴|dona|55|
11670|tsukamaru, 捕まる, be caught, be arrested, hold on to, grasp, find (e.g. proof), get (e.g. a taxi), be detained by, 捉まる, 摑まる|tsukamaru|捕まる|5195;12040;12041;12042|捉まる, 摑まる|||捕ま|tsukama|55|
11671|tsukamaru, 掴まる, hold on to, 捉まる, 摑まる|tsukamaru|掴まる|5196|捉まる, 摑まる|||掴ま|tsukama|55|
11672|azukaru, 預かる, take charge of, receive on deposit, look after, take care of, keep, hold on to, keep in custody, be put in charge of, be given responsibility for, be entrusted with, withhold (an announcement), reserve (judgment), leave undecided, take upon oneself (to do), settle (a matter) oneself, を|azukaru|預かる|5197;9340;9341;9342;9343|||を|預か|azuka|55|
11673|uragiru, 裏切る, betray, turn traitor to, double-cross, を|uragiru|裏切る|5198|||を|裏切|uragi|55|
11674|itaru, 至る, arrive at (e.g. a decision), reach (a stage), attain, lead (a place), lead to (a place), get to, the extreme case of, come, arrive, result in, 到る|itaru|至る|5199;7709;7710;7711|到る|||至|ita|55|
11675|yuzuru, 譲る, transmit, dispose of, hand over, transfer, turn over, assign, convey, bequeath, give up (e.g. one's seat), give way, yield, concede, give ground, surrender, sell, postpone, put off, defer, を|yuzuru|譲る|5200;10327;10328;10329;10330;10331|||を|譲|yuzu|55|
11676|shiboru, 絞る, wring, squeeze, press, 搾る, を|shiboru|絞る|5201|搾る||を|絞|shibo|55|
11677|tsunagaru, 繋がる, be tied together, be connected to, be linked to, lead to, be related to, be related (by blood), 接続る,  繫がる|tsunagaru|繋がる|19833;19834;19835|接続る,  繫がる|||繋が|tsunaga|55|
11678|soru, 剃る, shave, suru, を|soru|剃る|5203|suru||を|剃|so|55|
11679|shiagaru, 仕上がる, be finished, be completed, be done, 仕上る|shiagaru|仕上がる|5204|仕上る|||仕上が|shiaga|55|
11680|osowaru, 教わる, be taught, を|osowaru|教わる|5205|||を|教わ|osowa|55|
11681|fukamaru, 深まる, deepen, heighten, intensify|fukamaru|深まる|5206||||深ま|fukama|55|
11682|monogataru, 物語る, tell, indicate, を|monogataru|物語る|5207|||を|物語|monogata|55|
11683|kugiru, 区切る, demarcate, delimit, divide (an area), mark off, cut off, punctuate, put an end to (e.g. a sentence), insert pauses or breaks (e.g. when reading aloud), 句切る, を|kugiru|区切る|5208;16010|句切る||を|区切|kugi|55|
11684|kugiru, 句切る, punctuate, put an end (e.g. a sentence), insert pauses or breaks (e.g. when reading aloud), を|kugiru|句切る|5209|||を|句切|kugi|55|
11685|tsumaru, 詰まる, be blocked, be packed, hit the ball near the handle of the bat (baseball)|tsumaru|詰まる|5210||||詰ま|tsuma|55|
11686|chikayoru, 近寄る, approach, draw near, 近よる|chikayoru|近寄る|5211|近よる|||近寄|chikayo|55|
11687|shimeru, 湿る, be wet, become wet, be damp, be moist, be in low spirits, feel depressed|shimeru|湿る|5212||||湿|shime|55|
11688|uketamawaru, 承る, hear, be told, know, receive (order), undertake, comply, take (a reservation, etc.), 受け賜る, を|uketamawaru|承る|5213|受け賜る||を|承|uketamawa|55|
11689|saguru, 探る, feel around for, fumble for, grope for, search for, look for, investigate, probe into, spy on, sound out, explore (parts unknown), enjoy (natural beauty), を|saguru|探る|5214;12567;12568|||を|探|sagu|55|
11690|tsukuru, 造る, manufacture, build, construct on a large scale, を|tsukuru|造る|5215|||を|造|tsuku|55|
11691|tsukuru, 創る, create, make, produce, manufacture, build, construct with an emphasis on creation, を|tsukuru|創る|5216|||を|創|tsuku|55|
11692|kezuru, 削る, shave (wood or leather), sharpen, plane, whittle, pare, scrape off, shave off (e.g. a budget, expenses, a salary, etc.), curtail, cut down, cross out, reduce, curtail, remove, erase, delete, 梳る, を|kezuru|削る|5217|梳る||を|削|kezu|55|
11693|meguru, 巡る, go around, return, surround, concern (usu. of disputes), 回る, 廻る|meguru|巡る|5218|回る, 廻る|||巡|megu|55|
11694|noru, 載る, be placed on, be set on, be piled on, be loaded on|noru|載る|5219||||載|no|55|
11695|harikiru, 張り切る, stretch breaking point, be in high spirits, be full of vigor (vigour), be enthusiastic, be eager, stretch to breaking point|harikiru|張り切る|5220;12479||||張り切|hariki|55|
11696|kuguru, 潜る, go under, pass under|kuguru|潜る|5221||||潜|kugu|55|
11697|moguru, 潜る, dive (in or under water), get under, get into, get in, creep into, crawl under, bury oneself, burrow into, dig oneself into, snuggle under, hide oneself (esp. from the government), conceal oneself, go underground|moguru|潜る|5222||||潜|mogu|55|
11698|sakanoboru, 遡る, go upstream, go back (in time, origin), date back to, trace back to, make retroactive, 溯る, 逆上る, 泝る|sakanoboru|遡る|19505;19506|溯る, 逆上る, 泝る|||遡|sakanobo|55|
11699|tsuru, 吊る, hang, suspend (something from something), be hanged (by the neck), を|tsuru|吊る|5224|||を|吊|tsu|55|
11700|unaru, 唸る, groan, moan, roar, howl, growl, hum, buzz, sough, 呻る|unaru|唸る|5225|呻る|||唸|una|55|
11701|yomigaeru, 蘇る, be resurrected, be resuscitated, be rehabilitated, be revived, be refreshed, be restored, be recalled (e.g. memories), be brought back, 甦る, 甦える, 蘇える|yomigaeru|蘇る|5226|甦る, 甦える, 蘇える|||蘇|yomigae|55|
11702|naru, 生る, bear fruit|naru|生る|5227||||生|na|55|
11703|hikitoru, 引き取る, take over, take back, collect, claim, retire a private place, take charge of, take custody of, look after, take care of, adopt, retire to a private place, withdraw, get out, 引取る, 引きとる, を|hikitoru|引き取る|5228;7680;7681|引取る, 引きとる||を|引き取|hikito|55|
11704|takamaru, 高まる, rise, swell, be promoted|takamaru|高まる|5230||||高ま|takama|55|
11705|tamawaru, 賜る, be given, be granted, be honored with, be honoured with, give, bestow, confer, honor, honour, 賜わる, 給わる, を|tamawaru|賜る|5231|賜わる, 給わる||を|賜|tamawa|55|
11706|furikaeru, 振り返る, turn head, look over one's shoulder, turn around, look back, think back (on), reminisce, look back (on), reflect (on), 振りかえる, 振返る,  ふり返る|furikaeru|振り返る|5232;21011|振りかえる, 振返る,  ふり返る|||振り返|furikae|55|
11707|tsunoru, 募る, invite contributions, etc., solicit help, participation, etc., recruit (e.g. soldiers), grow violent, become stronger, become worse|tsunoru|募る|5233;5234||||募|tsuno|55|
11708|todomaru, 留まる, remain, abide, stay (in the one place), be limited to, be confined to, 止まる, 停まる, 駐まる|todomaru|留まる|5235|止まる, 停まる, 駐まる|||留ま|todoma|55|
11709|kiru, 斬る, kill (a human) using a blade (sword, machete, knife, etc.), slice (off), lop (off), cut (off), を|kiru|斬る|5236|||を|斬|ki|55|
11710|taru, 足る, be sufficient, be enough, be worth doing, be worthy of, deserve, do (the job), serve, answer|taru|足る|5237;15309;15310||||足|ta|55|
11711|tachidomaru, 立ち止まる, stop, halt, stand still, 立ち止る, 立ちどまる, 立止る, 立ち留まる, 立留まる, 立留る|tachidomaru|立ち止まる|5238|立ち止る, 立ちどまる, 立止る, 立ち留まる, 立留まる, 立留る|||立ち止ま|tachidoma|55|
11712|tachiagaru, 立ち上がる, stand up, get up, rise, recover, take action, start, make the initial charge, start up, boot up, 立上がる, 起ち上がる, 立ちあがる|tachiagaru|立ち上がる|10064;10065;10066;10067;10068;10069|立上がる, 起ち上がる, 立ちあがる|||立ち上が|tachiaga|55|
11713|tooru, 通る, go past, go along, travel along, pass through, use (a road), take (a route), go via, go by way of, run (between), operate (between), connectof public transport, go indoors, go in a room, be admitted, be shown in, be ushered in, come in, penetrate, pierce, skewer, go through, come through, permeate, soak into, spread throughout, carry (e.g. of a voice), reach far, be passed on (e.g. of a customer's order the kitchen), be relayed, be conveyed, pass (a test, a bill in the House, etc.), be approved, be accepted, go by (a name), be known as, be accepted as, have a reputation for, be coherent, be logical, be reasonable, be comprehensible, be understandable, make sense, get across (e.g. of one's point), be understood, be straight (e.g. wood grain), go indoors, go into a room, be admitted, be shown in, be ushered in, come in, be passed on (e.g. of a customer's order to the kitchen), be relayed, be conveyed, be well-informed, be wise, do ... completely, do ... thoroughly, 徹る, 透る|tooru|通る|5240;6429;6430;6431;6432;6433;6434;6435;6436;6437;6438;6439;7327;7328;7329;7330|徹る, 透る|||通|too|55|
11714|tsuresaru, 連れ去る, take away, kidnap, 連去る, を|tsuresaru|連れ去る|5241|連去る||を|連れ去|tsuresa|55|
11715|mawaru, 回る, turn, revolve, visit several places, function well, pass a certain time, 廻る|mawaru|回る|5242|廻る|||回|mawa|55|
11716|ukaru, 受かる, pass (an exam)|ukaru|受かる|5243||||受か|uka|55|
11717|furu, 振る, wave, shake, swing, turn down (someone), carry with vigor, bring up the main topic, sprinkle, throw (dice), cast (actor), allocate (work), turn down (somebody), reject, jilt, dump, abandon, give up, ruin, add kana indicating a reading of a word, slightly change headings, change directions, extract by broiling, prepare an infusion of, decoct, carry with great vigor (e.g. a portable shrine), bring up a topic, lead to a topic, replace, substitute, set up a joke for somebody else, を|furu|振る|5244;10695;10696;10697;10698;10699;10700;10701;10702;10703;10704;10705|||を|振|fu|55|
11718|fusagaru, 塞がる, be closed, be blocked, be healed (e.g. wound), be shut up, be clogged, be plugged up, be occupied, be taken (e.g. accomodation)|fusagaru|塞がる|5245||||塞が|fusaga|55|
11719|ubaitoru, 奪い取る, plunder, を|ubaitoru|奪い取る|5246|||を|奪い取|ubaito|55|
11720|yowarikiru, 弱り切る, faint, be exhausted|yowarikiru|弱り切る|5247||||弱り切|yowariki|55|
11721|uchikiru, 打ち切る, stop, abort, discontinue, close, 打切る|uchikiru|打ち切る|5248|打切る|||打ち切|uchiki|55|
11722|uchitoru, 討ち取る, arrest, take prisoner, kill, get someone out (in baseball), 討取る, 打ち取る, 打取る|uchitoru|討ち取る|5249|討取る, 打ち取る, 打取る|||討ち取|uchito|55|
11723|uchiyaburu, 打ち破る, break, smash, defeat, destroy, eliminate, 討ち破る, 打破る, 撃ち破る, うち破る|uchiyaburu|打ち破る|5250|討ち破る, 打破る, 撃ち破る, うち破る|||打ち破|uchiyabu|55|
11724|uchinomeru, 打ちのめる, knock down, beat (someone) up|uchinomeru|打ちのめる|5251||||打ちのめ|uchinome|55|
11725|uchimakuru, 打ちまくる, pound away, hit at random, hit ceaselessly, を|uchimakuru|打ちまくる|5252|||を|打ちまく|uchimaku|55|
11726|irekawaruru, 入れ替わる, change places, relieve one another, 入れ代わる|irekawaruru|入れ替わる|5253|入れ代わる|||入れ替わ|irekawaru|55|
11727|okuru, 贈る, send, give to, award to, confer on, give (as a gift), present, confer, bestow, award, を|okuru|贈る|5254;7190;7191|||を|贈|oku|55|
11728|amaru, 余る, remain, be left over, be in excess, be too many|amaru|余る|5255||||余|ama|55|
11729|kooru, 凍る, freeze, be frozen over, congeal, 氷る, 凍おる|kooru|凍る|5256|氷る, 凍おる|||凍|koo|55|
11730|semaru, 迫る, approach, draw near, be imminent, press (someone for something), urge, compel|semaru|迫る|5257;5258||||迫|sema|55|
11731|utsuru, 映る, be reflected, harmonize with (harmonise), come out (photo), be projected|utsuru|映る|5259||||映|utsu|55|
11732|utsuru, 写る, be photographed, be projected|utsuru|写る|5260||||写|utsu|55|
11733|mazaru, 混ざる, be mixed, be blended with, associate with, mingle with, join, 交ざる, 雑ざる|mazaru|混ざる|5261|交ざる, 雑ざる|||混ざ|maza|55|
11734|moru, 盛る, serve (food, etc.), fill up, prescribe|moru|盛る|5262||||盛|mo|55|
11735|masaru, 勝る, excel, surpass, exceed, have an edge, be superior, outrival, outweigh, preponderate, 優る|masaru|勝る|5263|優る|||勝|masa|55|
11736|haru, 貼る, stick, paste, affix, link|haru|貼る|5264||||貼|ha|55|
11737|tatoeru, 例える, illustrate, compare (something) to, liken, speak figuratively, use a simile, use a metaphor, 譬える, 喩える|tatoeru|例える|5266;13375|譬える, 喩える|||例え|tatoe|55|
11738|agaru, 揚がる, be deep fried|agaru|揚がる|5267||||揚が|aga|55|
11739|agaru, 挙がる, be arrested, turn up (of evidence, etc.), be listed (as a candidate)|agaru|挙がる|5268||||挙が|aga|55|
11740|te ni hairu, 手に入る, obtain, come possess, get hold of, get one's hands on, を|te ni hairu|手に入る|5269|||を|手に入|te ni hai|55|
11741|katachidukuru, 形作る, form, shape, make, mold, build up, を|katachidukuru|形作る|5270|||を|形作|katachiduku|55|
11742|yuru, 揺る, shake, jolt, rock (cradle), swing, を|yuru|揺る|18541|||を|揺|yu|55|
11743|arukimawaru, 歩き回る, walk about, walk to and fro, pace around|arukimawaru|歩き回る|6086||||歩き回|arukimawa|55|
11744|hibikiwataru, 響き渡る, resound, echo, reverberate|hibikiwataru|響き渡る|6090||||響き渡|hibikiwata|55|
11745|ogoru, 奢る, give (someone) a treat, be extravagant, live luxuriously, be proud, be haughty, 驕る, 傲る|ogoru|奢る|6115;6116;6117|驕る, 傲る|||奢|ogo|55|
11746|moriagaru, 盛り上がる, swell, rise, bulge, be piled up, rouse, get excited|moriagaru|盛り上がる|6854;6855||||盛り上が|moriaga|55|
11747|sasaru, 刺さる, stick into (of something with a sharp point), prick, pierce, get stuck (in), lodge (in)|sasaru|刺さる|6853||||刺さ|sasa|55|
11748|aitedoru, 相手取る, challenge (esp. in a lawsuit), take on an opponent (in negotiations, contest, etc.), 相手どる, を|aitedoru|相手取る|7543|相手どる||を|相手取|aitedo|55|
11749|norikiru, 乗り切る, weather (a storm, rough seas), ride across, sail across, get through (adversity), weather, get over, tide over, overcome, survive, load completely (e.g. books on a shelf, people or luggage in a car), を|norikiru|乗り切る|8906;8907;8908|||を|乗り切|noriki|55|
11750|uzukumaru, 蹲る, crouch, squat, cower, tsukubaru, 踞る|uzukumaru|蹲る|9039|tsukubaru, 踞る|||蹲|uzukuma|55|
11751|toorikakaru, 通りかかる, happen to pass by, 通り掛る, 通り掛かる|toorikakaru|通りかかる|9012|通り掛る, 通り掛かる|||通りかか|toorikaka|55|
11752|suru, 刷る, print, color or pattern fabric using a wooden mold, 摺る, を|suru|刷る|8983;8984|摺る||を|刷|su|55|
11753|suru, 擦る, rub, chafe, strike (match), file, frost (glass), lose (e.g. a match), forfeit, squander one's money (e.g. through gambling, Pachinko, etc.), 磨る, 擂る, 摩る, を|suru|擦る|8985;8986|磨る, 擂る, 摩る||を|擦|su|55|
11754|nekaseru, 寝かせる, put to bed, lay down lengthwise, put a thing on its side, set something aside unused, let lie idle, ferment, lay down (wine), を|nekaseru|寝かせる|11022;11023;11024;11025|||を|寝かせ|nekase|55|
11755|mitsukeru, 見つける, discover, find (e.g. an error in a book), come across, detect, spot, locate, find (e.g. something missing), find fault, be used to seeing, be familiar with, 見附ける, 見附る, mikkeru, 見付ける, を|mitsukeru|見つける|10968;10969;10970|見附ける, 見附る, mikkeru, 見付ける||を|見つけ|mitsuke|55|
11756|itomeru, 射止める, shoot dead, bring down (an animal), win (a prize, someone's heart, etc.), make one's own, を|itomeru|射止める|10777;10778|||を|射止め|itome|55|
11757|iawaseru, 居合わせる, happen to be present|iawaseru|居合わせる|10755||||居合わせ|iawase|55|
11758|iikiru, 言い切る, declare, assert, state definitively, finish saying, say it all, finish one's sentence, 言いきる, 言切る, を|iikiru|言い切る|12313;12314|言いきる, 言切る||を|言い切|iiki|55|
11759|saboru, サボる, be truant, play hooky, skip school, skip out, be idle, sabotage by slowness|saboru|サボる|12397||||サボ|sabo|55|
11760|sashikakaru, 差し掛かる, come near to, approach, 差し掛る, 差しかかる|sashikakaru|差し掛かる|13253|差し掛る, 差しかかる|||差し掛か|sashikaka|55|
11761|garu, がる, show signs of being, feel, think, behave as if one were, pretend, act as if, want, desire, be anxious to, be eager to|garu|がる|13643;13644;13645||||が|ga|55|
11762|yowaru, 弱る, weaken, grow weak, wane, decline (of one's health), be downcast, be dejected, be dispirited, be troubled, be at a loss, be perplexed, be annoyed|yowaru|弱る|14095;14096;14097||||弱|yowa|55|
11763|yowamaru, 弱まる, abate, weaken, be emaciated, be dejected, be perplexed|yowamaru|弱まる|14091||||弱ま|yowama|55|
11764|nanoru, 名乗る, give one's name (as), introduce oneself (as), claim to be, call oneself, wear the title of, reveal oneself (as), admit to being, adopt as one's name, take (a name), call out the goods one is selling, 名告る, 名のる|nanoru|名乗る|14998;14999;15000;15001;15002|名告る, 名のる|||名乗|nano|55|
11765|kataru, 語る, talk about, speak of, tell, narrate, recite, chant, indicate, show, を|kataru|語る|14757;14758;14759|||を|語|kata|55|
11766|yorikakaru, 寄りかかる, lean against, recline on, lean on, rely on, depend on, 凭り掛かる, 寄り掛かる, 倚り懸かる, 寄り掛る|yorikakaru|寄りかかる|15403;15404|凭り掛かる, 寄り掛かる, 倚り懸かる, 寄り掛る|||寄りかか|yorikaka|55|
11767|yoriatsumaru, 寄り集まる, gather together|yoriatsumaru|寄り集まる|15402||||寄り集ま|yoriatsuma|55|
11768|yokubaru, 欲張る, covet, lust for|yokubaru|欲張る|15397||||欲張|yokuba|55|
11769|demoaru, でもある, also be (implies that as well as the earlier stated this is also the case), be ... or something|demoaru|でもある|14408;14409||||でもあ|demoa|55|
11770|noboru, 上る, ascend, go up, climb, ascend (as a natural process, e.g. the sun), rise, go to (the capital), be promoted, add up to, advance (in price), swim up (a river), sail up, come up (on the agenda), 登る, 昇る, 陞る|noboru|上る|15060;15061;15062;15063;15064;15065;15066;15067|登る, 昇る, 陞る|||上|nobo|55|
11771|todomaru, 止まる, remain, abide, stay (in the one place), be limited to, be confined to, 駐まる, 停まる, 留まる|todomaru|止まる|17916;17917|駐まる, 停まる, 留まる|||止ま|todoma|55|
11772|takaru, 集る, gather, crowd round, swarm, flock, extort from, sponge off|takaru|集る|17883;17884||||集|taka|55|
11773|negiru, 値切る, drive a bargain, beat down the price, haggle, 直切る, を|negiru|値切る|17453|直切る||を|値切|negi|55|
11774|kakawaru, 関わる, be affected, be influenced, be concerned with, have to do with, stick to (opinions), be affected, be influenced, 拘わる, 係る, 係わる, 拘る, 関る|kakawaru|関わる|17159;17160;17161;19061|拘わる, 係る, 係わる, 拘る, 関る|||関わ|kakawa|55|
11775|kiniiru, 気に入る, like, be pleased with, be delighted with, take a liking to, suit one's fancy, 気にいる|kiniiru|気に入る|18288|気にいる|||気に入|kinii|55|
11776|hikizuru, 引きずる, drag along, pull, force someone along, prolong, drag out, influence strongly, seduce, を|hikizuru|引きずる|18265;18266;18267;18268|||を|引きず|hikizu|55|
11777|umaru, 埋まる, be buried, be covered, be surrounded, overflow, be crowded, be filled, be repaid (e.g. debt), be replenished, be filled (e.g. vacancy, schedule), uzumaru|umaru|埋まる|18399;18400;18401;18402|uzumaru|||埋ま|uma|55|
11778|yusaburu, 揺さぶる, shake, jolt, rock, swing, sway, shake (e.g. the political world), disturb, shock, upset, put off a batter (by varying one's type of pitch), を|yusaburu|揺さぶる|18545;18546;18547|||を|揺さぶ|yusabu|55|
11779|kanjitoru, 感じ取る, perceive, sense, take in, grasp, feel, 感じとる, を|kanjitoru|感じ取る|18503|感じとる||を|感じ取|kanjito|55|
11780|kitaru, 来る, come, arrive, be due to, 来たる|kitaru|来る|19183|来たる|||来|kita|55|
11781|furikiru, 振り切る, shake off, shake free from, swing completely (bat, club, etc.), take a full swing, break off from (pursuer), pull away, reject (request), ignore, 振切る, を|furikiru|振り切る|21012;21013;21014;21015|振切る||を|振り切|furiki|55|
11782|tachiyoru, 立ち寄る, stop by, drop in for a short visit, 立寄る, 立ちよる|tachiyoru|立ち寄る|21344|立寄る, 立ちよる|||立ち寄|tachiyo|55|
