Index|KEYWORDS|Roumaji construction|Kana construction|Meaning|Alternate Spellings|Extra keywords|Preposition|Kanji Root|Latin Root|Exception index|
13125|dangai suru, 弾劾する, impeach, denunciate, accuse, censure, arraign, 弾劾, を|dangai suru|弾劾する|13467;13468||弾劾|を|弾劾|dangai |105|
13126|chouwa suru, 調和する, be in harmony, be in accord, reconcile, agree, 調和|chouwa suru|調和する|13465||調和||調和|chouwa |105|
13127|choutei suru, 調停する, arbitrate, concile, mediate, 調停, を|choutei suru|調停する|13464||調停|を|調停|choutei |105|
13128|choutatsu suru, 調達する, supply, provision, raise, procure, 調達, を|choutatsu suru|調達する|13463||調達|を|調達|choutatsu |105|
13129|chousetsu suru, 調節する, regulate, adjust, control, 調節, を|chousetsu suru|調節する|13462||調節|を|調節|chousetsu |105|
13130|chouri suru, 調理する, cook, prepare food, 調理|chouri suru|調理する|13460||調理||調理|chouri |105|
13131|chouka suru, 超過する, exceed, be more than, 超過, を|chouka suru|超過する|13459||超過|を|超過|chouka |105|
13132|chouin suru, 調印する, sign, seal, 調印, を|chouin suru|調印する|13458||調印|を|調印|chouin |105|
13133|chouetsu suru, 超越する, to transcend, to rise above, 超越|chouetsu suru|超越する|13457||超越||超越|chouetsu |105|
13134|dai suru, 題する, be titled (e.g. a book), be named, 題|dai suru|題する|12730||題||題|dai |105|
13135|hyou suru, 表する, express, show, 表, を|hyou suru|表する|12914||表|を|表|hyou |105|
13136|yuu suru, 有する, own, be endowed with, 有|yuu suru|有する|13549||有||有|yuu |105|
13137|zengo suru, 前後する, be inverted, be reversed, get out of order, co-occurr, 前後|zengo suru|前後する|14200;14201||前後||前後|zengo |105|
13138|zanrui suru, 残塁する, be left on base, 残塁|zanrui suru|残塁する|14199||残塁||残塁|zanrui |105|
13139|zangyou suru, 残業する, work overtime, 残業|zangyou suru|残業する|14198||残業||残業|zangyou |105|
13140|zaitaku suru, 在宅する, be in, be at home, 在宅|zaitaku suru|在宅する|14197||在宅||在宅|zaitaku |105|
13141|zaishoku suru, 在職する, be in office, 在職|zaishoku suru|在職する|14196||在職||在職|zaishoku |105|
13142|zaiseki suru, 在籍する, enroll, 在籍, を|zaiseki suru|在籍する|14195||在籍|を|在籍|zaiseki |105|
13143|zaijuu suru, 在住する, reside, live, dwell, 在住|zaijuu suru|在住する|14194||在住||在住|zaijuu |105|
13144|youyaku suru, 要約する, summarize, digest, 要約, を|youyaku suru|要約する|14193||要約|を|要約|youyaku |105|
13145|youbou suru, 要望する, demand for, request, 要望, を|youbou suru|要望する|14190||要望|を|要望|youbou |105|
13146|yokkyuu suru, 欲求する, desire, want, will, wish, crave, 欲求, を|yokkyuu suru|欲求する|14189||欲求|を|欲求|yokkyuu |105|
13147|sumai suru, 住まいする, dwell, reside, 住まい|sumai suru|住まいする|14188||住まい||住まい|sumai |105|
13148|shutsunyuu suru, 出入する, get in and out, assess income and expenses, perform free associations, make the run of the house, 出入|shutsunyuu suru|出入する|14187||出入||出入|shutsunyuu |105|
13149|shuchou suru, 主張する, claim, insist, assert, advocate, emphasize, emphasise, contend, opine, 主張|shuchou suru|主張する|14186||主張||主張|shuchou |105|
13150|shakuya suru, 借家する, rent a house, 借家|shakuya suru|借家する|14185||借家||借家|shakuya |105|
13151|sayou suru, 作用する, act, operate, have effect, perform a function, 作用|sayou suru|作用する|14184||作用||作用|sayou |105|
13152|samagawari suru, 様変わりする, change completely, 様変りする, 様変わり|samagawari suru|様変わりする|14183|様変りする|様変わり||様変わり|samagawari |105|
13153|sakusei suru, 作成する, draw up (e.g. legal document, contract, will, etc.), prepare, write, frame, make, produce, create, 作成, を|sakusei suru|作成する|14182||作成|を|作成|sakusei |105|
13154|sakuduke suru, 作付けする, plant, 作付する, sakutsukesuru, 作付け, を|sakuduke suru|作付けする|14181|作付する, sakutsukesuru|作付け|を|作付け|sakuduke |105|
13155|sadou suru, 作動する, operate, function, run, 作動|sadou suru|作動する|14180||作動||作動|sadou |105|
13156|ryuutsuu suru, 流通する, circulate (money, goods, etc.), be distributed, circulate (air, water, etc.), be ventilated, flow, 流通|ryuutsuu suru|流通する|14178;14179||流通||流通|ryuutsuu |105|
13157|ryouri suru, 料理する, cook, deal with something, handle, administrate, manage, 料理, を|ryouri suru|料理する|14176;14177||料理|を|料理|ryouri |105|
13158|rikou suru, 履行する, performe (a duty), fulfill (a promise), execute (a contract), discharge, implement, 履行, を|rikou suru|履行する|14175||履行|を|履行|rikou |105|
13159|rikon suru, 離婚する, divorce, 離婚, を|rikon suru|離婚する|14174||離婚|を|離婚|rikon |105|
13160|rikai suru, 理解する, understand, comprehend, appreciate, sympathize, 理解|rikai suru|理解する|14173||理解||理解|rikai |105|
13161|okawari suru, お代わりする, get a second helping, get another cup, get seconds, have a dog place its second paw in one's hand, お代わり|okawari suru|お代わりする|14171;14172||お代わり||お代わり|okawari |105|
13162|mokutou suru, 黙とうする, perform a silent prayer, 黙とう|mokutou suru|黙とうする|14170||黙とう||黙とう|mokutou |105|
13163|maeuri suru, 前売りする, make an advance sale, make a booking, 前売する, 前売り|maeuri suru|前売りする|14169|前売する|前売り||前売り|maeuri |105|
13164|maeoki suru, 前置きする, preface, introduce, 前置き, を|maeoki suru|前置きする|14168||前置き|を|前置き|maeoki |105|
13165|maebarai suru, 前払いする, pay in advance, prepay, 前払する, 前払い|maebarai suru|前払いする|14167|前払する|前払い||前払い|maebarai |105|
13166|ketsuretsu suru, 決裂する, suffer a breakdown, rupture, 決裂|ketsuretsu suru|決裂する|14166||決裂||決裂|ketsuretsu |105|
13167|ketsui suru, 決意する, decide, determine, resolve, 決意|ketsui suru|決意する|14165||決意||決意|ketsui |105|
13168|ketsugi suru, 決議する, reach a resolution, decide, 決議|ketsugi suru|決議する|14164||決議||決議|ketsugi |105|
13169|ketsudan suru, 決断する, decide, determine, 決断|ketsudan suru|決断する|14163||決断||決断|ketsudan |105|
13170|ketsubou suru, 欠乏する, feel want, be in shortage, 欠乏|ketsubou suru|欠乏する|14162||欠乏||欠乏|ketsubou |105|
13171|katarogu suru, カタログする, catalog, catalogue, カタログ, を|katarogu suru|カタログする|14161||カタログ|を|カタログ|katarogu |105|
13172|kashouhyouka suru, 過小評価する, underestimate, undervaluate, 過小評価, を|kashouhyouka suru|過小評価する|14160||過小評価|を|過小評価|kashouhyouka |105|
13173|kanetsu suru, 過熱する, superheat, overheat, 過熱|kanetsu suru|過熱する|14159||過熱||過熱|kanetsu |105|
13174|imi suru, 意味する, give meaning, give significance, make sense, 意味|imi suru|意味する|14158||意味||意味|imi |105|
13175|houfuku suru, 報復する, retaliate, get revenge, get reprisal, get retribution, retort, 報復|houfuku suru|報復する|14156;14157||報復||報復|houfuku |105|
13176|fujiyuu suru, 不自由する, feel discomfort, feel inconvenience, be poor, be destitute, 不自由|fujiyuu suru|不自由する|14154;14155||不自由||不自由|fujiyuu |105|
13177|chinretsu suru, 陳列する, exhibit, display, put on show, 陳列, を|chinretsu suru|陳列する|14153||陳列|を|陳列|chinretsu |105|
13178|chinmoku suru, 沈黙する, be silent, be quiet, hush, be reticent, not act, 沈黙|chinmoku suru|沈黙する|14151;14152||沈黙||沈黙|chinmoku |105|
13179|chinkon suru, 鎮魂する, repose (souls), 鎮魂|chinkon suru|鎮魂する|14150||鎮魂||鎮魂|chinkon |105|
13180|chinjutsu suru, 陳述する, make a statement, make a declaration, 陳述|chinjutsu suru|陳述する|14149||陳述||陳述|chinjutsu |105|
13181|chinjou suru, 陳情する, petition, appeal, 陳情, を|chinjou suru|陳情する|14148||陳情|を|陳情|chinjou |105|
13182|chinchaku suru, 沈着する, settle or be deposited (at the bottom of something), 沈着|chinchaku suru|沈着する|14147||沈着||沈着|chinchaku |105|
13183|chinbotsu suru, 沈没する, sink, founder, go down, submerse, get dead drunk, have too much fun (esp. in a red-light district, etc.) and miss work or neglect one's duties, stay in one place for a long time, 沈没|chinbotsu suru|沈没する|14143;14144;14145;14146||沈没||沈没|chinbotsu |105|
13184|chin'atsu suru, 鎮圧する, suppress, subjugate, 鎮圧, を|chin'atsu suru|鎮圧する|14142||鎮圧|を|鎮圧|chin'atsu |105|
13185|chin'age suru, 賃上げする, be increased (wage), 賃上げ|chin'age suru|賃上げする|14141||賃上げ||賃上げ|chin'age |105|
13186|buntsuu suru, 文通する, engage in correspondence, exchange letters, 文通|buntsuu suru|文通する|14140||文通||文通|buntsuu |105|
13187|boutou suru, 暴騰する, rise suddenly, rise sharply, boom, skyrocket, 暴騰|boutou suru|暴騰する|14139||暴騰||暴騰|boutou |105|
13188|bousou suru, 暴走する, act rashly, run wildly, behave recklessly, drive recklessly, go on a rampage, be a runaway process, perform reckless baserunning, 暴走|bousou suru|暴走する|14136;14137;14138||暴走||暴走|bousou |105|
13189|bouraku suru, 暴落する, slump, crash, fall heavily, decline suddenly, 暴落|bouraku suru|暴落する|14135||暴落||暴落|bouraku |105|
13190|boukou suru, 暴行する, assault, perform an outrage, perform an act of violence, rape, assault sexually, 暴行, を|boukou suru|暴行する|14133;14134||暴行|を|暴行|boukou |105|
13191|bekkyo suru, 別居する, be separated, live apart, 別居|bekkyo suru|別居する|14132||別居||別居|bekkyo |105|
13192|bakuro suru, 暴露する, disclose, expose, reveal, 暴露, を|bakuro suru|暴露する|14131||暴露|を|暴露|bakuro |105|
13193|hossuru, 欲する, want, desire, 欲, を|hossuru|欲する|13680||欲|を|欲|hos|105|
13194|zainichi suru, 在日する, be a resident in Japan (of a foreigner), be situated in Japan (e.g. of an embassy), 在日|zainichi suru|在日する|15531||在日||在日|zainichi |105|
13195|yorimichi suru, 寄り道する, drop in on the way, stop off at, make a side trip, go the long way round, make a detour, 寄道する, 寄り道|yorimichi suru|寄り道する|15529;15530|寄道する|寄り道||寄り道|yorimichi |105|
13196|torikomi suru, 取り込みする, import (e.g. data), capture (e.g. image), 取り込み, を|torikomi suru|取り込みする|15528||取り込み|を|取り込み|torikomi |105|
13197|tenzai suru, 点在する, be dotted with, be scattered, 点在|tenzai suru|点在する|15527||点在||点在|tenzai |105|
13198|tenteki suru, 点滴する, fall (rain, drop of water), drip intravenously, drip-feed, 点滴|tenteki suru|点滴する|15525;15526||点滴||点滴|tenteki |105|
13199|tenmetsu suru, 点滅する, switch on and off (of a light), flash, blink, flicker, 点滅|tenmetsu suru|点滅する|15524||点滅||点滅|tenmetsu |105|
13200|tenken suru, 点検する, inspect, examine, check, 点検, を|tenken suru|点検する|15523||点検|を|点検|tenken |105|
13201|tenka suru, 点火する, ignite, light, set fire to, 点火, を|tenka suru|点火する|15522||点火|を|点火|tenka |105|
13202|tai suru, 対する, face (each other), be facing, be directed toward (the future, etc.), be in response to, be related to, receive (a client, etc.), compare with, contrast with, be in opposition with, be opposed to, confront, oppose, compete with, 対, を|tai suru|対する|15517;15518;15519;15520;15521||対|を|対|tai |105|
13203|shoukan suru, 償還する, repay, redeem, amortize, amortise, 償還, を|shoukan suru|償還する|15516||償還|を|償還|shoukan |105|
13204|shohyou suru, 書評する, review a book, 書評|shohyou suru|書評する|15515||書評||書評|shohyou |105|
13205|shiokuri suru, 仕送りする, send (someone) an allowance, 為送りする, 仕送り|shiokuri suru|仕送りする|15514|為送りする|仕送り||仕送り|shiokuri |105|
13206|seisou suru, 正装する, dress fully, dress formally, wear a uniform, 正装|seisou suru|正装する|15513||正装||正装|seisou |105|
13207|seikai suru, 正解する, be correct, be right, have a correct interpretation (answer, solution), 正解|seikai suru|正解する|15512||正解||正解|seikai |105|
13208|secchi suru, 設置する, be established, be instituted, instal (machine or equipment), 設置, を|secchi suru|設置する|15510;15511||設置|を|設置|secchi |105|
13209|saikai suru, 際会する, meetg, face, confront, 際会, を|saikai suru|際会する|15509||際会|を|際会|saikai |105|
13210|oute suru, 王手する, check, 王手, を|oute suru|王手する|15508||王手|を|王手|oute |105|
13211|onajiku suru, 同じくする, be similar, be the same, 同じく|onajiku suru|同じくする|15507||同じく||同じく|onajiku |105|
13212|nomineeto suru, ノミネートする, nominate, ノミネート, を|nomineeto suru|ノミネートする|15506||ノミネート|を|ノミネート|nomineeto |105|
13213|monogatari suru, 物語する, tell a tale, tell a story, tell a legend, 物語|monogatari suru|物語する|15505||物語||物語|monogatari |105|
13214|mawarimichi suru, 回り道する, go on a detour, create a diversion, 回り道|mawarimichi suru|回り道する|15504||回り道||回り道|mawarimichi |105|
13215|kokusaika suru, 国際化する, be internationalized, be internationalised, 国際化|kokusaika suru|国際化する|15503||国際化||国際化|kokusaika |105|
13216|kichou suru, 記帳する, be registered, be entered, 記帳|kichou suru|記帳する|15502||記帳||記帳|kichou |105|
13217|keshou suru, 化粧する, apply make-up, apply makeup, 化粧|keshou suru|化粧する|15501||化粧||化粧|keshou |105|
13218|kaseki suru, 化石する, be petrified, fossilize, fossilise, 化石|kaseki suru|化石する|15500||化石||化石|kaseki |105|
13219|kakutou suru, 格闘する, fight hand-to-hand, grapple, scuffle, 格闘|kakutou suru|格闘する|15499||格闘||格闘|kakutou |105|
13220|kakuduke suru, 格付けする, rate, classify, allocate, grade, 格付け, を|kakuduke suru|格付けする|15498||格付け|を|格付け|kakuduke |105|
13221|kakuage suru, 格上げする, be elevated in status, be upgraded, be promoted, 格上げ|kakuage suru|格上げする|15497||格上げ||格上げ|kakuage |105|
13222|kakitome suru, 書留する, register (e.g. of mail), write down, put on record, record, make a note of, 書留めする, 書き留めする, 書留, を|kakitome suru|書留する|15496|書留めする, 書き留めする|書留|を|書留|kakitome |105|
13223|kakikomi suru, 書き込みする, write, enter (e.g. to a form), post (e.g. to a blog), 書込みする, 書き込み|kakikomi suru|書き込みする|15493;15494;15495|書込みする|書き込み||書き込み|kakikomi |105|
13224|kaitou suru, 回答する, reply, answer, 回答, を|kaitou suru|回答する|15492||回答|を|回答|kaitou |105|
13225|kaisou suru, 回想する, recollect, retrospect, reflect, reminisce, 回想|kaisou suru|回想する|15491||回想||回想|kaisou |105|
13226|kaishuu suru, 回収する, be collected, recover, withdraw, be retrieved, 回収|kaishuu suru|回収する|15490||回収||回収|kaishuu |105|
13227|kaisai suru, 開催する, hold (a conference, exhibition, etc.), open, host (e.g. the Olympics), 開催, を|kaisai suru|開催する|15489||開催|を|開催|kaisai |105|
13228|kaiken suru, 会見する, interview, have an audience with, meet, 会見|kaiken suru|会見する|15488||会見||会見|kaiken |105|
13229|kaihi suru, 回避する, evade, avoid, 回避, を|kaihi suru|回避する|15487||回避|を|回避|kaihi |105|
13230|kaigou suru, 会合する, meet, assemble, gather, associate, conjunct, 会合|kaigou suru|会合する|15484;15485;15486||会合||会合|kaigou |105|
13231|kaigi suru, 会議する, meet, confer, 会議|kaigi suru|会議する|15483||会議||会議|kaigi |105|
13232|kaidan suru, 会談する, converse, confer (usu. between important people), discuss, 会談|kaidan suru|会談する|15482||会談||会談|kaidan |105|
13233|kagou suru, 化合する, combine chemically, 化合|kagou suru|化合する|15481||化合||化合|kagou |105|
13234|joutatsu suru, 上達する, improve (e.g. in skill, ability), advance, progress, communicate opinions of the general populace to those of high rank, 上達|joutatsu suru|上達する|15479;15480||上達||上達|joutatsu |105|
13235|jouen suru, 上演する, perform (of play, opera, etc.), stage, present, 上演, を|jouen suru|上演する|15477||上演|を|上演|jouen |105|
13236|jisei suru, 自制する, have self control, have self restraint, 自制|jisei suru|自制する|15476||自制||自制|jisei |105|
13237|jikaku suru, 自覚する, be self-conscious, be self-aware, 自覚|jikaku suru|自覚する|15474||自覚||自覚|jikaku |105|
13238|ichi suru, 位置する, be in place, 位置|ichi suru|位置する|15473||位置||位置|ichi |105|
13239|hokujou suru, 北上する, go North, 北上|hokujou suru|北上する|15472||北上||北上|hokujou |105|
13240|hiyake suru, 日焼けする, get a sunburn, get a suntan, get a tan, become discolored from the sun (e.g. paper), yellow, 日焼け|hiyake suru|日焼けする|15470;15471||日焼け||日焼け|hiyake |105|
13241|himatsubushi suru, 暇つぶしする, waste time, kill time, 暇つぶし|himatsubushi suru|暇つぶしする|15469||暇つぶし||暇つぶし|himatsubushi |105|
13242|himan suru, 肥満する, be corpulent, be fat, be obese, 肥満|himan suru|肥満する|15468||肥満||肥満|himan |105|
13243|higaeri suru, 日帰りする, do a day trip, 日帰り|higaeri suru|日帰りする|15467||日帰り||日帰り|higaeri |105|
13244|henji suru, 返事する, reply, answer, respond, 返辞する, 返事|henji suru|返事する|15465|返辞する|返事||返事|henji |105|
13245|hasei suru, 派生する, be derived, 派生|hasei suru|派生する|15464||派生||派生|hasei |105|
13246|hanten suru, 反転する, roll over, turn around, turn from side to side, be inversed, be reversed, invert tones, make a negative image, 反転|hanten suru|反転する|15461;15462;15463||反転||反転|hanten |105|
13247|hansuru, 反する, be contrary to, be inconsistent with, contradict, act contrary to (rules or guidelines), violate, transgress, oppose, rebel, revolt, 叛する, 反|hansuru|反する|15458;15459;15460|叛する|反||反|han |105|
13248|hansha suru, 反射する, reflect, reverberate, reflex, reflexes, 反射|hansha suru|反射する|15456;15457||反射||反射|hansha |105|
13249|hansei suru, 反省する, reflect, reconsider, introspect, meditate, contemplate, regret, repent, feel remorse, be sorry, 反省|hansei suru|反省する|15454;15455||反省||反省|hansei |105|
13250|hanron suru, 反論する, object, refute, rebut, counterargue, 反論|hanron suru|反論する|15453||反論||反論|hanron |105|
13251|hanran suru, 反乱する, insurrect, mutiny, rebel, revolt, uprise, 反乱|hanran suru|反乱する|15452||反乱||反乱|hanran |105|
13252|hanpatsu suru, 反発する, be opposed, rebel, revolt, resist, refuse, rebound, recoil, be repulsed, rally (e.g. in stock prices), recover, 反発|hanpatsu suru|反発する|15449;15450;15451||反発||反発|hanpatsu |105|
13253|hankyou suru, 反響する, echo, reverberate, react, respond, 反響|hankyou suru|反響する|15447;15448||反響||反響|hankyou |105|
13254|hangeki suru, 反撃する, counterattack, 反撃|hangeki suru|反撃する|15446||反撃||反撃|hangeki |105|
13255|han'ei suru, 反映する, be reflected (light, image, situation, attitude, etc.), reflect, influence, apply (e.g. an update), 反影する, 反映, を|han'ei suru|反映する|15444;15445|反影する|反映|を|反映|han'ei |105|
13256|haken suru, 派遣する, dispatch, despatch, deploy, 派遣|haken suru|派遣する|15443||派遣||派遣|haken |105|
13257|hahei suru, 派兵する, dispatch troops, despatch troops, 派兵|hahei suru|派兵する|15442||派兵||派兵|hahei |105|
13258|gourei suru, 号令する, order (esp. a number of people), command, bow at start and end of school class, 号令|gourei suru|号令する|15440;15441||号令||号令|gourei |105|
13259|gaman suru, 我慢する, be patient, endure, persevere, be tolerant, have self-control, be in self-denial, 我慢|gaman suru|我慢する|15439||我慢||我慢|gaman |105|
13260|gakushuu suru, 学習する, study, learn, 学習|gakushuu suru|学習する|15438||学習||学習|gakushuu |105|
13261|busho suru, 部署する, be at one's post, be at one's station, 部所する, 部署|busho suru|部署する|15437|部所する|部署||部署|busho |105|
13262|burabura suru, ぶらぶらする, dangle heavily, sway to and fro, swing, stroll, ramble, roam, wander, persist (of an illness), ぶらぶら|burabura suru|ぶらぶらする|15433;15434;15436||ぶらぶら||ぶらぶら|burabura |105|
13263|buntan suru, 分担する, take on one's share (e.g. of work), divide (work, expenses, etc.) between, apportion, allot, allocate, assign, 分担, を|buntan suru|分担する|15432||分担|を|分担|buntan |105|
13264|bunri suru, 分離する, separate, partit, detach, segregate, isolate, 分離, を|bunri suru|分離する|15431||分離|を|分離|bunri |105|
13265|bunpai suru, 分配する, divide, split, share, distribute, disseminate, allocate, 分配, を|bunpai suru|分配する|15430||分配|を|分配|bunpai |105|
13266|bunki suru, 分岐する, diverge, ramificate, bifurcate, branch off, 分岐|bunki suru|分岐する|15429||分岐||分岐|bunki |105|
13267|ashibumi suru, 足踏みする, step (in place), stamp (up and down), stomp, mark time (for a soldier), be in a standstill, be in a stalemate, 足ぶみする, 足踏み|ashibumi suru|足踏みする|15427;15428|足ぶみする|足踏み||足踏み|ashibumi |105|
13268|achikochi suru, 彼方此方する, to get things in the wrong order (back to front), to become muddled up, 彼方此方|achikochi suru|彼方此方する|15426||彼方此方||彼方此方|achikochi |105|
13269|yasei suru, 野生する, be wild, grow wild, live in the wild, 野生|yasei suru|野生する|16686||野生||野生|yasei |105|
13270|unkou suru, 運行する, be in service (bus, train), operate, move, revolve, 運行|unkou suru|運行する|16684;16685||運行||運行|unkou |105|
13271|tousai suru, 搭載する, load (on board), equip, 搭載, を|tousai suru|搭載する|16683||搭載|を|搭載|tousai |105|
13272|tetsuduki suru, 手続きする, perform a procedure, perform proceedings, perform formalities, 手続する, 手続き|tetsuduki suru|手続きする|16682|手続する|手続き||手続き|tetsuduki |105|
13273|teire suru, 手入れする, care, look after, repair, maintain, tend, trim, groom, raid, crack down, 手入れ, を|teire suru|手入れする|16680;16681||手入れ|を|手入れ|teire |105|
13274|tantou suru, 担当する, be in charge (of an area of responsibility), be responsible (for a work role, etc.), 担当|tantou suru|担当する|16679||担当||担当|tantou |105|
13275|taitou suru, 台頭する, rise (e.g. of a movement), emerge, rear one's head, gain prominence, come to the fore, gain power, gather strength, 擡頭する, 台頭|taitou suru|台頭する|16678|擡頭する|台頭||台頭|taitou |105|
13276|soshiki suru, 組織する, organize, organise, form, construct, setup, constitute, weave (a fabric), soshokusuru, 組職する, 組織, を|soshiki suru|組織する|16675;16676;16677|soshokusuru, 組職する|組織|を|組織|soshiki |105|
13277|sokaku suru, 組閣する, form of a cabinet, 組閣|sokaku suru|組閣する|16674||組閣||組閣|sokaku |105|
13278|shuuroku suru, 収録する, compile, edit, recording, 輯録する, 集録する, 収録, を|shuuroku suru|収録する|16672;16673|輯録する, 集録する|収録|を|収録|shuuroku |105|
13279|shuunin suru, 就任する, assume (office), take up (a post), be inaugurated, be installed, 就任|shuunin suru|就任する|16671||就任||就任|shuunin |105|
13280|shutsuen suru, 出演する, perform, appear (in a stage, film, TV show, etc.), 出演|shutsuen suru|出演する|16670||出演||出演|shutsuen |105|
13281|shubetsu suru, 種別する, classify, assort, 種別, を|shubetsu suru|種別する|16669||種別|を|種別|shubetsu |105|
13282|shouryoku suru, 省力する, save labor, reduce labor, 省力|shouryoku suru|省力する|16668||省力||省力|shouryoku |105|
13283|shouryaku suru, 省略する, omit, abbreviate, abridge, 省略, を|shouryaku suru|省略する|16667||省略|を|省略|shouryaku |105|
13284|shitei suru, 指定する, designate, specify, assign, appoint, point at, 指定, を|shitei suru|指定する|16666||指定|を|指定|shitei |105|
13285|shinrai suru, 信頼する, rely on, trust, have faith in, have confidence in, 信頼, を|shinrai suru|信頼する|16665||信頼|を|信頼|shinrai |105|
13286|shinnin suru, 信任する, trust, be confiding, 信任|shinnin suru|信任する|16664||信任||信任|shinnin |105|
13287|shinkou suru, 信仰する, have faith, believe, have creed, 信仰|shinkou suru|信仰する|16663||信仰||信仰|shinkou |105|
