Index|KEYWORDS|Romaji construction|Kana construction|Meaning|Alternate Spellings|
4930|e, へ, to, toward|e|へ|2||
4931|mo, も, also, either, even|mo|も|3;4||
4932|mo ... mo, も...も, both ... and, neither ... nor, mo|mo ... mo|も...も|5;6||
4933|to, と, and, with, when, object marker, if X then Y|to|と|7;8;9;10;11||
4934|ya, や, and (amongst others)|ya|や|12||
4935|nado, 等, and so forth, and the like, etc..., et cetera|nado|等|13||
4936|no, の, of, made of, pronunciation of hyphen, feminine tone, question marker, noun descriptor, in fact, indeed, polite softener, noun modifier for verb, pronoun modifier|no|の|14;15;16;17;18;19;20;21;6205||
4937|no ga, のが, pronoun modifier and use as subject, good at, not good at, like to do/be, dislike to do/be|no ga|のが|22;23||
4938|no wo, のを, noun modifier and use as object|no wo|のを|24||
4939|n, ん, in fact, indeed, softener, emphasizer, emphasis, n da, n desu|n|ん|25;26||
4940|wo, を, verb object marker, gerund object marker, "leaving" verb object marker, "going through" verb object marker|wo|を|27;28;29;30||
4941|wa, は, subject marker, choice marker, verb object marker, verb object marker, verb object marker, as for, regarding, in relation to|wa|は|31;32;33;34;35||
4942|wa, わ, you know, certainly, hear me out|wa|わ|36||
4943|de, で, location of an activity, by means of, substance of a material, because of, due to, limits in space, limits in time, limits in price or quantity, X and Y, where, takes place|de|で|37;38;39;40;41;42;43;44||
4944|de wa, では, as for in, de ha|de wa|では|6147||
4945|datte, だって, even, too, as well, also, they say, I hear, you mean, after all, because, but|datte|だって|45;46;47;48;49||
4946|yo, よ, you know, certainly, hear me out, da yo, wa yo, だよ, わよ, n da yo, n desu yo|yo|よ|50|da yo, wa yo, だよ, わよ|
4947|yone, よね, confirmation|yone|よね|51||
4948|na, な, na-adjective marker, you are ordered not to do/be X|na|な|52;53||
4949|ka, か, question marker, yes?, no?, isn't it?, is it?, or, whether or not, some- (e.g. something, someone), hmm, huh, kai, kae|ka|か|54;7406;7407;7408;7409|kai, kae|
4950|ka naa, かなあ, don't know if yes or no, かな〜, ka na, na no ka naa|ka naa|かなあ|55|かな〜|
4951|ka shira, かしら, don't know if yes or no, na no ka shira|ka shira|かしら|55||
4952|ka, か, or, I don't Y if X is ...|ka|か|56;57||
4953|ka … ka, か...か, either or|ka … ka|か...か|58||
4954|ga, が, emphasis, object marker, subject marker, but, and (less common)|ga|が|59;60;61;62;63||
4955|ka, ヶ, kanji connector, ga|ka|ヶ|64|ga|
4956|ne, ね, negative question marker, opinion, wa ne, わね|ne|ね|65;66|wa ne, わね|
4957|kara, から, (away) from, therefore|kara|から|67;68||
4958|made, まで, until, by a certain time, up to|made|まで|69;70||
4959|nozoi, 除い, except for|nozoi|除い|71||
4960|maru de, 丸で, quite, entirely, completely, at all, as if, as though, just like, similar to|maru de|丸で|72;6192||
4961|you de, ようで, like, similar to|you de|ようで|73||
4962|goto, 如, like, similar to, same as|goto|如|74||
4963|no made, 間で, between|no made|間で|75||
4964|ni yotte, に因って, made by, because of, due to, by means of, depending on, according to|ni yotte|に因って|76||
4965|ni, に, existence at a location, performing a continuous action at a location, final location, final destination, time of an action/event, frequency or proportion of an action/event, change or resulting condition, object marker for decision verb, object marker for verb in causative active tense, object marker for giving/receiving verb, subject marker in a passive sentence, object marker for person who is allowed/made to do an action, used when comparing/differentiating/estimating, for the purpose of, made for, cause for a given situation, ability, skill, knowledge, used with adverb describing manner, lists, do Y in order to do/be X, X by means of Y, go/come to do X, adverb form|ni|に|77;78;79;80;81;82;83;84;85;86;87;88;89;90;91;92;93;94;95;96;97;98||
4966|ni wa, には, from the object's point of view, verb object marker, ni ha|ni wa|には|99;100||
4967|no wa, には, noun modifier and use as subject, no ha|no wa|には|101||
4968|toka …toka, とか...とか, among other things, such things as, something like that, toka|toka …toka|とか...とか|102||
4969|oyobi, 及び, and, as well as|oyobi|及び|103||
4970|wa ... ga ii desu, は...がいいです, out of X, the Y is good, wa, ga|wa ... ga ii desu|は...がいいです|104||
4971|wa ... ga ..., は...が..., As for X, Y is (verb), wa, ga|wa ... ga ...|は...が...|105||
4972|de ... en, で...円, (counter) X are worth (price) yen, de, en, worth, priced, price, money|de ... en|で...円|106||
4973|de utteiru, で売っています, sold at, de utteimasu|de utteiru|で売っています|107||
4974|ni suru, にする, I will have X, ni shimasu, will take, will order|ni suru|にする|108||
4975|mo sou, もそう, (I) also X so|mo sou|もそう|109||
4976|(...), (...), Y that X, ga|(...)|(...)|110||
4977|mama, まま, X just the way it is|mama|まま|111||
4978|touri ni, 通りに, X the way it is meant to be, douri ni|touri ni|通りに|112||
4979|hou ga ii da, ほうがいいです, it would be best if, hou ga ii desu, hou ga, ta hou ga|hou ga ii da|ほうがいいです|113||
4980|mitai, 見たい, It seems that (he) does/is X, seems that, looks like, looks as if|mitai|見たい|114||
4981|rashii, らしい, (He) seems to do/be X, like, as if, apparently, it seems, I heard that, sounds like|rashii|らしい|115||
4982|sou, そう, (He) seems to do/be X / (I've) heard that X (from what I can see), (I've) heard that (he's) not X (from what I can see), looks like, appears to be, feels like, sounds like, seems to be, sou ni, sou mo nai, da sou|sou|そう|116;117||
4983|tte, って, (I've) heard that X, it seems that X, you said, he said, she said, they said, if ... then, do you seriously think that, I already told you, you should know by now that, of course, the said ..., says that ..., I hear that ..., as for the term ..., as for ..., datte, だって, tte, datte|tte|って|118;7021;7022;7023;7024;7025;7026;7027;7028;7029|datte, だって|
4984|you, よう, (He) seems to do/be X (from what I can deduce), looks like, appears to be, feels like, sounds like, seems to be, you da, na you da, no you da|you|よう|119||
4985|te mo, ても, even if (he) does/is X, de mo|te mo|ても|120||
4986|ikura ...te mo, 幾ら...ても, no matter how much (he) does/is X, de mo|ikura ...te mo|幾ら...ても|121||
4987|de mo, でも, also there|de mo|でも|6128||
4988|ii desu ka, いいですか, would (you) like to/be X?|ii desu ka|いいですか|122||
4989|ikaga desu ka, いかがですか, would (you) like to/be X?|ikaga desu ka|いかがですか|122||
4990|dearu, である, there is|dearu|である|123||
4991|ga tsuiteimasu, がついています, X is included|ga tsuiteimasu|がついています|124||
4992|ga hatteimasu, がはっています, X is included|ga hatteimasu|がはっています|125||
4993|X ka nanika wo, か何かを, do/be X or something|X ka nanika wo|か何かを|126||
4994|X ka dareka wo, か誰かを, do/be X or someone|X ka dareka wo|か誰かを|127||
4995|X ka dokoka wo, かどこかを, do/be X or somewhere|X ka dokoka wo|かどこかを|128||
4996|darou, だろう, (He) probably does/is X, (I) wonder if (he) does/is X, likely, presumptive|darou|だろう|129;130||
4997|deshou, でしょう, (He) probably does/is X, (I) wonder if (he) does/is X, likely, presumptive|deshou|でしょう|131;132||
4998|no hoka, のほか, apart from X|no hoka|のほか|133||
4999|sugiru, すぎる, too much X, sugimasu, suginai, sugimashita, sugita|sugiru|すぎる|134||
5000|baai, 場合, In case (you) do/are X, in case of, in the case that, in case that, if|baai|場合|135||
5001|bakari ni, ばかいに, Y only because of X, bakkari ni, bakashi ni, bakkashi ni|bakari ni|ばかいに|136||
5002|na n da, なんだ, It's because of X, bakkari ni, bakashi ni, bakkashi ni|na n da|なんだ|137||
5003|ba, ば, if X then Y, if, then, nara, naraba, kereba, if that's the case, if so, that being the case|ba|ば|138||
5004|nakereba, なければ, if not X then Y, kereba, denakereba, kunakereba, ba|nakereba|なければ|139||
5005|nakya, なきゃ, if not X then Y, kereba, denakereba, kunakereba, ba|nakya|なきゃ|140||
5006|ba ii da, ばいいだ, what must one do/be when X?, ba ii desu ka, dou sureba, it will be fine if, it will be enough if, you should do, ba yokatta, nakereba ii desu, nakereba yokatta desu|ba ii da|ばいいだ|141||
5007|shi …shi, し...し, because of X, shi ne, shi|shi …shi|し...し|142||
5008|tara ii da, たらいいだ, what must one do/be when X?, tara yokatta da, tara yokatta desu|tara ii da|たらいいだ|143||
5009|tara, たら, if X then Y, when X then Y, taraba, daraba, if, then, dattara, kattara|tara|たら|144;145||
5010|nakattara, なかったら, if not X then Y, when not X then Y, daraba, taraba, if, then, denakattara, kunakattara|nakattara|なかったら|146;147||
5011|sore de, それで, therefore, still, even so, therefore, thus, consequently, as such|sore de|それで|148;149||
5012|soko de, 其処で, so, accordingly, thereupon, therefore, therefore, thus, consequently, as such|soko de|其処で|150||
5013|yue ni, 故に, therefore, therefore, thus, consequently, as such|yue ni|故に|151||
5014|soshitara, そしたら, therefore, therefore, thus, consequently, as such|soshitara|そしたら|152||
5015|node, ので, therefore, nande, nanode, therefore, thus, consequently, as such|node|ので|153||
5016|nde, んで, therefore, nande, nanode, therefore, thus, consequently, as such|nde|んで|154||
5017|te, て, therefore, X by means of Y, de, is so, so much that|te|て|155;156|de|
5018|nara, なら, if X|nara|なら|157||
5019|kakawarazu, かかわらず, despite, in spite of, regardless of, 拘らず, 関らず, 拘わらず, 関わらず, 不抱|kakawarazu|かかわらず|158|拘らず, 関らず, 拘わらず, 関わらず, 不抱|
5020|igai, 以外, except for, other than, with the exception of|igai|以外|159||
5021|demo, でも, however, but, even if, nevertheless, even so, notwithstanding, temo|demo|でも|160|temo|
5022|soredemo, それでも, however, but, even if, nevertheless, even so, notwithstanding|soredemo|それでも|161||
5023|soreyori, それより, however, but, apart from that, other than that, aside from that, more than that|soreyori|それより|162||
5024|tadashi, 但し, but, however, provided that, nevertheless, even so, notwithstanding|tadashi|但し|163||
5025|kedo, けど, but, and (less common), dakedo|kedo|けど|164;165||
5026|keredomo, けれども, but (politer form of kedo), dakeredomo|keredomo|けれども|166||
5027|tokoro de, ところで, even if X|tokoro de|ところで|167||
5028|tatoe …temo, たとえ...ても, even if X, tatoe demo|tatoe …temo|たとえ...ても|6204||
5029|sore demo, それでも, still, even so|sore demo|それでも|168||
5030|tokoro ga, 所が, even so, however, still, whereupon, even though, nevertheless, on the contrary, as a matter of fact, despite|tokoro ga|所が|169||
5031|sore ni shite mo, それにしても, nevertheless, however|sore ni shite mo|それにしても|170||
5032|soretomo, それとも, X? or Y?, either or|soretomo|それとも|171||
5033|naide, ないで, don't do X but instead do Y, don't do Y without doing X, not X and then Y, do not do|naide|ないで|172;173;174||
5034|noni, のに, Y despite, even though X, in order to do/be X, for the purpose of doing/being X, in spite of, despite this, although, and yet, but even so, but even then, however, nevertheless, for all that, nothwithstanding that, nanoni, datta noni|noni|のに|175;176||
5035|shikashi, 然し, X but Y, however, but|shikashi|然し|177;8960||
5036|ja nakute, じゃなくて, not X but Y instead|ja nakute|じゃなくて|178||
5037|mata wa, 又は, or, otherwise, mata ha|mata wa|又は|179||
5038|to issho ni, と一緒に, X together with Y, altogether with|to issho ni|と一緒に|180||
5039|sore ni, それに, besides, in addition|sore ni|それに|181||
5040|sono ue, その上, besides, in addition|sono ue|その上|182||
5041|nagara, ながら, do Y during X|nagara|ながら|183||
5042|shi, し, X and Y (amongst other things), dashi|shi|し|184|dashi|
5043|X tari Y tari suru, たり, X and/or Y, tari, dattari|X tari Y tari suru|たり|185||
5044|toki, 時, Y happening at the same time as X, Y happened/will have happened/is agreed upon to happen at the same time as X, when, during, in case of|toki|時|186;187||
5045|uchi ni, 内に, Y happening while X is still happening, when, during|uchi ni|内に|188||
5046|no tochuu de, の途中で, action Y happening in the midst of event X, in the middle of, in the midst of, during, 途中|no tochuu de|の途中で|189||
5047|tochuu ni, 途中に, Y exists on the way during movement X, in the middle of, in the midst of, during, 途中|tochuu ni|途中に|190||
5048|tochuu de, 途中で, action Y happening on the way during movement X, in the middle of, in the midst of, during, 途中|tochuu de|途中で|191||
5049|ato, あと, X is true and also Y, atto|ato|あと|192||
5050|you ni, ように, (make an effort) in order to do X, in the hopes of something uncertain|you ni|ように|193||
5051|tame ni, 為に, Y for the sake of doing/being X, for the sake of something certain, in order to, for, for the sake of, in favor of, in favour of, on behalf of|tame ni|為に|194||
5052|no tame ni, の為に, Y for the benefit of X, for the sake of something certain, no tame no, の為の|no tame ni|の為に|195|no tame no, の為の|
5053|tame, 為, because of X, due to X, no tame, ta tame, da tame|tame|為|6360||
5054|you ni, ようにと, tell/ask to do/be X, initiator, initiates|you ni|ようにと|196||
5055|to ii n desu ga, といいんですが, (I) hope that X, da to ii n da, da to ii n desu, da to ii da, da to ii desu|to ii n desu ga|といいんですが|6104||
5056|to ii desu (ne), といいですね, (I) hope that X, da to ii n da, da to ii n desu, da to ii da, da to ii desu|to ii desu (ne)|といいですね|6148||
5057|to iu, と言う, say/tell that X, da to imasu, da to iusay that, tell that, to itta, I said that, she said that|to iu|と言う|197||
5058|to tsutaeru, と伝える, say/tell that X, da to tsutaeru, da to tsutaemasu, say that, tell that, to tsutaeta, I said that, she said that|to tsutaeru|と伝える|197||
5059|to omou, と思う, think that X, da to omou, da to omoimasu, I think that, she thinks that,youthink that|to omou|と思う|198||
5060|to wa kagiranai, とは限らない, is/do not always X, da to wa kagiranai, だとは限らない, is not always, do not always, da to wa kagiranai, da to wa kagirimasen|to wa kagiranai|とは限らない|199|da to wa kagiranai, だとは限らない|
5061|tokoro dewa, ところでは, as far as X|tokoro dewa|ところでは|200||
5062|ka ...ka, か...か, do you Y if X is ...?, ka, か, know if, believe that, think that, remember that, remember if|ka ...ka|か...か|201||
5063|ka dou ka, かどうか, do you Y if X is ... or not?, I don't Y if X is ... or not, know if, believe that, think that|ka dou ka|かどうか|202;203||
5064|ka dou ka … te miru, かどうか, In order to see if X is … or not|ka dou ka … te miru|かどうか|204||
5065|hazu, 筈, is supposed to do/be X, is not supposed to do/be X, was certainly supposed to do/be X, was regrettably supposed to do/be X, was certainly not supposed to do/be X, 弭, expected to do, should do, expected to be, supposed to be, should be, must do, must be, sure, no hazu, na hazu, I'm sure that, was sure that|hazu|筈|205;206;207;208;209|弭|
5066|ni tsuite, に就いて, concerning X, about X, relating to X, regarding X, per (e.g. 100 yen per person), for every, with regard to, with regards to, in regards to, ni tsuite no|ni tsuite|に就いて|210;6376||
5067|naru, なる, becomes X, became X, ni naru, you ni naru, comes to be, comes to do|naru|なる|211;212||
5068|you ni naritai, ようになりたい, become able to be/do X, will be be able to do, will be able to be, etai|you ni naritai|ようになりたい|213||
5069|you ni naru kamo shirenai, ようになるかもしれない, not become able to be/do X, will not be be able to do, will not be able to be, you ni naru kamo shiremasen|you ni naru kamo shirenai|ようになるかもしれない|214||
5070|onaji, 同じ, X and Y have the same (characteristic)|onaji|同じ|215||
5071|ni niteiru, に似ている, Y resembles X|ni niteiru|に似ている|216||
5072|ni tai suru, にたいする, toward, respective to|ni tai suru|にたいする|6742||
5073|to dochira ga, とどちが, which of X and Y is most (characteristic) ?|to dochira ga|とどちが|217||
5074|no naka de ... ga ichiban, の中で...が一番, out of all the X, Y is the most (characteristic)|no naka de ... ga ichiban|の中で...が一番|218||
5075|yori ... hou ga, より...ほうが, Y more ... than X, hou ga, yori|yori ... hou ga|より...ほうが|219||
5076|yori, より, X less … than Y|yori|より|220||
5077|noto ... noto, のと...のと, between/of X and Y, which of, decision, decide|noto ... noto|のと...のと|221||
5078|yori mou sukoshi ..., よりもう少し, less X and a bit more Y|yori mou sukoshi ...|よりもう少し|222||
5079|you ni, ように, X seems to be like Y, X looks like Y, you na, appears to be, no you ni, no you na|you ni|ように|223|you na|
5080|you ni, そうな, X seems to be like Y, X looks like Y, appears to be|you ni|そうな|223||
5081|ato de, 後で, after X, ato, no ato de, の後で, no atto de, afterwards|ato de|後で|224||
5082|mae ni, 前に, before X, no mae ni, の前に|mae ni|前に|225||
5083|te, て, X and then Y, afterwards|te|て|226||
5084|sorekara, それから, X and then Y, afterwards|sorekara|それから|227||
5085|soshite, 然して, X and then Y, and, and then, thus, and now, and finally, soushite, 然うして, soushite, thus|soshite|然して|228;8978|soushite, 然うして|
5086|sara ni, さらに, furthermore, again, after all, more and more, moreover, even more|sara ni|さらに|229||
5087|shikamo, しかも, moreover, furthermore, nevertheless, and yet|shikamo|しかも|230||
5088|teite, ていて, X is being done (present progressive) while doing/being something, deite, teite|teite|ていて|231|deite|
5089|tete, てて, X is being done (present progressive) while doing/being something, dete, tete|tete|てて|232|dete|
5090|te iru, ている, X is being done (present progressive), X past action/event that is still relevant to the present, te iru, te imasu, de iru, de imasu|te iru|ている|233;234||
5091|te aru, てある, X has (already) been done, te aru, te arimasu, de aru, de arimasu|te aru|てある|235||
5092|te iku, て行く, X has been happening and will continue to happen, do/be X while moving away, do/be X then go somewhere, te iku, te ikimasu, de iku, de ikimasu|te iku|て行く|236;237;238||
5093|te oku, ておく, to do/be X preemptively, in preparation for, in advance, te oku, te okimasu, de oku, de okimasu, do preemptively, do in preparation for, do in advance|te oku|ておく|239||
5094|ttoku, っとく, to do/be X preemptively, in preparation for, in advance, ttoku, ttokimasu, preemptively, preparation|ttoku|っとく|240||
5095|te kara, てから, X and then Y, te kara, de kara, then, afterwards|te kara|てから|241||
5096|te kuru, て来る, to come to do/be X, do/be X while approaching, do/be X then come over, te kuru, te kimasu, de kuru, de kimasu|te kuru|て来る|242;243;244||
5097|te mo ii da, てもいいだ, X is possible, te mo ii da, te mo ii desu, de mo ii da, de mo ii desu, alright, may, permission|te mo ii da|てもいいだ|245||
5098|te wa ikenai, てはいけない, X is not permitted, te wa ikenai, te wa ikemasen, de wa ikenai, de wa ikemasen, not allowed, not permitted, forbidden, may not, prohibition|te wa ikenai|てはいけない|246||
5099|cha ikenai, ちゃいけない, X is not permitted, cha ikenai, te wa ikemasen, de wa ikenai, de wa ikemasen, not allowed, not permitted, forbidden, may not, prohibition|cha ikenai|ちゃいけない|247||
5100|te mo ii desu ka?, てもいいですか?, is it fine if (he) does/is X?, te mo ii desu ka?, mou ii da, is it ok, is it fine, is ok, is fine, is acceptable, permission, may I, may she, may he, may they, de mo ii desu ka|te mo ii desu ka?|てもいいですか?|248||
5101|te ageru, て上げる, (He) does/is X as a personal favor for someone, te ageru, te ageru, te agemasu, de ageru, de agemasu|te ageru|て上げる|249||
5102|te hoshii, てほしい, (I) want someone to do X, hope someone does X, te hoshii, te hoshii desu|te hoshii|てほしい|250||
5103|te kudasai, て下さい, please do X, to please do/be X, te kudasai, de kudasai|te kudasai|て下さい|251;252||
5104|te kurenai, て呉れない, would you please do X, te kurenai, de kurenai|te kurenai|て呉れない|253||
5105|te kuremasen ka, て呉れませんか, will you please do X, te kuremasen ka, de kuremasen ka|te kuremasen ka|て呉れませんか|6125||
5106|te itadakemasen ka, て呉れませんか, could you please do X, te itadakemasen ka, de itadakemasen ka|te itadakemasen ka|て呉れませんか|6126||
5107|te kureru, て呉れる, (He) does/is X as a favor for me, te kureru, te kuremasu, de kureru, de kuremasu|te kureru|て呉れる|254||
5108|te miru, て見る, do X and see what happens, te miru, te mimasu, de miru, de mimasu|te miru|て見る|255||
5109|te mitai da, て見たいだ, want to do X and see what happens, want to try doing X, te mitai da, te mitai desu, de mitai da, de mitai desu, te mitakatta, de mitakatta|te mitai da|て見たいだ|256||
5110|te moraeru, て貰えます, (He) can do/be X as a favor, te moraeru, te moraemasu, de moraeru, de moraemasu|te moraeru|て貰えます|257||
5111|te moraemasu ka, て貰えますか, could (you) do/be X (as a favor)?, te moraemasu ka, de moraemasu ka|te moraemasu ka|て貰えますか|258||
5112|te moreru to, て貰えると, if someone can do/be X as a favor, te moreru to, de moraeru to|te moreru to|て貰えると|259||
5113|te itadaku, ていただく, someone does/is X as a personal favor for someone else (polite), te itadaku|te itadaku|ていただく|6100||
5114|te goran, てご覧, please try to do/be X, te goran|te goran|てご覧|260||
5115|te morau, て貰う, someone does/is X as a personal favor for someone or for me, te morau, de moraimasu, de morau, de moraimasu|te morau|て貰う|261||
5116|te moraitai, て貰いたい, I want someone to do/be X (as a favor), te moraitai, de moraitai|te moraitai|て貰いたい|262||
5117|te sokonau, て損なう, I want someone to do/be X (as a favor), to fail to do/be X, te sokonau|te sokonau|て損なう|263;264||
5118|te moraitai n desu ga, て貰いたいんですが, would you please do/be X (as a favor), te moraitai n desu ga, de moraitai no desu ga, de moraitai n desu ga, de moraitai no desu ga|te moraitai n desu ga|て貰いたいんですが|265||
5119|te shimau, て仕舞う, (He has) completely finished doing/being X, (He) regrets doing/being X, te shimau, te shimau, te shimaimasu, de shimau, de shimaimasu|te shimau|て仕舞う|266;267||
5120|te shimatta, て仕舞った, did/was X and regret doing it, te shimatta, te shimaimashita, de shimatta, de shimaimashita|te shimatta|て仕舞った|268||
5121|cchimatta, っちまった, did/was X and regret doing it, cchimatta|cchimatta|っちまった|269||
5122|te sumimasen, てすみません, (He is) sorry to do/be X, te sumimasen|te sumimasen|てすみません|270||
5123|te bakari iru, ばかりいる, always doing X, te bakari iru, bakkari iru, bakashi iru, bakkashi iru, bakkari imasu, bakashi imasu, bakkashi imasu|te bakari iru|ばかりいる|271||
5124|te koto wa dekinai, ことはできない, (He) cannot make a X-ing, te koto wa dekinai, koto ha dekinai, koto ha dekimasen|te koto wa dekinai|ことはできない|272||
5125|te choudai, て頂戴, to do/be X as a favor for me, te choudai|te choudai|て頂戴|273||
5126|sou ni naru, そう, (He) almost does/is X, sou ni naru, sou ni narimasu|sou ni naru|そう|274||
5127|nasasou, なさそう, (He) doesn't seem to do/be X, nasasou, sou, sou ni nai, sou mo nai, doesn't look like, doesn't sound like, doesn't appear to be, apparently not, doesn't seem to be|nasasou|なさそう|275||
5128|eru, える, to be able to do/be X, eru|eru|える|276||
5129|eta, えた, to have been able to do/be X, eta|eta|えた|277||
5130|saseru, させる, to make someone do/de X (causative active), saseru|saseru|させる|278||
5131|koto ga dekiru, ことが出来る, to be able to do a X-ing, koto ga dekiru|koto ga dekiru|ことが出来る|279||
5132|koto, こと, A/an X-ing/X-ment, 事, koto, ru koto|koto|こと|280|事|
5133|koto ni kimeru, ことに決める, (He) has decided to do/be X, koto ni kimeru|koto ni kimeru|ことに決める|281||
5134|beki, べき, should X, must X, ought to X, beki|beki|べき|282||
5135|komu, 込む, to go into, to put into, to remain (seated), to be plunged into (silence), to do thoroughly, to do intently, to continue in the same state, komu|komu|込む|283||
5136|hajimeru, 始める, to start to do/be, hajimeru|hajimeru|始める|284||
5137|chau, ちゃう, (He has) completely finished doing/being X, chau|chau|ちゃう|285||
5138|chatta, ちゃった, did/was X and regret doing it, chatta, te shimaimashita, de shimatta, de shimaimashita|chatta|ちゃった|286||
5139|jau, じゃう, (He has) completely finished doing/being X, jau|jau|じゃう|285||
