Index|KEYWORDS|Roumaji construction|Kana construction|Meaning|Alternate Spellings|
6289|ataeru, 与える, give (esp. someone of lower status), bestow, grant, confer, present, award, provide, afford, offer, supply, assign, cause, pass (a variable a function)|ataeru|与える|5693||
6290|ronjiru, 論じる, argue, discuss, debate|ronjiru|論じる|5694||
6291|osameru, 収める, dedicate, make an offering, pay (fees), supply, store, finish, bring a close, restore (something its place), achieve (e.g. a result), 納める|osameru|収める|5695|納める|
6292|kaneru, 兼ねる, serve two or more functions or roles simultaneously, contain (or combine) two or more features, work in two or more jobs simultaneously (positions, etc.), do alongside, hesitate do something (out of consideration for others), think of the future (as well as the present)|kaneru|兼ねる|5696||
6293|ageru, 挙げる, earn (something desirable), give (an example, etc.), cite, summon up (all of one's energy, etc.), arrest, nominate, conduct (a ceremony, esp. a wedding)|ageru|挙げる|5697||
6294|ageru, 揚げる, deep-fry, summon (for geishas, etc.)|ageru|揚げる|5698||
6295|uttaeru, 訴える, raise, bring (someone's attention), appeal to, call for, complain, sue (a person), take someone court, resort (e.g. arms, violence)|uttaeru|訴える|5699||
6296|akogareru, 憧れる, long for, yearn after, admire, be attracted by, 憬れる, 憧憬れる|akogareru|憧れる|5700|憬れる, 憧憬れる|
6297|akiru, 飽きる, get tired of, lose interest in, have enough, 厭きる, 倦きる, 倦る|akiru|飽きる|5701|厭きる, 倦きる, 倦る|
6298|susumeru, 勧める, recommend, advise, encourage, offer (wine), 薦める, 奨める|susumeru|勧める|5702|薦める, 奨める|
6299|megumareru, 恵まれる, be blessed with, be rich in, abound in|megumareru|恵まれる|5703||
6300|afureru, 溢れる, overflow, brim over, flood|afureru|溢れる|5704||
6301|soroeru, 揃える, collect, gather, get together, complete (a collection), arrange, put in order, prepare, get ready, make uniform, make even, match|soroeru|揃える|5705||
6302|akirameru, 諦める, give up, abandon (hope, plans), resign oneself (to)|akirameru|諦める|5706||
6303|oboreru, 溺れる, drown, nearly drown, sink below the surface (of water), indulge in, lose one's head over something, wallow in|oboreru|溺れる|5707||
6304|yuderu, 茹でる, boil, 湯でる|yuderu|茹でる|5708|湯でる|
6305|dekiagaru, 出来上がる, be completed, be finished, be ready (e.g. serve or eat), be very drunk, 出来上る, でき上がる|dekiagaru|出来上がる|5709|出来上る, でき上がる|
6306|shouzuru, 生ずる, produce, yield, cause, result from, arise, be generated|shouzuru|生ずる|5710||
6307|kiseru, 着せる, put clothes on (someone), plate, gild, veneer, accuse (of some crime), give (a bad name)|kiseru|着せる|5711||
6308|kaeru, 代える, substitute|kaeru|代える|5712||
6309|kaeru, 替える, replace|kaeru|替える|5713||
6310|toriireru, 取り入れる, harvest, reap, take in, gather in, adopt, take in, gather in, adopt (e.g. idea), accept (e.g. advice), introduce, borrow (e.g. word), 採り入れる, 取入れる, 取りいれる|toriireru|取り入れる|5714;7990;7991|採り入れる, 取入れる, 取りいれる|
6311|atehameru, 当てはめる, apply, adapt, 当て嵌める|atehameru|当てはめる|5715|当て嵌める|
6312|aratameru, 革める, change, alter, revise, replace, reform, correct, mend, improve, do properly, do formally, 改める|aratameru|革める|5716|改める|
6313|aratameru, 検める, examine, check, inspect, 改める|aratameru|検める|5717|改める|
6314|fukumeru, 含める, include (in a group or scope), instruct, make one understand, include (a nuance), put in (an implication), put in (someone's) mouth, permeate with flavor|fukumeru|含める|5718||
6315|yoseru, 寄せる, come near, let someone approach, bring near, bring together, collect, gather, deliver (opinion, news, etc.), send (e.g. a letter), contribute, donate, let someone drop by, add (numbers), have feelings for (love, good will, trust, etc.), rely upon for a time, depend on, use as a pretext, put aside, press, push, force|yoseru|寄せる|5719||
6316|kokoroeru, 心得る, know, understand, be aware of, regard as, take for, consent, agree|kokoroeru|心得る|5720||
6317|maneru, 真似る, mimic, imitate|maneru|真似る|5721||
6318|sameru, 冷める, become cool (temperature), come down (fever), cool down (interest), abate, subside, dampen|sameru|冷める|5722||
6319|minareru, 見慣れる, become used seeing, be familiar with, 見馴れる, 見なれる|minareru|見慣れる|5723|見馴れる, 見なれる|
6320|hedateru, 隔てる, separate (by distance, time, etc.), isolate, partition, divide, interpose, have between, alienate, estrange, 距てる|hedateru|隔てる|5724|距てる|
6321|ueru, 飢える, starve, thirst, be hungry, 餓える, 饑える|ueru|飢える|5725|餓える, 饑える|
6322|semeru, 攻める, attack, assault, assail|semeru|攻める|5726||
6323|ukeireru, 受け入れる, accept, receive, agree, 受入れる, 受け容れる, 受けいれる, 受容れる|ukeireru|受け入れる|5727|受入れる, 受け容れる, 受けいれる, 受容れる|
6324|chidimeru, 縮める, shorten, reduce, boil down, shrink|chidimeru|縮める|5728||
6325|osameru, 納める, dedicate, make an offering, pay (fees), supply, store, finish, bring a close, restore (something its place), achieve (e.g. a result), 収める|osameru|納める|5729|収める|
6326|koraeru, 堪える, bear, stand, endure, put up with, 怺える|koraeru|堪える|5730|怺える|
6327|taeru, 耐える, support, withstand, resist, brave, be fit for, be equal to, 堪える|taeru|耐える|5731|堪える|
6328|tsunageru, 繋げる, tie, fasten, connect, transfer (phone call)|tsunageru|繋げる|5732||
6329|tsubureru, 潰れる, be smashed, become useless, cease functioning, go bankrupt|tsubureru|潰れる|5733||
6330|kabuseru, 被せる, cover (with something), put on (e.g. on someone else's head), plate something (with a metal), pour or dash a liquid (on something), charge (a person with a guilt);|kabuseru|被せる|5734||
6331|naderu, 撫でる, brush gently, stroke, caress|naderu|撫でる|5735||
6332|akireru, 呆れる, be amazed, be shocked, be astonished, be astounded, be disgusted, 惘れる|akireru|呆れる|5736|惘れる|
6333|hameru, 嵌める, insert, put in (such that there is a snug fit), button, put on (something that envelopes, e.g. gloves, ring), have sex, fuck, pigeonhole (ina particular category), place a ring-shaped object around something (esp. one that restricts freedom, such as handcuffs), entrap, set someone up (i.e. frame them for a crime, etc.), 填める, 篏める|hameru|嵌める|5737|填める, 篏める|
6334|fuzakeru, 巫山戯る, romp, gambol, frolic, joke, make fun of, flirt, mess around, screw around, josh|fuzakeru|巫山戯る|5738||
6335|hikisageru, 引き下げる, pull down, lower, reduce, withdraw, 引下げる|hikisageru|引き下げる|5739|引下げる|
6336|sakaeru, 栄える, prosper, flourish|sakaeru|栄える|5740||
6337|haeru, 栄える, shine, look attractive, look pretty, 映える|haeru|栄える|5741|映える|
6338|kanaeru, 叶える, grant (request, wish), answer (prayer)|kanaeru|叶える|5742||
6339|kanaeru, 適える, fulfill (conditions), meet (requirements)|kanaeru|適える|5743||
6340|yurumeru, 緩める, loosen, slow down|yurumeru|緩める|5744||
6341|yasumeru, 休める, rest, suspend, give relief|yasumeru|休める|5745||
6342|katamukeru, 傾ける, incline, lean, tip, tilt, slant, bend, list, devote oneself to, concentrate on, pour one's energy into, ruin, squander, empty, drink (alcohol)|katamukeru|傾ける|5746||
6343|hikaeru, 控える, be temperate in, restrain oneself, hold back, make notes, be in preparation for, be in waiting for, be in a close relationship (e.g. as a backer, etc.), 扣える|hikaeru|控える|5747|扣える|
6344|komeru, 込める, load (a gun, etc.), charge, put in(e.g. emotion, effort), include (e.g. tax in a sales price), 籠める, 篭める, 罩める|komeru|込める|5748|籠める, 篭める, 罩める|
6345|komeru, 込める, hang over, shroud, enshroud, envelop, screen, 籠める, 篭める, 罩める|komeru|込める|5749|籠める, 篭める, 罩める|
6346|toritsukeru, 取り付ける, furnish, install, get someone's agreement, patronize, buy usually from the same store, 取りつける, 取付ける|toritsukeru|取り付ける|5750|取りつける, 取付ける|
6347|uketomeru, 受け止める, catch, stop the blow, react to, take, 受けとめる|uketomeru|受け止める|5751|受けとめる|
6348|fukameru, 深める, deepen, heighten, intensify|fukameru|深める|5752||
6349|totonoeru, 整える, put in order, arrange, adjust, get ready, prepare, raise money, 調える, 斉える|totonoeru|整える|5753|調える, 斉える|
6350|kumiawaseru, 組み合わせる, join together, combine, join up, 組合わせる, 組み合せる, 組合せる|kumiawaseru|組み合わせる|5754|組合わせる, 組み合せる, 組合せる|
6351|tenjiru, 転じる, turn, shift, alter, distract|tenjiru|転じる|5755||
6352|fumaeru, 踏まえる, be based on, have origin in|fumaeru|踏まえる|5756||
6353|uzumeru, 埋める, cover, bury (e.g. one's face in hands), submerge, fill (completely), stuff, pack, cram, fill up, 填める|uzumeru|埋める|5757|填める|
6354|toiawaseru, 問い合わせる, enquire, inquire, seek information, 問合わせる, 問合せる, 問い合せる|toiawaseru|問い合わせる|5758|問合わせる, 問合せる, 問い合せる|
6355|soeru, 添える, garnish, accompany (as a card does a gift), add as support, prop up, accompany (as an aid, guide, translator, etc.), mimic, imitate (archaic), draw something near oneself, approach nearby (archaic), 副える|soeru|添える|5759|副える|
6356|hikiageru, 引き上げる, pull up, drag up, lift up, increase, raise (e.g. taxes), withdraw, leave, pull out, retire, return home, 引上げる, 引き揚げる, 引揚げる|hikiageru|引き上げる|5760|引上げる, 引き揚げる, 引揚げる|
6357|ikeru, 行ける, be good (at), go well, look good, taste good|ikeru|行ける|5761||
6358|osaeru, 押える, pin something down, hold something down, hold something back, stop, restrain, curb, seize, grasp, arrest, catch happening, determine (important points), find (proof), understand, 押さえる|osaeru|押える|5762|押さえる|
6359|osaeru, 抑える, gain control of something, govern, keep down (e.g. information), suppress|osaeru|抑える|5763||
6360|yaseru, 瘠せる, become thin, lose weight, reduce (one's) weight, slim, be barren, be infertile, be sterile, 瘠せる, 痩る, 瘠る, 瘦せる|yaseru|瘠せる|5764|瘠せる, 痩る, 瘠る, 瘦せる|
6361|oikakeru, 追いかける, chase, run after, pursue, 追い掛ける, 追掛ける|oikakeru|追いかける|5765|追い掛ける, 追掛ける|
6362|shikaritsukeru, 叱り付ける, rebuke, scold harshly, 叱りつける|shikaritsukeru|叱り付ける|5766|叱りつける|
6363|seshimeru, せしめる, cheat someone out of, wangle|seshimeru|せしめる|5767||
6364|shinzuru, 信ずる, believe, place trust in, confide in, have faith in|shinzuru|信ずる|5768||
6365|ouzuru, 応ずる, answer, respond, meet, satisfy, accept|ouzuru|応ずる|5769||
6366|yobareru, 呼ばれる, be called (a name), be referred (as), be treated something (e.g. a meal), be invited to|yobareru|呼ばれる|5770||
6367|fuujiru, 封じる, seal (letter), prevent, forbid, block, prevent, forbid, block|fuujiru|封じる|5771;8175||
6368|tawamureru, 戯れる, be playful, gambol, be amused, play, sport, frolic, joke|tawamureru|戯れる|5772||
6369|osowareru, 襲われる, be tormented (by dreams), have a nightmare|osowareru|襲われる|5773||
6370|urotaeru, 狼狽える, be flustered, lose one's presence of mind, go crzy, go mad|urotaeru|狼狽える|5774||
6371|tsukitateru, 突き立てる, pierce, thrust violently|tsukitateru|突き立てる|5775||
6372|michiru, 満ちる, be full, wax (e.g. moon), rise (e.g. tide), mature, expire, 充ちる, 盈ちる|michiru|満ちる|5776|充ちる, 盈ちる|
6373|yowarihateru, 弱り果てる, be exhausted, be at a loss, be worn out, be helpless|yowarihateru|弱り果てる|5777||
6374|amaeru, 甘える, behave like a spoiled child, fawn on, take advantage of, presume upon, depend on|amaeru|甘える|5778||
6375|ukeru, 受ける, receive, get, catch (e.g. a ball), be struck by (wind, waves, sunlight, etc.), sustain (damage), incur (a loss), suffer (an injury), feel (influence), undergo (e.g. surgery), take (a test), accept (a challenge), be given (e.g. life, talent)esp. 受ける, 享ける, follow, succeed, be descended fromesp. 受ける, 享ける, face (south, etc.), be modified bylinguistics terminology, esp. 受ける, 承ける, obtain (a pawned item, etc.) by paying a fee, 享ける, 請ける, 承ける|ukeru|受ける|5779;6443;6444;6445;6446;6447;6448;6449;6450;6451|享ける, 請ける, 承ける|
6376|ukeru, 受ける, be well-received, become popular, go down well, be funny, be humorous, ウケる|ukeru|受ける|6452;6453|ウケる|
6377|miwakeru, 見分ける, distinguish, recognize, recognise, tell apart, differentiate, identify, 見わける|miwakeru|見分ける|5780|見わける|
6378|uchitomeru, 打ち止める, hammer inplace, end a performance, 打ち留める, 打止める, 打留める|uchitomeru|打ち止める|5781|打ち留める, 打止める, 打留める|
6379|uchitomeru, 撃ち止める, kill with a gun, slay, shoot dead, 撃止める|uchitomeru|撃ち止める|5782|撃止める|
6380|uchitomeru, 討ち止める, kill with a blade, slay, cut down, 討止める|uchitomeru|討ち止める|5783|討止める|
6381|butsukeru, 打付ける, knock, run into, nail on, strike hard, hit and attack, try (an idea) on someone, 撃止める|butsukeru|打付ける|5784|撃止める|
6382|uchiawaseru, 打ち合わせる, knock together, arrange (a meeting), knock together, strike against each other, arrange (e.g. a meeting), discuss (in advance), 打ち合せる, 打合せる, 打合わせる|uchiawaseru|打ち合わせる|5785;8563;8564|打ち合せる, 打合せる, 打合わせる|
6383|uchiageru, 打ち上げる, launch, shoot up, (of waves) dash, wash up (ashore), finish (e.g. a theater run, sumo tournament), close, report (boss, etc.), 打上げる, 打ち揚げる, 打揚げる|uchiageru|打ち上げる|5786|打上げる, 打ち揚げる, 打揚げる|
6384|uchiakeru, 打ち明ける, be frank, speak one's mind, open one's heart, confide, reveal, disclose, lay bare, speak frankly, open (one's heart), 打明ける|uchiakeru|打ち明ける|5787;8559|打明ける|
6385|uchitokeru, 打ち解ける, open one's heart, throw off reserve, be frank, 打解ける|uchitokeru|打ち解ける|5788|打解ける|
6386|uchihishigareru, 打ち拉がれる, be stricken (e.g. with grief), be battered (e.g. by disasters), 打ちひしがれる|uchihishigareru|打ち拉がれる|5789|打ちひしがれる|
6387|uchitateru, 打ち立てる, establish, formulate|uchitateru|打ち立てる|5790||
6388|haneru, 撥ねる, hit (e.g. with a car), run into, reject, deny, refuse, eliminate, exclude, leave out, flip, splash, splatter, point or curl up (e.g. ends of hair)|haneru|撥ねる|5791||
6389|haneru, 刎ねる, decapitate, behead|haneru|刎ねる|5792||
6390|haneru, 跳ねる, jump, leap, prance, spring up, bound, hop|haneru|跳ねる|5793||
6391|tereru, 照れる, be shy, be bashful, feel awkward, feel embarrassed|tereru|照れる|5794||
6392|hanareru, 離れる, be separated, be apart, be distant, leave, go away, quit, give up, drift away from|hanareru|離れる|5795||
6393|hanareru, 放れる, get free, be freed, be released|hanareru|放れる|5796||
6394|minukeru, 見抜ける, be transparent, be penetrable|minukeru|見抜ける|5797||
6395|kakotsukeru, 託ける, use as an excuse, pretend that, make something the pretext for, 託つける|kakotsukeru|託ける|5798|託つける|
6396|sukaseru, 空かせる, feel hungry, get hungry|sukaseru|空かせる|5799||
6397|shitsudukeru, し続ける, continue do, persist in doing, shitsuzukeru|shitsudukeru|し続ける|5800|shitsuzukeru|
6398|barakeru, 散ける, unravel|barakeru|散ける|5801||
6399|anjiru, 案じる, be anxious, be concerned, ponder (anxiously), fear, investigate, consider, plan, 案ずる|anjiru|案じる|5802|案ずる|
6400|anjiru, 按じる, pat, rub, take a sword in one's hand, 按ずる|anjiru|按じる|5803|按ずる|
6401|maniawaseru, 間に合わせる, make do, manage (with something), make shift, get done on time|maniawaseru|間に合わせる|5804||
6402|matomeru, 纏める, collect, put together, integrate, consolidate, unify, sumarize, aggregate, bring a conclusion, finalize, settle, put in order, establish, decide|matomeru|纏める|5805||
6403|someru, 染める, dye, color, colour|someru|染める|5806||
6404|someru, 初める, begin to|someru|初める|5807||
6405|kakiageru, 書き上げる, write out or down, finish writing, 描き上げる|kakiageru|書き上げる|5808|描き上げる|
6406|hageru, 禿げる, lose hair, become bald, become bare, ハゲる|hageru|禿げる|5809|ハゲる|
6407|hageru, 剥げる, come off, be worn off, fade, discolor, discolour|hageru|剥げる|5810||
6408|awaseru, 合わせる, match (rhythm, speed), join together, unite, combine, add up, face (someone), connect, overlap, mix, 併せる, 合せる|awaseru|合わせる|5811|併せる, 合せる|
6409|okiwasureru, 置き忘れる, leave behind, misplace, forget|okiwasureru|置き忘れる|5812||
6410|okuritsukeru, 送り付ける, send, 送りつける|okuritsukeru|送り付ける|5813|送りつける|
6411|okurimukaeru, 送り迎える, send or drop off and later pick up or go meet|okurimukaeru|送り迎える|5814||
6412|okuritodokeru, 送り届ける, send to, deliver, escort home|okuritodokeru|送り届ける|5815||
6413|kokomiru, 試みる, try, test|kokomiru|試みる|5816||
6414|tsutomeru, 努める, endeavor, try, strive, make an effort, exert oneself, be diligent|tsutomeru|努める|5817||
6415|kokorogakeru, 心がける, keep in mind, bear in mind, try, aim to do, endeavor, endeavour, 心掛ける, 心懸ける|kokorogakeru|心がける|5818|心掛ける, 心懸ける|
6416|hakikaeru, 履き替える, change lower-body clothing (shoes, slippers, pants, skirt…), 履替える|hakikaeru|履き替える|5819|履替える|
6417|uttorisaseru, うっとりさせる, enchant, to enrapture, to enthrall, to enthral, to charm|uttorisaseru|うっとりさせる|5820||
6418|noriokureru, 乗り遅れる, miss (train, bus, …)|noriokureru|乗り遅れる|6095||
6419|wakeru, 分ける, divide (into), split (into), part, separate, divide up, classify, sort out, divide out, share, distribute, deal out, dish out, distinguish, discriminate, differentiate (between), break up (a fight), mediate, call a draw, tie, push one's way through (a crowd), sell|wakeru|分ける|6107;6108;6109;6110;6111;6112;6113||
6420|okikaeru, 置き換える, replace, move, change the position of|okikaeru|置き換える|6808||
6421|itameru, 炒める, to fry, saute, stir-fry, 煠める|itameru|炒める|6856|煠める|
6422|itameru, 痛める, hurt, injure, cause pain, to harm, damage, spoil, to worry, bother, be grieved over, afflict, to cause financial loss, hurt one's pocket, 傷める|itameru|痛める|6857;6858;6859;6860|傷める|
6423|itameru, 傷める, damage, impair, spoil|itameru|傷める|6861||
6424|itameru, 撓める, treat leather, sharkskin, etc. with glue and pound until hard|itameru|撓める|6862||
6425|kitaeru, 鍛える, forge, temper, drill, train, discipline|kitaeru|鍛える|7443;7444||
6426|enjiru, 演じる, perform (a play), play (a part), act (a part), commit (a blunder)|enjiru|演じる|7617||
6427|enzuru, 演ずる, perform, play|enzuru|演ずる|7619||
6428|hanashikakeru, 話しかける, address (someone), accost a person, talk (to someone), begin to talk, start a conversation|hanashikakeru|話しかける|7653;7654||
6429|mataseru, 待たせる, keep (a person) waiting|mataseru|待たせる|7820||
6430|shikakeru, 仕掛ける, start, begin, commence, challenge, pick (a fight), make (war), set (traps), plant (explosives), lay (mines), make a meld call|shikakeru|仕掛ける|7913;7914;7915;7916||
6431|togameru, 咎める, blame, reproach, censure, rebuke, reprove, find fault, take to task, criticize, criticise, question (a suspect), challenge, aggravate (an injury), be aggravated, get inflamed, prick (one's conscience)|togameru|咎める|7979;7980;7981;7982||
6432|toraeru, 捉える, catch, capture, seize, arrest, grab, catch hold of, grasp (e.g. meaning), perceive, capture (e.g. features), captivate, move (one's heart)|toraeru|捉える|7983;7984;7985||
6433|tsukeru, 漬ける, soak, seep, dip in, pickle|tsukeru|漬ける|8015;8016||
6434|wariateru, 割り当てる, assign, allot, allocate, divide among, distribute, prorate, apportion|wariateru|割り当てる|8616||
6435|warikiru, 割り切る, find a clear solution, come to a clean decision, give a clear explanation, divide|warikiru|割り切る|8621;8622||
6436|da, だ, there is, です|da|だ|5821|です|
6437|kuru, 来る, come|kuru|来る|5822||
6438|motte kuru, 持ってくる, bring something, 持って来る|motte kuru|持ってくる|5823|持って来る|
6439|tsurete kuru, 連れてくる, bring someone along, 連れて来る|tsurete kuru|連れてくる|5824|連れて来る|
6440|suru, 為る, do, wear (specifically shoes, accessories), request, make, 為る, できる|suru|為る|5825|為る, できる|
6441|kiko suru, 聞する, move (apartments)|kiko suru|聞する|5826||
6442|seichou suru, 成長する, grow up|seichou suru|成長する|5827||
6443|kekkon suru, 結婚する, get married|kekkon suru|結婚する|5828||
6444|ai suru, 愛する, love|ai suru|愛する|5829||
6445|choosen suru, 挑戦する, attemp, challenge|choosen suru|挑戦する|5830||
6446|taipu suru, タイプする, type|taipu suru|タイプする|5831||
6447|faakkusu suru, ファックスする, fax|faakkusu suru|ファックスする|5832||
6448|shoukai suru, 紹介する, introduce, goshoukai suru, ご紹介する|shoukai suru|紹介する|5833|goshoukai suru, ご紹介する|
6449|taizai suru, 滞在する, stay|taizai suru|滞在する|5834||
6450|chuumon suru, 注文する, order (something)|chuumon suru|注文する|5835||
6451|yoyaku suru, 予約する, reserve, book, order in advance|yoyaku suru|予約する|5836||
6452|onegai suru, おねがいする, ask (request)|onegai suru|おねがいする|5837||
6453|unten suru, 運転する, drive|unten suru|運転する|5838||
6454|tabi suru, 旅する, go on a long trip, travel|tabi suru|旅する|5839||
6455|meiwaku suru, 迷惑する, to be troubled (by), to be bothered (by), to be inconvenienced (by)|meiwaku suru|迷惑する|5840||
6456|shinyou suru, 信用する, trust|shinyou suru|信用する|5841||
6457|nyuugaku suru, 入学する, enter school|nyuugaku suru|入学する|5842||
6458|shusseki suru, 出席する, be present, attend|shusseki suru|出席する|5843||
6459|ho suru, 保する, guarantee|ho suru|保する|5844||
6460|kaku suru, 画する, draw (a line), demarcate, mark, divide, map out, plan|kaku suru|画する|5845||
6461|ka suru, 課する, levy, charge, assess, impose, assign|ka suru|課する|5846||
6462|sou suru, 相する, assess (often one's fate)|sou suru|相する|5847||
6463|fuku suru, 伏する, crouch, stoop, bend down, prostrate oneself, lie down, yield, submit, surrender, hide, conceal oneself|fuku suru|伏する|5848||
6464|ga suru, 臥する, lie down (in bed), take one's bed (archaic)|ga suru|臥する|5849||
6465|fairu suru, ファイルする, file|fairu suru|ファイルする|5850||
6466|kinyuu suru, 記入する, enter information, fill in/fill out a form|kinyuu suru|記入する|5851||
6467|daunroodo suru, ダウンロードする, download|daunroodo suru|ダウンロードする|5852||
6468|purinsuru, プリントする, print|purinsuru|プリントする|5853||
6469|shichaku suru, 試着する, try something on|shichaku suru|試着する|5854||
6470|benkyou suru, 勉強する, study|benkyou suru|勉強する|5855||
6471|ryougae suru, 両替する, exchange|ryougae suru|両替する|5856||
6472|shokuji suru, 食事する, to eat|shokuji suru|食事する|5857||
6473|kaimono suru, 買い物する, shop, 買物する|kaimono suru|買い物する|5858|買物する|
6474|jogingu suru, ジョギングする, jog|jogingu suru|ジョギングする|5859||
6475|pishari suru, ぴしゃりする, slam shut, splash|pishari suru|ぴしゃりする|5860||
6476|shigosuru, 仕事する, work|shigosuru|仕事する|5861||
6477|denwa suru, 電話する, make a call, ring, telephone|denwa suru|電話する|5862||
6478|ryokou suru, 旅行する, travel|ryokou suru|旅行する|5863||
6479|souji suru, 掃除する, cleaning, sweeping, dusting, scrubbing, 掃除をする|souji suru|掃除する|5864|掃除をする|
6480|sentaku suru, 洗濯する, do the laundry|sentaku suru|洗濯する|5865||
6481|kopii suru, コピーする, copy, make a copy|kopii suru|コピーする|5866||
6482|sanpo suru, 散歩する, take a walk|sanpo suru|散歩する|5867||
6483|memo suru, メモする, make a note|memo suru|メモする|5868||
6484|renshuu suru, 練習する, practice, exercise|renshuu suru|練習する|5869||
6485|soutai suru, 相対する, leave early|soutai suru|相対する|5870||
6486|bikkuri suru, 吃驚する, be surprised, be amazed, be frightened, be ashtonished, 喫驚する|bikkuri suru|吃驚する|5871|喫驚する|
